PARAGRAPH NUMBER	ENTITY TYPE	ENTITY	CO-OCCURRING NOUNS	CO-OCCURRING ADJECTIVES	CO-OCCURRING VERBS	VALENCE	AROUSAL	DOMINANCE	SENTENCE
1004	LOCATION	the kingdom	loss;husband;palace;supper		be;finish;bid;welcome;leave;have;govern;tell	5.80785714286	3.96357142857	5.60214285714	She bade him welcome to her palace, and when they had finished supper she told him of the loss of her husband, and how there was no one left to govern the kingdom but herself.
1005	PERSON	the prince	tale		ask;end;have	5.586	3.838	5.4	asked the prince when she had ended her tale.
1006	PERSON	the queen	background		answer;bring;have;keep	6.09714285714	4.17	5.71142857143	"Here," answered the queen, bringing forward the girl, whom she had hitherto kept in the background.
1006	PERSON	the girl	background		answer;bring;have;keep	6.09714285714	4.17	5.71142857143	"Here," answered the queen, bringing forward the girl, whom she had hitherto kept in the background.
1009	PERSON	the queen	consent;delay;betrothal;marriage;country;place	further;own	beg;take	5.54888888889	4.15333333333	5.28555555556	And without any further delay he begged the queen to consent to their betrothal, for the marriage must take place in his own country.
1010	PERSON	the prince	nothing;couple;lineik	firm;wrong;sure;young	be;wish;travel;think;take;go;make	6.0925	4.17125	5.67125	Indeed she wished to travel with the young couple, to make sure that nothing should go wrong; but here the prince was firm, that he would take no one with him but Laufer, whom he thought was Lineik.
1010	PERSON	Laufer	nothing;couple;lineik	firm;wrong;sure;young	be;wish;travel;think;take;go;make	6.0925	4.17125	5.67125	Indeed she wished to travel with the young couple, to make sure that nothing should go wrong; but here the prince was firm, that he would take no one with him but Laufer, whom he thought was Lineik.
1011	LOCATION	Greece	sky;adventure;sea	clear;more	put;be;arrive;do	6.29888888889	3.77777777778	5.94333333333	This was done, and as the sky was now clear they put out to sea, and arrived in Greece without any more adventures.
1012	PERSON	The prince	tree;room	own	go;be;order;bring	6.09714285714	3.86714285714	5.46714285714	The prince then went to his own rooms and ordered that the trees should be brought in to him.
1014	PERSON	Laufer	sister;lineik		pray;be;weep;call;help	5.82285714286	3.87428571429	5.62	"Lineik, my sister," he called, softly, "Laufer is weeping; help her, I pray you."
1015	PERSON	Lineik	home;wrong;mother		do;forget;be;owe;have;answer;banish	5.37454545455	4.15090909091	5.14545454545	"Have you forgotten the wrongs her mother did to us" answered Lineik, "and that it is owing to her that we are banished from home?"
1016	PERSON	Lineik	tree;dress	quick;blue;safe;clever	be;return;embroider;weave	6.29076923077	3.77384615385	5.89384615385	So quick and clever was she that the blue dress was not only woven but embroidered, and Lineik was safe back in her tree before the prince returned.
1016	PERSON	the prince	tree;dress	quick;blue;safe;clever	be;return;embroider;weave	6.29076923077	3.77384615385	5.89384615385	So quick and clever was she that the blue dress was not only woven but embroidered, and Lineik was safe back in her tree before the prince returned.
1017	LOCATION	the room	stuff;bow	sure;richer;red;low	leave;be	5.58571428571	3.68	5.41142857143	"And I am sure that the red one will be still better, because the stuff is richer," and with a low bow he left the room.
1018	PERSON	the prince	tree		be;come;glide;do	6.06	3.845	5.67166666667	When it was done she glided into her tree just as the prince came in.
1020	PERSON	the prince	flower;stitch;time	last;long	put;be;come;take	5.58454545455	3.86909090909	5.40545454545	But it took a long time, and on the third morning, just as she was putting the last stitches into the last flower the prince came in.
1021	PERSON	Lineik	silk;tree	round	catch;try;be;get;jump;fold;have;fall;wrap	5.74058823529	3.74588235294	5.42411764706	Lineik jumped up quickly, and tried to get past him back to her tree; but the folds of the silk were wrapped round her, and she would have fallen had not the prince caught her.
1021	PERSON	the prince	silk;tree	round	catch;try;be;get;jump;fold;have;fall;wrap	5.74058823529	3.74588235294	5.42411764706	Lineik jumped up quickly, and tried to get past him back to her tree; but the folds of the silk were wrapped round her, and she would have fallen had not the prince caught her.
1023	PERSON	the prince	lie;death;punishment	shameful;wicked	end;die;turn;have;deserve;declare	4.14357142857	4.85571428571	4.73857142857	When she had ended the prince turned angrily to Laufer, and declared that, as a punishment for her wicked lies, she deserved to die a shameful death.
1023	PERSON	Laufer	lie;death;punishment	shameful;wicked	end;die;turn;have;deserve;declare	4.14357142857	4.85571428571	4.73857142857	When she had ended the prince turned angrily to Laufer, and declared that, as a punishment for her wicked lies, she deserved to die a shameful death.
1025	LOCATION	the country	ogress;courtier;people;ogre;disappearance	rid	be;account;get;have;cause;eat;hope;fill	5.79117647059	3.91588235294	5.64470588235	It was she who had caused the disappearance of the courtiers, for which no one could account, by eating them during the night, and she hoped to get rid of all the people in the country, and then to fill the land with ogres and ogresses like herself.
1025	LOCATION	the land	ogress;courtier;people;ogre;disappearance	rid	be;account;get;have;cause;eat;hope;fill	5.79117647059	3.91588235294	5.64470588235	It was she who had caused the disappearance of the courtiers, for which no one could account, by eating them during the night, and she hoped to get rid of all the people in the country, and then to fill the land with ogres and ogresses like herself.
1026	LOCATION	Greece	prince		march	5.5	3.69	4.88666666667	Afterwards the two princes marched back to Greece.
1027	PERSON	Laufer	nobleman;sister;couple;husband;friend	great	die;remain;live;find	6.14230769231	4.41	5.63769230769	And Laufer remained with Lineik as her friend and sister, till they found a husband for her in a great nobleman; and all three couples lived happily until they died.
1027	PERSON	Lineik	nobleman;sister;couple;husband;friend	great	die;remain;live;find	6.14230769231	4.41	5.63769230769	And Laufer remained with Lineik as her friend and sister, till they found a husband for her in a great nobleman; and all three couples lived happily until they died.
1028	PERSON	Islandische Muhrchen Poestion Wien				5.0	5.0	5.0	[From Islandische Muhrchen Poestion Wien.]
1032	PERSON	The man	sort;head;stone;thief;foe;trap		capture;get;be;strike;kill;lay;fall;catch;happen	4.80473684211	4.35263157895	4.91473684211	The man laid all sorts of traps to catch the thief, but instead of capturing the foe, it happened that one day he got caught himself, and falling down, struck his head against a stone, and was killed.
1036	PERSON	the man		heavy;whole	be;draw;have;sup	5.5825	3.69	5.465	Besides, when the whole six had supped off the man he was not so heavy to draw.
1039	LOCATION	the rocks	marten;squirrel;tree;lightning;time;hole;size	quick;next	be;run;remember;slip;think	5.909375	4.173125	5.216875	But the squirrel ran up a tree like lightning, and the marten remembering, just in time, that he was the next in size, slipped quick as thought into a hole in the rocks.
1041	LOCATION	the wood	nothing;hare;bear;paw	smallest	be;repeat;stretch;dart;have;touch;eat	5.72473684211	3.91842105263	5.51	"We must eat the smallest of us," repeated the bear, stretching out a paw towards the hare; but the hare was not a hare for nothing, and before the paw had touched her, she had darted deep into the wood.
1042	LOCATION	the way	wolf;dinner;fox;companion	big;next	be;whisper;manage;eat;have;tell;trot	5.85235294118	4.05235294118	5.58470588235	The fox trotted cheerfully by his two big companions, but on the way he managed to whisper to the wolf: "Tell me, Peter, when I am eaten, what will you have for your next dinner?"
1042	PERSON	Peter	wolf;dinner;fox;companion	big;next	be;whisper;manage;eat;have;tell;trot	5.85235294118	4.05235294118	5.58470588235	The fox trotted cheerfully by his two big companions, but on the way he managed to whisper to the wolf: "Tell me, Peter, when I am eaten, what will you have for your next dinner?"
1047	LOCATION	the tree	something	last	stare;do;begin;hit;sit;think	5.63111111111	3.89	5.81444444444	At last he hit upon something which he thought would do, and accordingly he sat down near the tree and began to stare hard at it.
1050	LOCATION	the tree	head;tree;fox;one;snow-shoe;side	such;ill-natured;good;young;easy	be;like;do;seek;make;give;gaze;answer;cock;find	6.12827586207	3.75379310345	5.86689655172	"It will not be easy to find another tree that would make such good snow-shoes," answered the fox, cocking his head on one side, and gazing at the tree thoughtfully; "but I do not like to be ill-natured, so if you will give me one of your young ones I will seek my snow-shoes elsewhere."
1051	PERSON	Michael	heart;fox;tree;magpie;pang;hole	dreadful;same	shoot;be;sit;see;have;peep	5.37555555556	4.10666666667	4.975	Why, a few days later, Michael the fox might have been seen sitting under the very same tree, and a dreadful pang shot through the heart of the magpie as he peeped at him from a hole in the nest.
1051	LOCATION	the nest	heart;fox;tree;magpie;pang;hole	dreadful;same	shoot;be;sit;see;have;peep	5.37555555556	4.10666666667	4.975	Why, a few days later, Michael the fox might have been seen sitting under the very same tree, and a dreadful pang shot through the heart of the magpie as he peeped at him from a hole in the nest.
1056	LOCATION	the nest	spite;people;one;thought;magpie;time;wisdom	poor;little;cleverer;able;much;other	oblige;be;console;throw;have	5.91888888889	3.67222222222	5.5	And the poor magpie, in spite of his wisdom, was obliged to throw another of his little ones out of the nest; and this time he was not able to console himself with the thought that he had been much cleverer than other people.
1080	LOCATION	the door	fox;storehouse	last	go;call	5.8625	3.925	5.635	At last he went to the door of the storehouse, and called to the fox:
1087	PERSON	Piro	count;boy;into;beggar		turn	5.025	3.545	5.1775	How The Beggar Boy Turned Into Count Piro
1091	PERSON	the boy			ask	5.895	3.795	5.895	asked the boy.
1092	PERSON	the king	palace;fox;s;mouth;way;basket		make;trot;thank;take	5.84083333333	4.08916666667	5.55666666667	The fox thanked him, and, taking the basket in his mouth, trotted off to the king"s palace and made his way straight to the king.
1092	PERSON	the king	palace;fox;s;mouth;way;basket		make;trot;thank;take	5.84083333333	4.08916666667	5.55666666667	The fox thanked him, and, taking the basket in his mouth, trotted off to the king"s palace and made his way straight to the king.
1093	PERSON	the king	basket;pear;master;foot;majesty	few;best	say;accept;beg;send;lay	5.71692307692	3.80538461538	5.67307692308	"Your Majesty, my master sends you a few of his best pears, and begs you will graciously accept them," he said, laying the basket at the feet of the king.
1094	PERSON	the king	pray;master		peer;be;cry;look	5.61142857143	4.11285714286	5.18142857143	cried the king, peering down to look at them; "and, pray, who is your master?"
1096	PERSON	the king			ask	5.975	3.965	5.91	asked the king.
1098	PERSON	the king			say	5.955	4.44	6.205	said the king.
1101	LOCATION	the cottage	basket;tale;youth;fox	pleased;empty	be;do;hear;seem;tell;trot	5.76933333333	3.526	5.49066666667	He trotted back to the cottage with his empty basket and told his tale, but the youth did not seem as pleased to hear as the fox was to tell.
1107	LOCATION	the palace	mouth		trot;pick	5.8075	4.3825	5.7475	Then he picked it up in his mouth, and trotted off to the palace.
1108	PERSON	Count Piro	respects;majesty;pear;s;master;basket	humble	bring;seem;say;like;have	6.07285714286	3.97142857143	5.66714285714	"Your Majesty, as you seemed to like the first basket of pears, I have brought you some more," said he, "with my master, the Count Piro"s humble respects."
1109	PERSON	the king			cry	4.61	4.95	4.045	cried the king.
1112	PERSON	Piro	count;anything;hand		ask;dream	6.45333333333	3.89333333333	5.73666666667	The Count Piro would not dream of asking anything but the hand of the princess."
1112	PERSON	the princess	count;anything;hand		ask;dream	6.45333333333	3.89333333333	5.73666666667	The Count Piro would not dream of asking anything but the hand of the princess."
1113	PERSON	the king			ask	5.975	3.965	5.91	asked the king.
1115	PERSON	the king			say;come;beg;talk	5.57666666667	3.945	5.65	"Well, beg him to come here, that we may talk together," said the king.
1116	PERSON	the king	daughter;marriage;fox;man	young	be;ask;say;have;go;tell	5.90875	4.0125	5.514375	So the fox went back to the young man and said: "I have told the king that you are Count Piro, and have asked his daughter in marriage."
1116	PERSON	Count Piro	daughter;marriage;fox;man	young	be;ask;say;have;go;tell	5.90875	4.0125	5.514375	So the fox went back to the young man and said: "I have told the king that you are Count Piro, and have asked his daughter in marriage."
1117	PERSON	the king	youth;dismay;head		be;see;cry;cut;order	5.2	4.07545454545	5.16545454545	cried the youth in dismay; "when the king sees me he will order my head to be cut off."
1118	LOCATION	the town	tailor	best	go;stop	5.824	4.074	5.688	And he went off to the town, and stopped at the house of the best tailor.
1118	LOCATION	the house	tailor	best	go;stop	5.824	4.074	5.688	And he went off to the town, and stopped at the house of the best tailor.
1119	LOCATION	the shop	horse;string;fox;tooth;s;tailor;master;horse-dealer;silver;round;parcel	beautiful;white;finest	bid;send;leave;go;say;persuade;choose;have;carry;tie	5.74483870968	4.06161290323	5.62161290323	The fox chose out a beautiful one of white and silver, bade the tailor tie it up in a parcel, and carrying the string in his teeth, he left the shop, and went to a horse-dealer"s, whom he persuaded to send his finest horse round to the cottage, saying that the king had bidden his master to the palace.
1119	LOCATION	the cottage	horse;string;fox;tooth;s;tailor;master;horse-dealer;silver;round;parcel	beautiful;white;finest	bid;send;leave;go;say;persuade;choose;have;carry;tie	5.74483870968	4.06161290323	5.62161290323	The fox chose out a beautiful one of white and silver, bade the tailor tie it up in a parcel, and carrying the string in his teeth, he left the shop, and went to a horse-dealer"s, whom he persuaded to send his finest horse round to the cottage, saying that the king had bidden his master to the palace.
1119	PERSON	the king	horse;string;fox;tooth;s;tailor;master;horse-dealer;silver;round;parcel	beautiful;white;finest	bid;send;leave;go;say;persuade;choose;have;carry;tie	5.74483870968	4.06161290323	5.62161290323	The fox chose out a beautiful one of white and silver, bade the tailor tie it up in a parcel, and carrying the string in his teeth, he left the shop, and went to a horse-dealer"s, whom he persuaded to send his finest horse round to the cottage, saying that the king had bidden his master to the palace.
1119	LOCATION	the palace	horse;string;fox;tooth;s;tailor;master;horse-dealer;silver;round;parcel	beautiful;white;finest	bid;send;leave;go;say;persuade;choose;have;carry;tie	5.74483870968	4.06161290323	5.62161290323	The fox chose out a beautiful one of white and silver, bade the tailor tie it up in a parcel, and carrying the string in his teeth, he left the shop, and went to a horse-dealer"s, whom he persuaded to send his finest horse round to the cottage, saying that the king had bidden his master to the palace.
1120	PERSON	the king	coat;horse;fox;man	young	put;meet;mount;run;ride	5.81363636364	4.25454545455	5.73545454545	Very unwillingly the young man put on the coat and mounted the horse, and rode up to meet the king, with the fox running before him.
1123	PERSON	The princess		dumb	be;seat	5.57714285714	3.69714285714	5.45571428571	The princess was already seated at the table, but was as dumb as Count Piro himself.
1123	LOCATION	the table		dumb	be;seat	5.57714285714	3.69714285714	5.45571428571	The princess was already seated at the table, but was as dumb as Count Piro himself.
1123	PERSON	Count Piro		dumb	be;seat	5.57714285714	3.69714285714	5.45571428571	The princess was already seated at the table, but was as dumb as Count Piro himself.
1124	PERSON	The king	leave;dinner;fox	satisfied	be;finish;take	5.89555555556	3.90555555556	5.63888888889	The king was quite satisfied, and they finished dinner, after which Count Piro and the fox took leave.
1124	PERSON	Count Piro	leave;dinner;fox	satisfied	be;finish;take	5.89555555556	3.90555555556	5.63888888889	The king was quite satisfied, and they finished dinner, after which Count Piro and the fox took leave.
1128	PERSON	the king	pear;fox;end;luck		do;pluck;leave;bring;see;take;answer;tell	5.43823529412	4.10411764706	5.61294117647	"Oh, leave it to me, and do as I tell you, and you will see that in the end it will bring you luck," answered the fox; and plucking the pears he took them up to the king.
1129	PERSON	Count Piro	answer;pear;proposal;master		ask;say;send	5.87777777778	3.94777777778	5.74888888889	"My master, Count Piro, sends you these pears," he said, "and asks for an answer to his proposal."
1130	PERSON	the king	count;fox;place;wedding;message;pride		deliver;please;take;answer;trot;tell;fill	5.85666666667	4.04066666667	5.798	"Tell the count that the wedding can take place whenever he pleases," answered the king, and, filled with pride, the fox trotted back to deliver his message.
1133	LOCATION	the palace	preparation;youth;wedding	grand	be;make;marry	6.36909090909	4.37454545455	5.60727272727	And up at the palace preparations were made for a grand wedding, and the youth was married to the princess.
1133	PERSON	the princess	preparation;youth;wedding	grand	be;make;marry	6.36909090909	4.37454545455	5.60727272727	And up at the palace preparations were made for a grand wedding, and the youth was married to the princess.
1134	PERSON	the king	bride;castle;master;home	own;young	wish;say;feast;take	6.15076923077	4.32461538462	5.74615384615	After a week of feasting, the fox said to the king: "My master wishes to take his young bride home to his own castle."
1135	LOCATION	the plain	fox	little	ride;set;run	5.75666666667	4.16	5.53666666667	So they all set out, and rode across the plain, the little fox running before them.
1138	PERSON	the king			come	5.82	4.01	5.735	Very soon the king came up.
1140	PERSON	Piro	count;shepherd;s		answer;do;know	5.85285714286	3.67285714286	5.64285714286	"Count Piro"s," answered the shepherd, who did not know the king.
1140	PERSON	the king	count;shepherd;s		answer;do;know	5.85285714286	3.67285714286	5.64285714286	"Count Piro"s," answered the shepherd, who did not know the king.
1141	PERSON	the king	son-in-law;man	such;rich;wealthy	be;rejoice;think;have	6.00090909091	4.69909090909	5.82	"Well, he must be a very rich man," thought the king to himself, and rejoiced that he had such a wealthy son-in-law.
1146	PERSON	the king			ride	6.135	4.775	5.405	Soon after the king rode up.
1148	PERSON	Piro	count;s;swineherd;son-in-law	such;lucky;rich	do;be;feel;know;have;answer	6.05230769231	4.24769230769	5.63230769231	"Count Piro"s," answered the swineherd, who did not know the king; and again the king felt he was lucky to have such a rich son-in-law.
1148	PERSON	the king	count;s;swineherd;son-in-law	such;lucky;rich	do;be;feel;know;have;answer	6.05230769231	4.24769230769	5.63230769231	"Count Piro"s," answered the swineherd, who did not know the king; and again the king felt he was lucky to have such a rich son-in-law.
1148	PERSON	the king	count;s;swineherd;son-in-law	such;lucky;rich	do;be;feel;know;have;answer	6.05230769231	4.24769230769	5.63230769231	"Count Piro"s," answered the swineherd, who did not know the king; and again the king felt he was lucky to have such a rich son-in-law.
1149	PERSON	the man			ask;be;watch	5.75	3.66	5.945	he asked of the man who was watching them.
1152	PERSON	the king			ride	5.6925	4.5775	4.995	In a few minutes the king rode up.
1154	PERSON	Count Piro	heart;s;son-in-law	good;rich	do;be;belong;leap;know;answer;think	6.096875	4.15625	5.6775	Count Piro"s," answered the man, who did not know the king; and the king"s heart leapt as he thought that if they belonged to his rich son-in-law they were as good as his.
1154	PERSON	the man	heart;s;son-in-law	good;rich	do;be;belong;leap;know;answer;think	6.096875	4.15625	5.6775	Count Piro"s," answered the man, who did not know the king; and the king"s heart leapt as he thought that if they belonged to his rich son-in-law they were as good as his.
1154	PERSON	the king	heart;s;son-in-law	good;rich	do;be;belong;leap;know;answer;think	6.096875	4.15625	5.6775	Count Piro"s," answered the man, who did not know the king; and the king"s heart leapt as he thought that if they belonged to his rich son-in-law they were as good as his.
1154	PERSON	the king	heart;s;son-in-law	good;rich	do;be;belong;leap;know;answer;think	6.096875	4.15625	5.6775	Count Piro"s," answered the man, who did not know the king; and the king"s heart leapt as he thought that if they belonged to his rich son-in-law they were as good as his.
1155	LOCATION	the steps	tear;eye		cry;run;fall	4.69666666667	4.31833333333	4.93666666667	He ran up the steps, with tears falling from his eyes, and crying:
1158	PERSON	the king			be;kill;send	5.0425	4.53	5.145	They are sent by the king to kill you!"
1161	LOCATION	the door	thought;fox;ogre;oven;ogress	quick	do;bang;come;scramble	5.53363636364	4.23454545455	5.57727272727	The ogre and ogress scrambled into the oven as quick as thought, and the fox banged the door on them; just as he did so the king came up.
1161	PERSON	the king	thought;fox;ogre;oven;ogress	quick	do;bang;come;scramble	5.53363636364	4.23454545455	5.57727272727	The ogre and ogress scrambled into the oven as quick as thought, and the fox banged the door on them; just as he did so the king came up.
1162	LOCATION	the palace	count;piro		be	6.05666666667	3.46666666667	5.35666666667	"This is the palace of Count Piro!"
1166	PERSON	the princess	liking;fox;t;talk	little;great	don;die;cry;take;have;weep	5.22071428571	4.60357142857	5.05357142857	"Oh, little, little fox, don"t talk of dying," cried the princess, nearly weeping, for she had taken a great liking to the fox.
1167	PERSON	The princess	tear;knee;walk		be;burst;lie;see;fall;go	5.05636363636	4.48363636364	5.10272727273	The princess was just going out for a walk, and directly she saw him lying there, she burst into tears and fell on her knees beside him.
1169	LOCATION	the ditch	leg		take;throw	4.9475	3.9	5.4675	just take him by the leg and throw him into the ditch."
1171	PERSON	Count Piro	wife;coffin;silver		do;be;follow;make;die	4.927	4.078	5.133	And when he actually did die, his coffin was made of silver, and Count Piro and his wife followed him to the grave.
1171	LOCATION	the grave	wife;coffin;silver		do;be;follow;make;die	4.927	4.078	5.133	And when he actually did die, his coffin was made of silver, and Count Piro and his wife followed him to the grave.
1176	LOCATION	the door	house;length	large	knock;come	5.66857142857	4.06	5.61142857143	At length he came to a large house, at the door of which he knocked.
1178	PERSON	the man	work;chief;to-morrow;herdsman		do;be;give;know;have;reply	5.84133333333	3.96	5.64533333333	"That you shall have," replied the man; "but to-morrow I shall give you some work to do, for you must know that I am the chief herdsman of the king."
1178	PERSON	the king	work;chief;to-morrow;herdsman		do;be;give;know;have;reply	5.84133333333	3.96	5.64533333333	"That you shall have," replied the man; "but to-morrow I shall give you some work to do, for you must know that I am the chief herdsman of the king."
1186	LOCATION	the mountain	outskirts;father;youth;s;home;cottage;ravine;man	wild;narrow;young	do;run;reach;drive;have;go;grow	5.96954545455	4.12318181818	5.55409090909	This the young man did, but as soon as they reached the outskirts of the mountain they grew quite wild, and would have run away altogether, had they not luckily gone towards a narrow ravine, from which the youth easily drove them home to his father"s cottage.
1187	LOCATION	the door	surprise;son;man	old	ask;knock;have;leave	5.61636363636	4.09	5.43727272727	asked the old man in surprise, when his son knocked at the door of the hut he had left only the day before.
1187	LOCATION	the hut	surprise;son;man	old	ask;knock;have;leave	5.61636363636	4.09	5.43727272727	asked the old man in surprise, when his son knocked at the door of the hut he had left only the day before.
1192	LOCATION	the swamp	tail;hill;point	last	be;rush;drive;leave;collect;see;vanish	5.29928571429	3.93428571429	5.61142857143	At last, however, I collected them all and was about to drive them back, when suddenly they rushed down the hill into the swamp, where they vanished completely, leaving only the points of their tails, which you can see for yourself."
1204	LOCATION	the steps	herdsman;man	young	ask;run;pant	5.72833333333	4.01166666667	5.58333333333	asked the herdsman as the young man ran panting up the steps.
1215	PERSON	the king	treasure;horn;hoof;ox	careful;sure;gold-tipped;greatest	reckon;be;look;have	5.81733333333	3.70266666667	5.666	You must look after forty oxen, and be sure you are very careful, for one of them has gold-tipped horns and hoofs, and the king reckons it among his greatest treasures."
1217	LOCATION	the door	head;cow;herd;hut;animal;corner;son;round;man	great;own;old	dash;be;stand	5.61	3.76764705882	5.44352941176	The old man was standing before the door of his hut when the great herd of animals dashed round a corner of the road, with his son and his own cow at their head.
