PARAGRAPH NUMBER	ENTITY TYPE	ENTITY	CO-OCCURRING NOUNS	CO-OCCURRING ADJECTIVES	CO-OCCURRING VERBS	VALENCE	AROUSAL	DOMINANCE	SENTENCE
1411	LOCATION	the inn	sign-post;road;people		take;be;direct;have;tell	5.68666666667	3.75444444444	5.48222222222	There was no sign-post to direct them, and the people in the inn had not told them which of the two roads to take.
1412	LOCATION	the inn		better	think;have;stay	5.875	3.69833333333	5.695	"I think we had better have stayed at the inn."
1416	PERSON	Rasmus	stag		shoot;say;please;ve	5.285	4.94333333333	5.40666666667	"I"ve just shot a stag," said Rasmus, highly pleased with himself.
1418	LOCATION	the tree	trick;alarm;gun	little	play;resolve;get;watch;begin;slide	5.69923076923	4.25769230769	5.58384615385	After watching them for a little, however, he began to get over his alarm, and finally slid down the tree again, resolved to get his gun and play some tricks with them.
1419	PERSON	the giant	fork;bullet;point;gun;s;chin;mouth		go;strike;handle	4.99076923077	4.78	5.30692307692	went Niels" gun, and the bullet struck the handle of the fork so hard that the point went into the giant"s chin, instead of his mouth.
1427	PERSON	Niels	fun;gesture;talk	good	be;guess;hear;happen;think	6.513	3.965	6.002	Niels was too far away to hear their talk, but from their gestures he could guess what was happening, and thought it good fun.
1431	PERSON	the giant	enemy;bush;observation;ground	fast	be;hide;get;make;have;climb	5.49692307692	3.58461538462	5.43153846154	So well had the giant made his observations, that though Niels climbed down the tree as fast as he could, so as to hide among the bushes, he had just got to the ground when the enemy was upon him.
1431	PERSON	Niels	enemy;bush;observation;ground	fast	be;hide;get;make;have;climb	5.49692307692	3.58461538462	5.43153846154	So well had the giant made his observations, that though Niels climbed down the tree as fast as he could, so as to hide among the bushes, he had just got to the ground when the enemy was upon him.
1431	LOCATION	the tree	enemy;bush;observation;ground	fast	be;hide;get;make;have;climb	5.49692307692	3.58461538462	5.43153846154	So well had the giant made his observations, that though Niels climbed down the tree as fast as he could, so as to hide among the bushes, he had just got to the ground when the enemy was upon him.
1432	PERSON	the giant	foot;ll;t;stay		put;be;say;leave;win	5.56727272727	4.20454545455	5.95545454545	"Stay where you are," said the giant, "or I"ll put my foot on you, and there won"t be much of you left after that."
1433	PERSON	Niels	comrade		carry;give	6.174	3.996	5.648	Niels gave in, and the giant carried him back to his comrades.
1433	PERSON	the giant	comrade		carry;give	6.174	3.996	5.648	Niels gave in, and the giant carried him back to his comrades.
1435	PERSON	Niels			say	5.91	4.43	6.88	said Niels.
1438	PERSON	the giant	rampart;fear;grass;top	wide;feather-bed;long	come;be;say;cover;fall	5.22461538462	4.09923076923	5.60076923077	"No fear of that," said the giant; "the rampart is quite wide on the top, and covered with long grass, so that you will come down as softly as though you fell on a feather-bed."
1439	PERSON	Niels	spot;bark;mouth	dead	fire;be;open;fall	4.74125	4.09	4.86125	It was just opening its mouth to bark, when Niels fired, and it fell dead on the spot.
1440	PERSON	the giant	inside		go;say;open;see	5.96857142857	4.33714285714	6.20714285714	"Go down on the inside now," said the giant, "and see if you can open the gate to us."
1440	LOCATION	the gate	inside		go;say;open;see	5.96857142857	4.33714285714	6.20714285714	"Go down on the inside now," said the giant, "and see if you can open the gate to us."
1441	PERSON	Niels	inscription;rim;silver;letter;horn	closer;round	be;look;turn;see;take;have;engrave;go;find	5.71285714286	3.83928571429	5.545	Niels went closer to look at these, and saw that the horn had letters engraved on the silver rim: when he took it down and turned it round, he found that the inscription was:--
1448	PERSON	the princess	giant;right;love;son;thing;sheep-farmer;sword	poor	be;use;win;kill;think;hope	5.87842105263	4.72421052632	5.64789473684	To kill the giants, he thought, would be using the sword for the right; but as to winning the love of the princess, that was a thing which the son of a poor sheep-farmer need not hope for.
1449	PERSON	Niels	door	large;small;latter	be;come;find;open	5.76666666667	4.0675	5.61583333333	When Niels came to the gate of the castle, he found that there was a large door and a small one, so he opened the latter.
1449	LOCATION	the gate	door	large;small;latter	be;come;find;open	5.76666666667	4.0675	5.61583333333	When Niels came to the gate of the castle, he found that there was a large door and a small one, so he opened the latter.
1449	LOCATION	the castle	door	large;small;latter	be;come;find;open	5.76666666667	4.0675	5.61583333333	When Niels came to the gate of the castle, he found that there was a large door and a small one, so he opened the latter.
1454	PERSON	the princess	tale;word;none;traveller;giant	many;strange	be;say;tell;do	5.73916666667	4.02583333333	5.81083333333	This was done, and many strange tales were told to the princess, but none of the travellers said a word about the three giants.
1457	PERSON	The man	sole;middle;paper;shoe;foot;hole	thin	be;see;hold;wear	5.58642857143	3.64857142857	5.37928571429	The man held up his foot so that they could see the sole of his shoe; it was worn as thin as paper, and there was a hole in the middle of it.
1458	LOCATION	Rome	shoe	new	leave;be;say;look;tell	5.805	4.0	5.739	"These shoes were quite new when I left Rome," he said, "and look at them now; that will tell you whether you are far from it or not."
1459	LOCATION	the forest	end;sight;road	bad;longer	return;sleep;take;have;go;find	5.725	3.88428571429	5.265	What with the winter and bad roads they took longer to return than they had taken to go, but in the end they found themselves in sight of the forest where they had slept before.
1461	PERSON	Peter	s		be;say;let;stay	5.97666666667	3.71333333333	5.72833333333	"So it is," said Peter; "let"s stay all night in it."
1463	PERSON	the princess	s;story;time		get;rest;steward;hear;have;come	6.27	3.659	5.587	After they had got time to rest themselves, the princess"s steward came to hear their story.
1468	PERSON	Rasmus	stag;way		shoot;be;say;sleep	5.69846153846	3.99923076923	5.29	"Yes there is," said Rasmus; "when we were on our way south, we slept in the wood near here one night, and I shot a stag."
1468	LOCATION	the wood	stag;way		shoot;be;say;sleep	5.69846153846	3.99923076923	5.29	"Yes there is," said Rasmus; "when we were on our way south, we slept in the wood near here one night, and I shot a stag."
1469	PERSON	the princess	story;importance;use;steward;newcomer;nothing	much;accustomed	be;tell;report;hear;have;go;think	6.09714285714	3.95	5.49142857143	The steward was so much accustomed to hearing stories of no importance that he thought there was no use going further with this, but reported to the princess that the newcomers had nothing to tell.
1472	PERSON	the princess		careless	go;be;say;talk;get	5.90777777778	4.22	5.56111111111	"You are getting careless," said the princess; "I shall go and talk to them myself."
1473	PERSON	Niels	stag;something;sword		shoot;say;find;forget;remember	5.252	4.602	5.287	"You"ve forgotten something, Niels," he said; "you remember you found a sword near here that night I shot the stag."
1474	PERSON	the princess			say	6.775	4.925	6.31	said the princess.
1475	PERSON	the princess	mind;sword;steward		be;make;recognise;have	5.945	4.025	5.76625	Before he had made up his mind, however, the steward was back with the sword, which the princess recognised at once.
1476	PERSON	Niels			say	5.91	4.43	6.88	she said to Niels.
1477	PERSON	Niels	sheep-farmer;son;penalty;thing;s;bed-room;princess	poor;silent;unfortunate;usual	carry;be;deliver;wonder	5.43588235294	4.09764705882	5.34411764706	Niels was silent, and wondered what the usual penalty was for a poor sheep-farmer"s son who was so unfortunate as to deliver a princess and carry off things from her bed-room.
1478	PERSON	the princess	pocket;slipper;half;handkerchief;steward	gold-hemmed;gold-embroidered	be;search;say;submit;see;have;come	5.701875	3.885625	5.5925	"See what else he has about him," said the princess to the steward, and Niels had to submit to be searched: out of one pocket came a gold-embroidered slipper, and out of another the half of a gold-hemmed handkerchief.
1478	PERSON	Niels	pocket;slipper;half;handkerchief;steward	gold-hemmed;gold-embroidered	be;search;say;submit;see;have;come	5.701875	3.885625	5.5925	"See what else he has about him," said the princess to the steward, and Niels had to submit to be searched: out of one pocket came a gold-embroidered slipper, and out of another the half of a gold-hemmed handkerchief.
1479	PERSON	the king	father		send	6.35333333333	3.85333333333	5.55333333333	Send for my father the king at once."
1480	PERSON	Niels	harm;rate	good	go;let;say;please;do	5.45222222222	4.37777777778	5.55333333333	"Please let me go," said Niels; "I did you as much good as harm, at any rate."
1482	PERSON	Niels	king;historian;father;reign;carriage;moor;something;mother	old	be;forget;die;send;stay;mention;reign;have;go	5.43428571429	3.88952380952	5.23	Before long the old king died, and Niels reigned after him; but whether his father and mother stayed with him, or went back to the moor in Jutland, or were sent to Rome in a carriage and four, is something that all the historians of his reign have forgotten to mention.
1482	LOCATION	Jutland	king;historian;father;reign;carriage;moor;something;mother	old	be;forget;die;send;stay;mention;reign;have;go	5.43428571429	3.88952380952	5.23	Before long the old king died, and Niels reigned after him; but whether his father and mother stayed with him, or went back to the moor in Jutland, or were sent to Rome in a carriage and four, is something that all the historians of his reign have forgotten to mention.
1482	LOCATION	Rome	king;historian;father;reign;carriage;moor;something;mother	old	be;forget;die;send;stay;mention;reign;have;go	5.43428571429	3.88952380952	5.23	Before long the old king died, and Niels reigned after him; but whether his father and mother stayed with him, or went back to the moor in Jutland, or were sent to Rome in a carriage and four, is something that all the historians of his reign have forgotten to mention.
1484	PERSON	Paul	shepherd			5.75	3.05	5.72	Shepherd Paul
1485	PERSON	Paul	shepherd;luck;world;home	tired	try;live;call;have;go;grow	6.26727272727	3.87272727273	5.75727272727	Then Paul, as the shepherd had called him, grew tired of living at home, and went out into the world to try his luck.
1486	LOCATION	the wood	space;tree;flax;mile;nothing;man	many;open	be;walk;see;astonish;surprise;comb;find	5.99611111111	3.92166666667	5.65611111111	He walked on for many miles, seeing nothing that surprised him, but in an open space of the wood he was astonished at finding a man combing trees as another man would comb flax.
1487	PERSON	Paul	man;word;friend;morning	good;strong	be;say	6.163	4.236	5.971	"Good morning, friend," said Paul; "upon my word, you must be a strong man!"
1488	PERSON	Shepherd Paul	comber;life;tree;wish	greatest	answer;be;wrestle	6.12777777778	3.9	5.72111111111	"I am Tree Comber," he answered proudly; "and the greatest wish of my life is to wrestle with Shepherd Paul."
1490	PERSON	Paul	journey	good	answer;continue	6.5625	3.8625	6.325	"Very good," answered Paul, and they continued their journey together.
1492	PERSON	Paul	fellow;word;morning	good;strong	be;say	6.18888888889	4.08444444444	5.99555555556	"Good morning," said Paul politely; "upon my word, you must be a strong fellow!"
1493	PERSON	the man	wish;stone;crusher;life	greatest	answer;be;wrestle	5.69	4.06272727273	5.71454545455	"I am Stone Crusher," answered the man, and the greatest wish of my life is to wrestle with Shepherd Paul."
1493	PERSON	Shepherd Paul	wish;stone;crusher;life	greatest	answer;be;wrestle	5.69	4.06272727273	5.71454545455	"I am Stone Crusher," answered the man, and the greatest wish of my life is to wrestle with Shepherd Paul."
1494	PERSON	the man	leave;time	short	beat;go;travel;declare;beg	5.41181818182	4.38454545455	5.19545454545	After a short time the man declared himself beaten, and begged leave to go with them; so they all three travelled together.
1495	PERSON	Paul	fellow;morning	good;strong	be;say	6.24125	4.095	5.9675	"Good morning," said Paul, "you must be a strong fellow."
1496	PERSON	Iron Kneader			answer;be;like;fight	5.57714285714	4.20714285714	5.52	"I am Iron Kneader, and should like to fight Shepherd Paul," answered he.
1496	PERSON	Shepherd Paul			answer;be;like;fight	5.57714285714	4.20714285714	5.52	"I am Iron Kneader, and should like to fight Shepherd Paul," answered he.
1497	PERSON	Paul	occasion;journey;foe	better	reply;begin;continue;let;get	5.75	3.70555555556	5.79444444444	"Let us begin at once then," replied Paul; and on this occasion also, Paul got the better of his foe, and they all four continued their journey.
1497	PERSON	Paul	occasion;journey;foe	better	reply;begin;continue;let;get	5.75	3.70555555556	5.79444444444	"Let us begin at once then," replied Paul; and on this occasion also, Paul got the better of his foe, and they all four continued their journey.
1500	PERSON	Paul	store	amusing	go;be;think	6.544	4.13	5.912	So they went off, amusing themselves by thinking what was in store for Paul.
1501	PERSON	Paul	longing;dinner;hunter;surprise	ready	be;see;come;have;get	6.14222222222	3.88888888889	5.70111111111	The hunters came back early, longing to see how Paul had got on, and, to their surprise, dinner was quite ready for them.
1504	PERSON	Paul	head;entreaty;dragon	many;afraid	be;refuse;do;sit;wait;have;listen;declare;care	5.5	3.96666666667	5.4275	But Paul refused to listen to all her entreaties, and declared that he was not afraid of the dragon, and did not care how many heads he had; and he sat down calmly to wait for him.
1506	PERSON	Paul	shepherd;hurry;man	young	be;begin;fight;say;have;come	5.463125	4.2625	5.43625	"I am Shepherd Paul," said the young man, "and I have come to fight you, and as I am in a hurry we had better begin at once."
1509	PERSON	the girl	sheath;sword	free	be;set;show;bid;rest;vow;come	6.1675	4.0175	5.75666666667	He vowed that his sword should never rest in its sheath till they were set free, and bade the girl come with him, and show him the way.
1509	LOCATION	the way	sheath;sword	free	be;set;show;bid;rest;vow;come	6.1675	4.0175	5.75666666667	He vowed that his sword should never rest in its sheath till they were set free, and bade the girl come with him, and show him the way.
1511	PERSON	Paul	head;shirt;s;struggle;sword;ground	hard;dead;long	be;help;lay	5.08083333333	4.1	5.29916666667	Long and hard was the struggle, but Paul"s sword and his shirt helped him, and the twelve heads lay dead upon the ground.
1512	PERSON	Paul	pocket;search;girl;castle;apple		put;set;change	5.79583333333	4.04333333333	5.75	Then Paul changed the castle into an apple, which he put into his pocket, and set out with the two girls in search of the third castle.
1512	LOCATION	the castle	pocket;search;girl;castle;apple		put;set;change	5.79583333333	4.04333333333	5.75	Then Paul changed the castle into an apple, which he put into his pocket, and set out with the two girls in search of the third castle.
1513	LOCATION	the earth	head;dwarf;region;surface;home;husband;beard	lower;little;pointed	leave;quit;change;have	5.61888888889	3.98833333333	5.42222222222	Her husband had eighteen heads, but when he quitted the lower regions for the surface of the earth, he left them all at home except one, which he changed for the head of a little dwarf, with a pointed beard.
1515	LOCATION	the steps	castle;dragon	whole	put;fly;begin;have;shake	5.784	3.955	5.718	He had scarcely put it on, when the whole castle began to shake violently, and the dragon flew up the steps into the hall.
1515	LOCATION	the hall	castle;dragon	whole	put;fly;begin;have;shake	5.784	3.955	5.718	He had scarcely put it on, when the whole castle began to shake violently, and the dragon flew up the steps into the hall.
1516	PERSON	Shepherd Paul	clutch;wife		be;wrestle;come;free;have	5.771	4.175	5.588	I am Shepherd Paul, and I have come to wrestle with you, and to free your wife from your clutches."
1517	PERSON	Paul	room;shirt;cupful;rest;s;cask;wine	magic	be;run;look;give;allow;drink;have;go	6.134	3.969	5.564	And he went into his room to look for his shirt and to drink some magic wine, but the shirt was on Paul"s back, and as for the wine, the girl had given a cupful to Paul and then had allowed the rest to run out of the cask.
1517	PERSON	the girl	room;shirt;cupful;rest;s;cask;wine	magic	be;run;look;give;allow;drink;have;go	6.134	3.969	5.564	And he went into his room to look for his shirt and to drink some magic wine, but the shirt was on Paul"s back, and as for the wine, the girl had given a cupful to Paul and then had allowed the rest to run out of the cask.
1517	PERSON	Paul	room;shirt;cupful;rest;s;cask;wine	magic	be;run;look;give;allow;drink;have;go	6.134	3.969	5.564	And he went into his room to look for his shirt and to drink some magic wine, but the shirt was on Paul"s back, and as for the wine, the girl had given a cupful to Paul and then had allowed the rest to run out of the cask.
1519	LOCATION	the earth	girl;upward;opening		set;lead	5.99428571429	4.24714285714	5.66	Afterwards he and the three girls set off for the opening which led upwards to the earth.
1521	PERSON	Paul	time;father;goodness;one	young	fly;do;return;have;lose;ask;reward;tell	5.90461538462	4.03538461538	5.58076923077	When their father returned the young ones told him what Paul had done, and he lost no time in flying after Paul, and asking how he could reward him for his goodness.
1521	PERSON	Paul	time;father;goodness;one	young	fly;do;return;have;lose;ask;reward;tell	5.90461538462	4.03538461538	5.58076923077	When their father returned the young ones told him what Paul had done, and he lost no time in flying after Paul, and asking how he could reward him for his goodness.
1522	LOCATION	the earth	food;griffin;journey	long	be;get;agree;answer;go;carry;eat	6.34785714286	4.275	5.80857142857	"By carrying me up to the earth," answered Paul; and the griffin agreed, but first went to get some food to eat on the way, as it was a long journey.
1522	PERSON	Paul	food;griffin;journey	long	be;get;agree;answer;go;carry;eat	6.34785714286	4.275	5.80857142857	"By carrying me up to the earth," answered Paul; and the griffin agreed, but first went to get some food to eat on the way, as it was a long journey.
1522	LOCATION	the way	food;griffin;journey	long	be;get;agree;answer;go;carry;eat	6.34785714286	4.275	5.80857142857	"By carrying me up to the earth," answered Paul; and the griffin agreed, but first went to get some food to eat on the way, as it was a long journey.
1523	PERSON	Paul	head;right;cupful;cask;bullock;slice;mouth;throat;wine;side;left		draw;cut;get;hang;pour;turn;say;put	5.21333333333	4.14333333333	5.55916666667	"Now get on my back," he said to Paul, "and when I turn my head to the right, cut a slice off the bullock that hangs on that side, and put it in my mouth, and when I turn my head to the left, draw a cupful of wine from the cask that hangs on that side, and pour it down my throat."
1524	PERSON	Paul	home;farewell		bid;return;thank	5.958	3.72	5.942	Then Paul thanked him and bade him farewell, and he returned home again.
1525	PERSON	Paul	search;anything;fright;one;sleep;sight;wickedness	faithless;tired	be;reproach;do;die;rest;start;have;come;think	5.48272727273	3.94772727273	5.33363636364	At first Paul was too tired to do anything but sleep, but as soon as he was rested he started off in search of the three faithless ones, who almost died from fright at the sight of him, for they had thought he would never come back to reproach them for their wickedness.
1533	LOCATION	the wood	somebody	heavy	do;risk;be;walk;see;let;have;find	5.87	3.76181818182	5.59181818182	She found him rather heavy, but it would never have done to let him walk through the wood and risk his being seen by somebody.
1534	LOCATION	the forest	ditch;dusk		hide;grow;gallop	5.41428571429	3.9	5.23	Once outside, he hid himself in a ditch till it grew dusk, and then galloped away into the forest.
1539	LOCATION	the bridge	corner;shape	different	be;see;hide;transform	5.56909090909	4.00181818182	5.49545454545	But instead of transforming himself into a different shape, he just hid himself in a corner of the bridge, where he could see without being seen.
1540	LOCATION	the bridge	court;father;middle;guard;place;troop		be;take;have;follow;arrive;come	5.54133333333	3.954	5.23466666667	He had not been there long when his father arrived and took up his place near the middle of the bridge, and soon after the king came by, followed by a troop of guards and all his court.
1540	PERSON	the king	court;father;middle;guard;place;troop		be;take;have;follow;arrive;come	5.54133333333	3.954	5.23466666667	He had not been there long when his father arrived and took up his place near the middle of the bridge, and soon after the king came by, followed by a troop of guards and all his court.
1541	LOCATION	the river	water;soldier;leg;tanukus;king		be;fling;conceive;seize;attack;close	5.50666666667	4.3925	5.45083333333	The soldiers, conceiving that their king was being attacked, seized the tanuki by the legs and flung him over into the river, and the water closed over him.
1542	LOCATION	the forest		lonely	go;be;live;find;have	5.85875	3.93	5.44375	Then he went back to the forest, and if he has not found it too lonely, he is probably living there still.
1548	LOCATION	the mountain	shadow;monkey;tree;kakus;visit;crab;time;hole;side	beautiful;sunny;more	sit;pay;see;have;pass;go;happen;find	5.99260869565	3.98260869565	5.36	For some time the crab saw no more of the monkey, who had gone to pay a visit on the sunny side of the mountain; but one morning he happened to pass by her hole, and found her sitting under the shadow of a beautiful kaki tree.
1560	PERSON	the queen	boy;loss;wife;memory;s;monument;mother	little;splendid;sad	be;bewail;love;sit;die;build;fall	5.5125	4.21166666667	5.33	When the little boy was only ten years old the queen, his mother, fell ill and died, and the king, who loved her dearly, built a splendid monument to his wife"s memory, and day after day he sat by it and bewailed his sad loss.
1560	PERSON	the king	boy;loss;wife;memory;s;monument;mother	little;splendid;sad	be;bewail;love;sit;die;build;fall	5.5125	4.21166666667	5.33	When the little boy was only ten years old the queen, his mother, fell ill and died, and the king, who loved her dearly, built a splendid monument to his wife"s memory, and day after day he sat by it and bewailed his sad loss.
1561	PERSON	the lady	comfort;return;friend;husband		suggest;make;inform;have;lose;find	5.91333333333	3.88916666667	5.83833333333	In return, the lady informed him that she had lately lost her husband, and suggested that they might both find it a comfort if they made friends.
1562	PERSON	the king	palace;time	other;pleased	marry;see;invite	5.87333333333	4.45111111111	5.60222222222	This pleased the king so much that he invited her to his palace, where they saw each other often; and after a time he married her.
1563	PERSON	Sigurd	home;stepmother;spirit;hunting;wedding	fond;good;old	regain;be;use;ride;stay	6.04533333333	3.926	5.59133333333	After the wedding was over he soon regained his good spirits, and used to ride out hunting as in old days; but Sigurd, who was very fond of his stepmother, always stayed at home with her.
1565	PERSON	Sigurd	party;bed;hunting	sure	lie;hide;be;bid;start;call;have	5.71	3.96818181818	5.70909090909	After the hunting party had started she hid Sigurd under her bed, and bade him be sure to lie there till she called him.
1566	PERSON	Sigurd	staying;giantess;while;shake;ankle;earthquake;ground	great;good;long	be;feel;plough;see;lay;wade;peep;walk;think	5.6155	4.048	5.463	Sigurd lay very still for a long while, and was just thinking it was no good staying there any more, when he felt the floor shake under him as if there were an earthquake, and peeping out he saw a great giantess wading along ankle deep through the ground and ploughing it up as she walked.
1566	LOCATION	the floor	staying;giantess;while;shake;ankle;earthquake;ground	great;good;long	be;feel;plough;see;lay;wade;peep;walk;think	5.6155	4.048	5.463	Sigurd lay very still for a long while, and was just thinking it was no good staying there any more, when he felt the floor shake under him as if there were an earthquake, and peeping out he saw a great giantess wading along ankle deep through the ground and ploughing it up as she walked.
1567	LOCATION	the room	home;sister;ingiborg;morning	good	be;cry;enter	6.14	4.07555555556	5.56333333333	"Good morning, Sister Ingiborg," cried she as she entered the room, "is Prince Sigurd at home?"
1567	PERSON	Prince Sigurd	home;sister;ingiborg;morning	good	be;cry;enter	6.14	4.07555555556	5.56333333333	"Good morning, Sister Ingiborg," cried she as she entered the room, "is Prince Sigurd at home?"
1568	PERSON	Prince Sigurd	lamb;sister;drink;beer;giantess;dinner;home	good;best	be;thank;do;say;have;eat	6.345	3.94722222222	5.97833333333	After they had both done eating the giantess said: "Thank you, sister, for your good dinner--the best lamb, the best can of beer and the best drink I have ever had; but--is not Prince Sigurd at home?"
1569	PERSON	Ingiborg	hiding-place;sight		be;come;tell	6.05	3.515	5.58	When she was quite out of sight Ingiborg told Sigurd to come out of his hiding-place.
1569	PERSON	Sigurd	hiding-place;sight		be;come;tell	6.05	3.515	5.58	When she was quite out of sight Ingiborg told Sigurd to come out of his hiding-place.
