PARAGRAPH NUMBER	ENTITY TYPE	ENTITY	CO-OCCURRING NOUNS	CO-OCCURRING ADJECTIVES	CO-OCCURRING VERBS	VALENCE	AROUSAL	DOMINANCE	SENTENCE
513	PERSON	Wildrose	eye;eaglet;time	lovelier	answer;do;seem;open	5.78285714286	3.64428571429	5.81428571429	But the eaglets did not answer, and Wildrose opened her eyes, and seemed seven times lovelier than before.
516	PERSON	The prince	depths;stag;length;man;chase		tread;lead;give;have;follow;find	5.56833333333	4.295	5.3525	The prince instantly gave chase, and where the stag led he followed, till at length he found himself in the depths of the forest, where no man before had trod.
516	LOCATION	the forest	depths;stag;length;man;chase		tread;lead;give;have;follow;find	5.56833333333	4.295	5.3525	The prince instantly gave chase, and where the stag led he followed, till at length he found himself in the depths of the forest, where no man before had trod.
518	PERSON	Wildrose	head		smile;cry;sit;shake	5.476	4.582	5.654	cried he; but Wildrose smiled and shook her head, and sat down quietly.
519	LOCATION	the forest	home;fortune;hope;time	sad	fail;go;return;find	5.763	4.338	5.616	Twice he returned to the forest in the hopes of finding her, but this time fortune failed him, and he went home as sad as ever.
528	PERSON	the prince	distance;woman;huntsman;turn;way;arm	royal;little;old	go;follow;keep;tuck;pick	5.38866666667	3.97066666667	5.268	The old woman picked them up, and tucking them under her arm went on her way, keeping at a little distance behind the royal huntsmen, who in their turn followed the prince.
529	LOCATION	the forest	wood	dark	bid;enter;reach;wait	5.59428571429	3.9	5.74	But when they reached the forest, she bade them all wait outside, and entered the dark wood by herself.
531	PERSON	Wildrose	woman;nest;s;tripod;patience;stupidity;t;time;hill	old	move;be;bewitch;peep;win;cry;know;have;lose;happen;seem;stand	5.2772	3.946	5.3184	It really seemed bewitched, and no one knows what might have happened if Wildrose, who had been all the time peeping out of her nest, had not lost patience at the old woman"s stupidity, and cried out: "The tripod won"t stand on that hill, you must move it!"
532	LOCATION	the nest	moment;woman;kettle;tripod;hand	steady;other;old;same	ask;try;look	5.73384615385	3.65153846154	5.72615384615	asked the old woman, looking up to the nest, and at the same moment trying to steady the kettle with one hand and the tripod with the other.
549	PERSON	Tiidu	loss;hardship;parent;heart;folly;son;time;spirit	little;useless;glad;idle	do;show;cure;take;have;be;hope	5.601	4.3685	5.2545	His parents did not take his loss much to heart, but were rather glad that their useless son had for once shown a little spirit, and they hoped that time and hardship might cure Tiidu of his idle folly.
551	LOCATION	Tiidu	exertion;boy;life;riches;rest;s;place;mother;craving;man	lazy;own;contented;other;fresh;happy	be;give;goad;lie;place;know;have	6.08555555556	3.81481481481	5.76925925926	Any other man in Tiidu"s place would have been contented and happy in this life; but his craving for riches gave him no rest, and only goaded him day by day to fresh exertions, so that even his own mother would not have known him for the lazy boy who was always lying asleep in one place or the other.
552	LOCATION	the sea	help;sailor;rope;shore;ship;waist		swim;see;shout;tell;say;untie;have;come;throw	5.73473684211	4.06947368421	5.80578947368	"Now," he said, "I will throw you into the sea, and you must shout for help; and when you see the sailors coming untie the rope from your waist, and tell them that you have swum after the ship all the way from shore."
552	LOCATION	the way	help;sailor;rope;shore;ship;waist		swim;see;shout;tell;say;untie;have;come;throw	5.73473684211	4.06947368421	5.80578947368	"Now," he said, "I will throw you into the sea, and you must shout for help; and when you see the sailors coming untie the rope from your waist, and tell them that you have swum after the ship all the way from shore."
555	PERSON	Tiidu	strength;man	dead	answer;be;help;go;do	5.55153846154	4.29	5.53307692308	"I shall soon indeed be a dead man if you do not help me," answered Tiidu, "for my strength is going fast."
556	PERSON	Tiidu	rope;sailor;captain;waist;tooth	round;unseen	tie;hold;fling;loose;seize	5.27928571429	3.98928571429	5.43642857143	Then the captain seized a rope and flung it out to him, and Tiidu held it between his teeth, while, unseen by the sailors; he loosed the one tied round his waist.
557	PERSON	Tiidu	ship;captain;board		be;say;bring	5.825	3.91166666667	5.71833333333	said the captain, when Tiidu was brought up on board the ship.
558	PERSON	Tiidu	trick;merry;friend;clothes	dry;cunning	make;berth;sleep;wear;give	6.04	4.09583333333	5.67916666667	So he gave him dry clothes to wear, and a berth to sleep in, and Tiidu and his friend secretly made merry over their cunning trick.
561	PERSON	Tiidu	heart;s;wages;coat	heavy;cheap	spend	5.43888888889	4.37888888889	5.28222222222	So with a heavy heart Tiidu spent some of his next month"s wages on a cheap coat.
564	PERSON	Tiidu	pipe;advice;man;laugh;people	last;afraid;old	do;like;be;have;persist;touch;tell	5.54833333333	4.07055555556	5.64833333333	Tiidu did not like this advice--he was afraid that the people would laugh at him; and, besides, it was long since he had touched his pipes--but the old man persisted, and at last Tiidu did as he was told.
564	PERSON	Tiidu	pipe;advice;man;laugh;people	last;afraid;old	do;like;be;have;persist;touch;tell	5.54833333333	4.07055555556	5.64833333333	Tiidu did not like this advice--he was afraid that the people would laugh at him; and, besides, it was long since he had touched his pipes--but the old man persisted, and at last Tiidu did as he was told.
567	PERSON	Kungla	man	prouder	be	5.8	3.895	5.47	In all Kungla there was no prouder man than Tiidu.
567	PERSON	Tiidu	man	prouder	be	5.8	3.895	5.47	In all Kungla there was no prouder man than Tiidu.
571	LOCATION	the island	basket;treasure	able	leave;be;rush;carry;weave	5.86181818182	4.18727272727	5.70363636364	Next day he wove a basket out of some rushes, so that if he ever left the island he might be able to carry his treasures about.
572	LOCATION	the island	pipe;hand		dash;be;make;hold	5.88571428571	4.08428571429	5.80428571429	there it was, making straight for the island; and Tiidu, holding his pipes in his hand, dashed down to the shore.
572	PERSON	Tiidu	pipe;hand		dash;be;make;hold	5.88571428571	4.08428571429	5.80428571429	there it was, making straight for the island; and Tiidu, holding his pipes in his hand, dashed down to the shore.
572	LOCATION	the shore	pipe;hand		dash;be;make;hold	5.88571428571	4.08428571429	5.80428571429	there it was, making straight for the island; and Tiidu, holding his pipes in his hand, dashed down to the shore.
573	PERSON	Tiidu	gratitude;story;shipwreck;offer;pipe;board;captain	thankful	be;play;do;show;sail;accept;promise;ask;come;tell	5.986	3.8675	5.722	Tiidu told them the story of his shipwreck, and the captain promised that he should come on board, and sail with them back to Kungla; and thankful indeed was Tiidu to accept the offer, and to show his gratitude by playing on his pipes whenever he was asked to do so.
573	LOCATION	Kungla	gratitude;story;shipwreck;offer;pipe;board;captain	thankful	be;play;do;show;sail;accept;promise;ask;come;tell	5.986	3.8675	5.722	Tiidu told them the story of his shipwreck, and the captain promised that he should come on board, and sail with them back to Kungla; and thankful indeed was Tiidu to accept the offer, and to show his gratitude by playing on his pipes whenever he was asked to do so.
573	PERSON	Tiidu	gratitude;story;shipwreck;offer;pipe;board;captain	thankful	be;play;do;show;sail;accept;promise;ask;come;tell	5.986	3.8675	5.722	Tiidu told them the story of his shipwreck, and the captain promised that he should come on board, and sail with them back to Kungla; and thankful indeed was Tiidu to accept the offer, and to show his gratitude by playing on his pipes whenever he was asked to do so.
574	PERSON	Tiidu	apple;bull	afraid;mad	be;begin;promise;have;hasten;eat	5.21769230769	4.26384615385	5.56769230769	This Tiidu promised, and hastened away as if he had a mad bull behind him, so afraid was he that the man should begin to eat an apple at once.
574	PERSON	the man	apple;bull	afraid;mad	be;begin;promise;have;hasten;eat	5.21769230769	4.26384615385	5.56769230769	This Tiidu promised, and hastened away as if he had a mad bull behind him, so afraid was he that the man should begin to eat an apple at once.
575	LOCATION	the palace	mother;beard;clothes;apple;side	own;other;black;long;needless	be;know;keep;disguise;say;wear;have;take	5.7652173913	3.69391304348	5.58347826087	It is needless to say that for some days he took no more apples back to the palace, but kept well away on the other side of the town, wearing other clothes, and disguised by a long black beard, so that even his own mother would not have known him.
575	LOCATION	the town	mother;beard;clothes;apple;side	own;other;black;long;needless	be;know;keep;disguise;say;wear;have;take	5.7652173913	3.69391304348	5.58347826087	It is needless to say that for some days he took no more apples back to the palace, but kept well away on the other side of the town, wearing other clothes, and disguised by a long black beard, so that even his own mother would not have known him.
576	LOCATION	the town	malady;story;by-and-bye;air;nose;way;nothing;round;man	own;sure	catch;be;rub;start;connect;go;know	6.0425	3.7045	5.4625	By-and-bye a story went round the town, started no one knew how, that the malady was in some way connected with the nose; and men rubbed their own anxiously, to be sure that nothing catching was in the air.
577	PERSON	the king	yard;s;moment;haste;nose;time;post;carriage		count;be;do;stop;drive;step;know	5.72238095238	3.78761904762	5.53857142857	He stepped into the carriage, and was driven post haste to the king, who was feverishly counting every moment, for both his nose and the queen"s were by this time more than a yard long, and they did not know where they would stop.
577	PERSON	the queen	yard;s;moment;haste;nose;time;post;carriage		count;be;do;stop;drive;step;know	5.72238095238	3.78761904762	5.53857142857	He stepped into the carriage, and was driven post haste to the king, who was feverishly counting every moment, for both his nose and the queen"s were by this time more than a yard long, and they did not know where they would stop.
578	PERSON	the king	room;bed	dark;sure	be;give;get;move;cure;take;come;tell	5.98263157895	3.88526315789	5.62315789474	He gave one of these to the king and another to the queen, and told them that before taking them they were to get into bed in a dark room and not to move for some hours, after which they might be sure that they would come out cured.
578	PERSON	the queen	room;bed	dark;sure	be;give;get;move;cure;take;come;tell	5.98263157895	3.88526315789	5.62315789474	He gave one of these to the king and another to the queen, and told them that before taking them they were to get into bed in a dark room and not to move for some hours, after which they might be sure that they would come out cured.
580	PERSON	Tiidu	people;feast;pipe;part;farewell;wedding;home	other;best	do;play;return;be;bid;take;declare	5.81052631579	3.91105263158	5.75368421053	This did not take long either; and people who were at the wedding feast declared that the best part of the whole day was the hour when Tiidu played to them on the pipes before they bade each other farewell and returned to their homes.
584	PERSON	The king	world;woman;father;sight	unlucky;wicked	leave;be;love;hate;die	5.22818181818	4.38636363636	5.19545454545	The king loved the boy very much, but the queen, who was a wicked woman, hated the sight of him; and this was the more unlucky for, when he was twelve years old, his father died, and he was left alone in the world.
584	PERSON	the boy	world;woman;father;sight	unlucky;wicked	leave;be;love;hate;die	5.22818181818	4.38636363636	5.19545454545	The king loved the boy very much, but the queen, who was a wicked woman, hated the sight of him; and this was the more unlucky for, when he was twelve years old, his father died, and he was left alone in the world.
584	PERSON	the queen	world;woman;father;sight	unlucky;wicked	leave;be;love;hate;die	5.22818181818	4.38636363636	5.19545454545	The king loved the boy very much, but the queen, who was a wicked woman, hated the sight of him; and this was the more unlucky for, when he was twelve years old, his father died, and he was left alone in the world.
586	PERSON	the queen	daybreak;rest;wind;horn		sound;be;have;speak	6.279	3.792	5.541	But he might as well have spoken to the winds: when the horn was sounded at daybreak the queen was there with the rest.
587	PERSON	the queen	body;heart;harm;ogre;beauty;horse;s;sight		be;do;bind;move;turn;promise;stab	5.42818181818	4.44727272727	5.37	The ogre"s heart was moved at the sight of the queen"s beauty, and he promised that he would do her no harm; but he stabbed the boy at once, and binding his body on a horse, turned him loose in the forest.
587	PERSON	the boy	body;heart;harm;ogre;beauty;horse;s;sight		be;do;bind;move;turn;promise;stab	5.42818181818	4.44727272727	5.37	The ogre"s heart was moved at the sight of the queen"s beauty, and he promised that he would do her no harm; but he stabbed the boy at once, and binding his body on a horse, turned him loose in the forest.
587	LOCATION	the forest	body;heart;harm;ogre;beauty;horse;s;sight		be;do;bind;move;turn;promise;stab	5.42818181818	4.44727272727	5.37	The ogre"s heart was moved at the sight of the queen"s beauty, and he promised that he would do her no harm; but he stabbed the boy at once, and binding his body on a horse, turned him loose in the forest.
589	PERSON	the fairy	king;world;wife	young	marry;love;live;long;see	6.756	4.678	5.933	So the young king married the fairy, and they lived happily together in the castle; but though he loved his wife he still longed to see the world.
589	LOCATION	the castle	king;world;wife	young	marry;love;live;long;see	6.756	4.678	5.933	So the young king married the fairy, and they lived happily together in the castle; but though he loved his wife he still longed to see the world.
592	LOCATION	the castle	moment		be;have;wish	6.11666666667	4.01666666667	5.845	And in a moment the castle was before him just as he had wished.
593	LOCATION	the road	rag;goose-boy;object;face;mud;order;side	better;other;disgusting	be;guess;rub;make;cross;see;come	5.53454545455	3.74136363636	5.50954545455	And in order that no one should guess that he was any better than a goose-boy should be, he rubbed his face and his rags over with mud, and made himself altogether such a disgusting object that every one crossed over to the other side of the road when he was seen coming.
597	PERSON	the king			be;play;remember	6.482	3.652	5.826	Remember, the king is not to be played with!"
601	PERSON	the king	tear;prayer;bridegroom;splendour;wedding;trouble	many;great;dirty	be;heed;pay;wash;take;have;celebrate	5.67888888889	4.37666666667	5.55722222222	However, the king paid no heed to her tears and prayers, and before many days were over the wedding was celebrated with great splendour, though the bridegroom had not taken the trouble to wash himself, and was as dirty as before.
604	LOCATION	the field	soldier;clay;doll;row	little;whole	leave;make;ride;find;sit	5.67285714286	3.89428571429	5.775	Then he left the field, and when the soldiers rode back they found him still sitting in the road making whole rows of little clay dolls.
604	LOCATION	the road	soldier;clay;doll;row	little;whole	leave;make;ride;find;sit	5.67285714286	3.89428571429	5.775	Then he left the field, and when the soldiers rode back they found him still sitting in the road making whole rows of little clay dolls.
605	PERSON	the king	enemy;victory;way		remain;give	5.70375	4.385	5.16	As before, the enemy gave way before him, and in a few minutes the victory remained with the king.
606	LOCATION	the road	battle;doll;clay		be;make;return;sit	5.73	3.78777777778	5.73777777778	In the evening, when they all returned from the battle, there he was, sitting in the road, making clay dolls.
614	PERSON	The magician	gratitude;help;house;youth;deliverer;reward	full	go;be;promise	6.25384615385	4.21923076923	5.77846153846	The magician was full of gratitude to his deliverer, and promised him a reward for his help if the youth would go back with him to his house.
615	PERSON	the boy	nothing;home;s	welcome	be;do;get;answer;know;have;lodge;wander	6.06523809524	3.91523809524	5.6080952381	"Indeed there is nothing that would be more welcome to me than a night"s lodging," answered the boy; "I have been wandering all day in the forest, and did not know how to get home again.
615	LOCATION	the forest	nothing;home;s	welcome	be;do;get;answer;know;have;lodge;wander	6.06523809524	3.91523809524	5.6080952381	"Indeed there is nothing that would be more welcome to me than a night"s lodging," answered the boy; "I have been wandering all day in the forest, and did not know how to get home again.
616	LOCATION	the forest	food;larder;host	empty	be;return;get	5.98571428571	3.56857142857	5.43	But his host returned to the forest to get some food, for the larder was empty.
618	LOCATION	the forest	time	impossible	go;find	5.47285714286	3.71142857143	5.13857142857	But finding it quite impossible, he went back for the third time to the forest.
619	PERSON	The girl	life;horse;choice;s;master;nothing;reward	more	be;run;offer;say;stall;hear;stand;have;ask;save;tell	5.91608695652	4.10695652174	5.68304347826	The girl had heard how he had saved her master"s life, so she said nothing more about his running away, but instead told him that if the magician offered him the choice of a reward, he was to ask for the horse which stood in the third stall of the stable.
619	PERSON	the magician	life;horse;choice;s;master;nothing;reward	more	be;run;offer;say;stall;hear;stand;have;ask;save;tell	5.91608695652	4.10695652174	5.68304347826	The girl had heard how he had saved her master"s life, so she said nothing more about his running away, but instead told him that if the magician offered him the choice of a reward, he was to ask for the horse which stood in the third stall of the stable.
619	LOCATION	the stable	life;horse;choice;s;master;nothing;reward	more	be;run;offer;say;stall;hear;stand;have;ask;save;tell	5.91608695652	4.10695652174	5.68304347826	The girl had heard how he had saved her master"s life, so she said nothing more about his running away, but instead told him that if the magician offered him the choice of a reward, he was to ask for the horse which stood in the third stall of the stable.
620	PERSON	the magician	courage;reward;son		say;finish;tell;have	6.12363636364	4.25272727273	5.83363636364	When they had finished the magician said: "Now, my son, tell me what you will have as the reward of your courage?"
623	PERSON	the magician	blow;horse;help;danger;flute;fiddle;zither;aid		be;play;give;bring;say;touch;come	5.84904761905	4.2980952381	5.50857142857	And besides the horse, the magician gave him a zither, a fiddle, and a flute, saying: "If you are in danger, touch the zither; and if no one comes to your aid, then play on the fiddle; but if that brings no help, blow on the flute."
626	PERSON	the king	horse;i.	beautiful;other;stable	sell;do;take;ask;become;feed	5.69133333333	4.17666666667	5.84466666667	"Do not sell me, but ask the king to take me to his stable, and feed me there; then his other horses will become just as beautiful as I."
628	LOCATION	the stable	youth;command	thunderstruck	go;be;bow	5.64666666667	4.00666666667	5.88666666667	The youth was thunderstruck at this command, but he only bowed, and went off at once to the stable.
630	PERSON	The magician	horse;flesh;clutch;dragon;s;ox;wind;raven	safe;other	gallop;ride;throw;try;s;carry;eat;speak	5.73666666667	4.21791666667	5.58541666667	Then the other horse spoke again: "The magician"s raven will try to eat us as we ride away, but throw it some of the oxen"s flesh, and then I will gallop like the wind, and carry you safe out of the dragon"s clutches."
631	PERSON	the king	horse;man	young	do;bring;tell;be	5.67555555556	3.87777777778	5.55666666667	So the young man did as he was told, and brought the horse back to the king.
633	LOCATION	the stable	shoulder;head;anything;wife;horse;home	long	do;say;walk;bring;s;lay;have;tell;order;disappear	5.75217391304	3.92695652174	5.75608695652	Slowly he walked to the stable, and laying his head on his horse"s shoulder, he said: "The king has ordered me to bring his wife home again, and how can I do that when she disappeared so long ago, and no one can tell me anything about her?"
633	PERSON	The king	shoulder;head;anything;wife;horse;home	long	do;say;walk;bring;s;lay;have;tell;order;disappear	5.75217391304	3.92695652174	5.75608695652	Slowly he walked to the stable, and laying his head on his horse"s shoulder, he said: "The king has ordered me to bring his wife home again, and how can I do that when she disappeared so long ago, and no one can tell me anything about her?"
634	PERSON	the king	s;horse;wife		be;save;turn	5.79166666667	4.37583333333	5.35166666667	For I am the king"s wife, who was turned into a horse by the magician from whom you saved me."
634	PERSON	the magician	s;horse;wife		be;save;turn	5.79166666667	4.37583333333	5.35166666667	For I am the king"s wife, who was turned into a horse by the magician from whom you saved me."
635	PERSON	the king	gratitude;great;gift;wife;s;stand;surprise;rescuer;happiness		load;be;behold;lose	6.15	4.66692307692	5.88	Great was the king"s surprise and happiness when he beheld his lost wife stand before him, and in gratitude to her rescuer he loaded him with gifts.
636	PERSON	the king	youth;throne;s;time		do;be;seize;declare;have;puff;tell;present	5.66125	4.074375	5.590625	This time he presented himself before the king and told him that the youth was so puffed up with what he had done that he had declared he would seize the king"s throne for himself.
636	PERSON	the king	youth;throne;s;time		do;be;seize;declare;have;puff;tell;present	5.66125	4.074375	5.590625	This time he presented himself before the king and told him that the youth was so puffed up with what he had done that he had declared he would seize the king"s throne for himself.
640	PERSON	the king	fir;fear;tree	big	be;give;dance;bind;make;leave;have	5.81071428571	4.37071428571	5.48	So, very unwillingly, the king gave him leave; but first he had himself bound to a big fir tree, for fear that he should be made to dance.
644	PERSON	the king	fir;word;gallows;air;hold;heave;cloud;man	mighty;young	be;vanish;point;bind;take;go;waste;spin	5.35416666667	4.14625	5.30333333333	The young man pointed to the king, who was still bound to the fir; and without wasting words the magician took hold of the tree also, and with a mighty heave both fir and man went spinning through the air, and vanished in the clouds after the gallows.
644	PERSON	the magician	fir;word;gallows;air;hold;heave;cloud;man	mighty;young	be;vanish;point;bind;take;go;waste;spin	5.35416666667	4.14625	5.30333333333	The young man pointed to the king, who was still bound to the fir; and without wasting words the magician took hold of the tree also, and with a mighty heave both fir and man went spinning through the air, and vanished in the clouds after the gallows.
644	LOCATION	the tree	fir;word;gallows;air;hold;heave;cloud;man	mighty;young	be;vanish;point;bind;take;go;waste;spin	5.35416666667	4.14625	5.30333333333	The young man pointed to the king, who was still bound to the fir; and without wasting words the magician took hold of the tree also, and with a mighty heave both fir and man went spinning through the air, and vanished in the clouds after the gallows.
645	LOCATION	the stable	king;envy;helper;people;life;youth;man	poor;young;free	be;elect;remain;drown;have;declare	5.68181818182	4.03818181818	5.44136363636	Then the youth was declared to be free, and the people elected him for their king; and the stable helper drowned himself from envy, for, after all, if it had not been for him the young man would have remained poor all the days of his life.
648	PERSON	Prince		strong		6.125	5.145	5.465	The Strong Prince
651	PERSON	the queen	water;son	thirsty	be;say;finish;fetch;have	5.87181818182	4.22818181818	5.77272727273	When they had finished the queen said: "My son, I am thirsty; fetch me some water."
652	LOCATION	the tree	weapon;rope;start;moment;sword;mother;man	young	carry;draw;cut;climb;hold	5.63588235294	4.41470588235	5.47823529412	The young man drew back with a start; but in a moment he climbed the tree, cutting the rope which held the sword, and carried the weapon to his mother.
654	LOCATION	the home	band;cave;robber;rock	clear	be	5.80333333333	3.84416666667	5.39083333333	Behind the rock was a cave which it was quite clear was the home of some robbers, though not one of the band was there.
657	LOCATION	the ditch	confidence;fate;signal;captain;robber;man	dead;same	be;remain;leap;hear;lay;meet	5.16388888889	4.02111111111	5.42055555556	The second man, hearing the signal, leapt the ditch in confidence, and was met by the same fate, and in a few minutes eleven of the robbers lay dead, and there remained only the captain.
658	PERSON	the prince	fool;captain	last;stark;dead;stiff	take;be;seem;lay;wonder	5.29769230769	3.94923076923	4.92769230769	Still, the prince was no fool, and wondered if indeed he was as dead as he seemed to be; but the captain lay so stiff and stark, that at last he was taken in.
660	PERSON	The prince	care;hunting;round;key;mother		go;lock;bid;take;be	5.87636363636	3.94363636364	5.44363636364	The prince went round all these and carefully locked them up, bidding his mother take care of the keys while he was hunting.
661	LOCATION	the chamber	lock;key		turn;run;have;sleep	5.65125	3.73875	5.49	She quickly turned the key in the lock, and ran back to the chamber she had slept in.
