PARAGRAPH NUMBER	ENTITY TYPE	ENTITY	CO-OCCURRING NOUNS	CO-OCCURRING ADJECTIVES	CO-OCCURRING VERBS	SENTENCE
1095	PERSON	Kathleen	girl	sensible		A sensible girl like Kathleen too!"
1097	PERSON	Kathleen	t		don;know;say	"I don\"t know," said Kathleen.
1099	PERSON	Prince		little	be	How is the little Prince?"
1106	PERSON	Terence			ask	Terence asked.
1107	PERSON	Kathleen	promise		have;be;say;try;keep	"I have been here very often," Kathleen said, "trying to keep my promise to you."
1109	PERSON	Kathleen			say;like	"Yes," Kathleen said, "if you would like me to."
1110	PERSON	Terence			say	said Terence.
1111	PERSON	Terence	home		be;go;go;think	Terence was gone and she went home to think about it.
1112	PERSON	Kathleen	t		say;look;let;go;\;go;\;re;look	Then he said, without looking around: "Let me go, Kathleen; I can\"t go while you\"re looking."
1116	PERSON	Kathleen	nothing		say;answer;do;think;say	"I say nothing to it," Kathleen answered; "what did you think I would say?"
1118	PERSON	Kathleen			be;say	"That is all," said Kathleen.
1121	PERSON	Terence	father		come;be;introduce	Her father came soon and Terence was introduced to him too.
1122	PERSON	Kathleen	corner;room;paper;mrs.;o;book;time;sight;mermaid;bottom;sea	same;astonishing	sit;sit;read;knit;read;be;be;see;play	When he and Kathleen sat together in a corner of the room and John sat reading a paper and Mrs. O"Brien knitting and reading a book at the same time, it was as astonishing a sight to him as it would be to you to see a dozen mermaids playing at the bottom of the sea."
1122	PERSON	John	corner;room;paper;mrs.;o;book;time;sight;mermaid;bottom;sea	same;astonishing	sit;sit;read;knit;read;be;be;see;play	When he and Kathleen sat together in a corner of the room and John sat reading a paper and Mrs. O"Brien knitting and reading a book at the same time, it was as astonishing a sight to him as it would be to you to see a dozen mermaids playing at the bottom of the sea."
1122	PERSON	Brien	corner;room;paper;mrs.;o;book;time;sight;mermaid;bottom;sea	same;astonishing	sit;sit;read;knit;read;be;be;see;play	When he and Kathleen sat together in a corner of the room and John sat reading a paper and Mrs. O"Brien knitting and reading a book at the same time, it was as astonishing a sight to him as it would be to you to see a dozen mermaids playing at the bottom of the sea."
1123	PERSON	Kathleen			whisper	he whispered to Kathleen.
1124	PERSON	Kathleen			ask	Kathleen asked.
1126	PERSON	Kathleen	course;ball;party;dancing		do;say;go;be	"Why, of course we do," Kathleen said; "we go to balls sometimes, and to parties where there is dancing, and then--"
1134	PERSON	Kathleen	way		be;call;hurry	"This is the way," Kathleen called, and she hurried back after him.
1136	PERSON	Kathleen	doorstep;rest		be;vex;go;want;laugh;have;sit	Kathleen was vexed that Terence could not go where she wanted him to, but she laughed till she had to sit down on a doorstep and rest.
1136	PERSON	Terence	doorstep;rest		be;vex;go;want;laugh;have;sit	Kathleen was vexed that Terence could not go where she wanted him to, but she laughed till she had to sit down on a doorstep and rest.
1139	PERSON	Terence		afraid	do;seem;understand;tell;be	Terence did not seem to understand it at all, and he told her not to be afraid."
1140	PERSON	Terence	something;father		be;do;make;stop;talk;look;ask;let;go	If something could not be done to make Terence stop talking to her so, and looking at her so, she should ask her father to let her go away somewhere.
1143	PERSON	Kathleen			ask	Kathleen asked.
1149	LOCATION	Ireland	nothing;potato;potato	good	be;offer;be;be	For there was nothing to offer him but potatoes, though they were as good potatoes as there were in Ireland.
1166	PERSON	Kathleen	someone;grandmother		do;come;see;happen;stay;see	Someone did come to see Kathleen before long, but, as it happened, neither she nor her grandmother stayed to see him.
1173	PERSON	Kathleen	eye;course		say	"With both eyes, of course," said Kathleen.
1174	PERSON	Terence	\;s;eye;fist		cry;strike	Terence cried, and he struck at Kathleen\"s eyes with his fist.
1174	PERSON	Kathleen	\;s;eye;fist		cry;strike	Terence cried, and he struck at Kathleen\"s eyes with his fist.
1182	PERSON	Kathleen			ask	Kathleen asked.
1190	PERSON	Brien	mrs.;o;miss;sullivans	servant	have;go;\;tell	"Mrs. O\"Brien and Miss Kathleen have gone to the Sullivans\"," the servant told him.
1190	PERSON	Kathleen	mrs.;o;miss;sullivans	servant	have;go;\;tell	"Mrs. O\"Brien and Miss Kathleen have gone to the Sullivans\"," the servant told him.
1193	PERSON	Terence	sullivans		go;\;find;say	"I will go to the Sullivans\" and find them," Terence said.
1201	PERSON	Ellen	matter		sit;try;soothe;try;get;tell;be	Ellen sat close to him, trying to soothe him and trying to get him to tell her what was the matter."
1202	PERSON	Ellen	mrs.;o;room;moment;something		say;come;have;tell	"Ellen," said Mrs. O\"Brien, "come outside the room here for a moment; I have something to tell you."
1202	PERSON	Brien	mrs.;o;room;moment;something		say;come;have;tell	"Ellen," said Mrs. O\"Brien, "come outside the room here for a moment; I have something to tell you."
1203	PERSON	Terence	s;way		look;answer;leave;\	"Look at Terence there," Ellen answered; "how can I leave him when he\"s that way?"
1203	PERSON	Ellen	s;way		look;answer;leave;\	"Look at Terence there," Ellen answered; "how can I leave him when he\"s that way?"
1204	PERSON	Brien	mrs.;o		leave;say;come	"Leave him," said Mrs. O\"Brien, "and come out here with me."
1205	PERSON	Brien	mrs.;o;room;word		look;say;be;do;look;mean;say;do	"Now look at me," said Mrs. O\"Brien, when they were out of the room; "do I look as if I would mean every word I said, or do I not?"
1206	PERSON	Ellen			look;tell;do;look;mean;have	Look at me, Ellen, and tell me, do I look as if I meant to have it?"
1207	PERSON	Terence	way	confused	look;say;go	Then she looked down again in a confused way, and said: "I must go back to Terence."
1208	PERSON	Terence	ll		\;follow;come;like;think	We\"ll follow you, and Terence can come, too, if he likes, and I think he will."
1209	PERSON	Brien	mrs.;o;terence;kitchen		call;be;go;come;like	Mrs. O\"Brien called to Terence: "We are going to the kitchen; you can come if you like."
1210	PERSON	Brien	kitchen;other;half;half;corner;room;face;arm;eye;mrs.;o		steal;sit;lay;have;do;do;cover;keep;see;be;go;do	He stole into the kitchen after the others and half sat and half lay in the corner, as he had done in the room above, only he did not cover his face with his arm, but kept his eyes on Mrs. O"Brien to see what she was going to do."
1211	PERSON	Ellen	mrs.;o;pot;fire;water	largest	whisper;put;put;let;boil	"Now, Ellen," Mrs. O\"Brien whispered, "put your largest pot on the fire, put water in it, and let it boil."
1211	PERSON	Brien	mrs.;o;pot;fire;water	largest	whisper;put;put;let;boil	"Now, Ellen," Mrs. O\"Brien whispered, "put your largest pot on the fire, put water in it, and let it boil."
1212	PERSON	Brien	egg;house;mrs.;o		bring;have;say	"Now bring all the eggs you have in the house," Mrs. O\"Brien said.
1213	PERSON	Terence	crucifix	afraid	have;be;know;care;know	But she need not have been afraid of Terence; he knew the crucifix as well as he cared to know it."
1214	PERSON	Brien	mrs.;o;egg;shell;rest	hard	wait;be;boil;whisper;break;keep;throw	Mrs. O\"Brien waited till it was boiling as hard as ever it could, and then she whispered to Ellen: "Break the eggs now; keep the shells and throw away the rest."
1214	PERSON	Ellen	mrs.;o;egg;shell;rest	hard	wait;be;boil;whisper;break;keep;throw	Mrs. O\"Brien waited till it was boiling as hard as ever it could, and then she whispered to Ellen: "Break the eggs now; keep the shells and throw away the rest."
1215	PERSON	Ellen	poor;egg;shell;rest		guess;mean;break;lay;throw	Poor Ellen could not guess what it all meant, but she broke the eggs, laid the shells carefully aside, and threw away the rest.
1216	PERSON	Brien	mrs.;o;shell;pot		say;put	"Now," said Mrs. O\"Brien, "put the shells in the pot."
1217	PERSON	Ellen			do;be;tell	Ellen did as she was told.
1218	PERSON	Terence	corner		call	Terence called from his corner.
1219	PERSON	Brien	mrs.;o		tell;be;brew;whisper	"Tell him you are brewing," Mrs. O\"Brien whispered.
1220	PERSON	Terence	m;brewing	loud;enough	\;say;be;hear	"I\"m brewing, Terence," said Ellen, scarcely loud enough to be heard.
1220	PERSON	Ellen	m;brewing	loud;enough	\;say;be;hear	"I\"m brewing, Terence," said Ellen, scarcely loud enough to be heard.
1221	PERSON	Terence			ask	Terence asked again.
1222	PERSON	Brien	egg-shell;mrs.;o		say;whisper	"Say egg-shells," Mrs. O\"Brien whispered.
1223	PERSON	Terence	egg-shell		say	"Egg-shells, Terence," Ellen said.
1223	PERSON	Ellen	egg-shell		say	"Egg-shells, Terence," Ellen said.
1229	PERSON	Terence	fiddle		do;like;hear;play	And yet I did like to hear Terence play the fiddle."
1230	PERSON	Terence	fiddle	little;new	play;say	"I can play the fiddle a little too," the new Terence said.
1232	PERSON	Peter	fiddle;fiddle;song;gladness;song;soul;man	great;full	bring;play;sing;bear;find	Peter brought the fiddle and Terence played, and the fiddle sang a great song of gladness--the song of a soul born to find itself a full man all at once.
1232	PERSON	Terence	fiddle;fiddle;song;gladness;song;soul;man	great;full	bring;play;sing;bear;find	Peter brought the fiddle and Terence played, and the fiddle sang a great song of gladness--the song of a soul born to find itself a full man all at once.
1243	PERSON	Naggeneen	t;t;word;ld		couldn;tell;say;couldn;say;\;have;say;tell	"I couldn\"t tell you that," said Naggeneen; "I couldn\"t say the words that I\"ld have to say to tell you."
1255	PERSON	Naggeneen			say	said Naggeneen.
1256	PERSON	Naggeneen	none		forbid;touch	"I forbid you ever to touch her, Naggeneen, and none of us ever will."
1258	PERSON	Naggeneen	king		\;have;say;play	"And we\"ve all had enough," said the King; "so now, Naggeneen, play for us."
1260	PERSON	Naggeneen			have;frighten;frighten;choose	Naggeneen had frightened them, as he always frightened them when he chose.
1264	PERSON	Terence	carriage		see;come;get	After a while they saw Terence and Kathleen come out and get into a carriage."
1264	PERSON	Kathleen	carriage		see;come;get	After a while they saw Terence and Kathleen come out and get into a carriage."
1267	PERSON	John	mother	same	be;think;say	"I was thinking that same, mother," said John.
1269	PERSON	John			think;say	"I think so," said John.
1300	PERSON	CHARLES SCRIBNER	u;s;son;publishers			u" CHARLES SCRIBNER"S SONS, Publishers"
1307	PERSON	PAUL DU CHAILLU	book	new		A NEW BOOK BY PAUL DU CHAILLU
1320	PERSON	Ivar		viking		Ivar the Viking
1328	PERSON	KIRK MUNROE	book	new		A NEW BOOK BY KIRK MUNROE
1332	LOCATION	Cuba	scene;story	new;early	be;lay	The scene of this new story is laid in Cuba, in the early
1336	PERSON	KIRK MUNROE	book	other		OTHER BOOKS BY KIRK MUNROE
1337	PERSON	Stuart	midshipman			Midshipman Stuart
1342	PERSON	Crockett				With Crockett and Bowie
1342	PERSON	Bowie				With Crockett and Bowie
1346	LOCATION	Pontiac	war			At War with Pontiac
1358	LOCATION	Ireland	fairy;folk			Fairies and Folk of Ireland
1361	PERSON	Frost	mr.;method;re-telling	attractive	apply	Mr. Frost here applies his attractive methods to re-telling
1377	PERSON	DANIEL C. BEARD	book	new		A NEW BOOK BY DANIEL C. BEARD
1390	PERSON	ADELIA B. BEARD	lina			BY LINA AND ADELIA B. BEARD
1399	PERSON	ERNEST SETON-THOMPSON				BY ERNEST SETON-THOMPSON
1412	PERSON	Buller				With Buller in Natal
1412	LOCATION	Natal				With Buller in Natal
1413	PERSON	W. Rainey	illustrated			Illustrated by W. Rainey, R.I. 12mo, $1.50.
1413	LOCATION	R.I.	illustrated			Illustrated by W. Rainey, R.I. 12mo, $1.50.
1416	PERSON	Garibaldi				Out with Garibaldi
1427	LOCATION	HAYTI	roving;commission;or;insurrection	black		A Roving Commission; OR, THROUGH THE BLACK INSURRECTION AT HAYTI.
1428	LOCATION	La Vende	tale		rise	A Tale of the Rising in La Vende.
1430	PERSON	Napoleon	story;s;invasion			A Story of Napoleon"s Invasion of Egypt."
1430	LOCATION	Egypt	story;s;invasion			A Story of Napoleon"s Invasion of Egypt."
1431	LOCATION	Glendower	tale;hotspur			A Tale of Hotspur and Glendower.
1435	PERSON	Cochrane	tale;exploit;lord;waters			A Tale of the Exploits of Lord Cochrane in South American Waters.
1436	LOCATION	Paris	tale;white;hoods			A Tale of the White Hoods of Paris.
1438	PERSON	Napoleon	story;s;retreat			A Story of Napoleon"s Retreat from Moscow."
1438	LOCATION	Moscow	story;s;retreat			A Story of Napoleon"s Retreat from Moscow."
1439	LOCATION	Rhodes	tale;siege			A Tale of the Siege of Rhodes.
1440	PERSON	Tippoo Said	story			A Story of the War with Tippoo Said.
1441	LOCATION	Colorado	story;adventure			A Story of Adventure in Colorado.
1452	PERSON	Charles Scribner	u;s;sons;publishers			u" Charles Scribner"s Sons--Publishers"
