PARAGRAPH NUMBER	ENTITY TYPE	ENTITY	CO-OCCURRING NOUNS	CO-OCCURRING ADJECTIVES	CO-OCCURRING VERBS	SENTENCE
650	PERSON	Terence	dream;trouble	different;much;same	see;be;make;be;be	She saw Terence in her dreams, and he was a very different Terence from the one who made her so much trouble when she was awake, and yet he was partly the same.
650	PERSON	Terence	dream;trouble	different;much;same	see;be;make;be;be	She saw Terence in her dreams, and he was a very different Terence from the one who made her so much trouble when she was awake, and yet he was partly the same.
652	PERSON	Peter	nobody	sure	say;leave	"Sure," said Peter, "we left nobody there but Terence."
652	PERSON	Terence	nobody	sure	say;leave	"Sure," said Peter, "we left nobody there but Terence."
658	PERSON	Terence	fiddle;money;time	own;little;last	beg;buy;save;buy	But when Terence begged them to buy him a fiddle of his own, they saved up money a little at a time, and at last they bought him one.
665	PERSON	Kathleen	story	near	seem;be;come;want;be	But it never seemed to be because of the stories that he came; he only wanted to be near Kathleen."
669	PERSON	O `` Brien	mrs.		make;think;be	u"And all this made Mrs. O"Brien think the more that Terence was one of them."
669	PERSON	Terence	mrs.		make;think;be	u"And all this made Mrs. O"Brien think the more that Terence was one of them."
697	PERSON	Brien	mrs.;o;s;story		listen	u"So Mrs. O"Brien and Kathleen listened to Terence"s story."
697	PERSON	Kathleen	mrs.;o;s;story		listen	u"So Mrs. O"Brien and Kathleen listened to Terence"s story."
697	PERSON	Terence	mrs.;o;s;story		listen	u"So Mrs. O"Brien and Kathleen listened to Terence"s story."
698	PERSON	Donald	\;s;ox		go;kill	So one night they went and killed Donald\"s ox.
699	PERSON	Donald	hand;magpie;coat	round	put;catch;hold	With that Donald put round his hand and caught the magpie and held it under his coat.
705	PERSON	Donald	m;man;\	poor	\;say	"\"I\"m a poor man,\" says Donald.
710	PERSON	Donald	price;hide;home;vengeance	common	get;get;come;vow	But when they got there they could get no more for them than the common price of hides, and they came home again vowing vengeance on Donald.
712	PERSON	Donald	word;word;sorrow;something;t;way;chance	particular;long	say;keep;think;\;be;give;think;wasn;begin;see;get;do;be;think	"Well, Donald said never a word, but he kept thinking, and those words \"all your sorrows are nearly over\" gave him something particular to think about, and it wasn\"t long till he began to see his way, if he could only get a chance to do what he was thinking of.
717	PERSON	Donald	money;world		\;make;do;say;begin;sing	"\"There\"s not money enough in the world to make me do it,\" says Donald, and he began singing again.
723	PERSON	Donald	home;cattle		go;drive	Then Donald went away home, driving the cattle before him.
730	PERSON	Donald	home;cattle;farm;money;farm	own	go;look;make;take;have;leave	And then Donald went home and looked after his cattle and his farm, and soon he made money enough to take the two farms that Hudden and Dudden had left, besides his own.
730	PERSON	Hudden	home;cattle;farm;money;farm	own	go;look;make;take;have;leave	And then Donald went home and looked after his cattle and his farm, and soon he made money enough to take the two farms that Hudden and Dudden had left, besides his own.
730	PERSON	Dudden	home;cattle;farm;money;farm	own	go;look;make;take;have;leave	And then Donald went home and looked after his cattle and his farm, and soon he made money enough to take the two farms that Hudden and Dudden had left, besides his own.
736	PERSON	Da Luan	da;mort			Da Luan, da Mort,
737	PERSON	Da Luan	da;mort			Da Luan, da Mort,
738	PERSON	Da Luan	da;mort			Da Luan, da Mort.
743	PERSON	Da Luan	da;mort			Da Luan, da Mort,
744	PERSON	Da Luan	da;mort			Da Luan, da Mort,
745	PERSON	Da Luan	da;mort			Da Luan, da Mort,
746	PERSON	Cadine	augus;da			Augus da Cadine.
756	PERSON	Lusmore	mother;way;hump;boy;way	rid;own;same	hear;have;have;take;think;get	So when his mother heard the way Lusmore had had the hump taken off him, she thought maybe her boy could get rid of his own in the same way.
757	PERSON	Lusmore	end;spot;rath;hunchback;everything	little	go;show;have;sit;leave;tell;do;have;do	And in the end he went with them to show them the very spot where he had sat down beside the rath, and there they left the little hunchback, and told him to do everything just as Lusmore had done it.
758	PERSON	Lusmore	song;singing	better	be;sing;hear;have;have;improve;be	And they were singing much better now than when Lusmore heard them first, for they had the song now as he had improved it for them, and they were singing:
760	PERSON	Da Luan	da;mort			Da Luan, da Mort,
761	PERSON	Da Luan	da;mort			Da Luan, da Mort,
762	PERSON	Da Luan	da;mort			Da Luan, da Mort,
763	PERSON	Cadine	augus;da			Augus da Cadine.
766	PERSON	Lusmore	breath;\;meaning;way	same;same	find;say;want;have;want;reward;do	"And he just found breath enough to say: \"I want the same that Lusmore had,\" meaning by that he wanted them to reward him the same way they did Lusmore.
766	PERSON	Lusmore	breath;\;meaning;way	same;same	find;say;want;have;want;reward;do	"And he just found breath enough to say: \"I want the same that Lusmore had,\" meaning by that he wanted them to reward him the same way they did Lusmore.
771	PERSON	Terence			say	said Terence.
777	PERSON	Kathleen	house;side;park	own;west	have;be;live;be	Then he had a house of his own, over on the west side of the Park, and it was there that Kathleen lived when she was eighteen years old."
778	PERSON	Peter	head;rib;people;s;thing;head;window	other	be;get;break;be;have;pay;have;break	He was constantly getting his head and his ribs broken, and Peter was always having to pay for other people"s things that he had broken, from their heads to their windows."
780	PERSON	Kathleen	everybody;everybody		say;play	And everybody said he played so wonderfully--everybody except Kathleen.
784	PERSON	Ellen	side;park;friend;north;end;park;hill;time	east;many	live;live;walk;have;tell	Ellen and Peter still lived on the east side of the Park, and some of her friends lived there, too, so that Kathleen often walked through the north end of the Park, near that hill that I have told you about so many times before.
784	PERSON	Peter	side;park;friend;north;end;park;hill;time	east;many	live;live;walk;have;tell	Ellen and Peter still lived on the east side of the Park, and some of her friends lived there, too, so that Kathleen often walked through the north end of the Park, near that hill that I have told you about so many times before.
784	PERSON	Kathleen	side;park;friend;north;end;park;hill;time	east;many	live;live;walk;have;tell	Ellen and Peter still lived on the east side of the Park, and some of her friends lived there, too, so that Kathleen often walked through the north end of the Park, near that hill that I have told you about so many times before.
802	PERSON	Naggeneen	s;something;thing;soul		do;be;talk;have	Maybe it\"s something to do with them things Naggeneen was always talking about our having no souls--"
807	PERSON	Terence	thing;way;man	right	do;tell;do;tell;bring;learn;teach	"Did he tell us the right thing to do when he told us to bring Terence here to learn the ways of men and to teach them to us?"
808	PERSON	Terence	way	easier;other	be;have	And Terence is easier to have about other ways."
810	PERSON	Naggeneen	plan;use		know;say;be	And you know Naggeneen himself said the plan would be no use."
824	PERSON	Kathleen	other		overtake;walk;keep;hurry	She overtook them and the three walked on together, though the others could scarcely keep up, Kathleen hurried so.
829	PERSON	Kathleen	lantern;trouble;dancing;light;dancer;swarm;firefly		do;seem;have;see;have;see;have;think;be	These and the lanterns did not seem to trouble them at all in dancing, and if Kathleen had seen the lights and had not seen the dancers, she would have thought that they were a swarm of fireflies.
831	PERSON	Kathleen	other;matter;way;midst;company;edge;dancer;hand;whirl;circle;foot;ground	close;whole;very;great	dance;move;be;find;join;tell;be;touch	They danced around by themselves, moving in and out among the others, no matter how close together they were, and always finding their way, now in the midst of the whole company and now out beyond the very edge of it, and then suddenly all the dancers would join hands and whirl about in a great circle, so fast that Kathleen could not tell whether her feet were touching the ground at all.
833	PERSON	Kathleen	man		have;be;dance;whisper;be;go	The man who had been dancing with Kathleen whispered to her: "You are to go with us."
834	PERSON	Kathleen	grass-plot;foot;ground;grass;pool;water;s;pool	shell-shaped;little;little	leave;move;tell;be;come;own	They all left the shell-shaped grass-plot and moved along together--Kathleen could scarcely tell even now whether her feet were on the ground or not--over the grass, till they came to a little pool of water--Kathleen"s own little pool."
834	PERSON	Kathleen	grass-plot;foot;ground;grass;pool;water;s;pool	shell-shaped;little;little	leave;move;tell;be;come;own	They all left the shell-shaped grass-plot and moved along together--Kathleen could scarcely tell even now whether her feet were on the ground or not--over the grass, till they came to a little pool of water--Kathleen"s own little pool."
837	PERSON	Kathleen	water;star;water;moment;water;floor;gold	faint;yellow	look;see;be;walk;see;be;be;shine;be;walk;seem;be	Then, as Kathleen looked down at the water again, to see if she were really walking on it, she saw that there were no more stars, but the water was of a faint, shining yellow, and in a moment she was not walking on water any more, but on a floor, that seemed to her to be all of gold.
840	PERSON	Kathleen	hill;life;anything	wonderful	be;have;know;have;see	And all this was inside a hill that Kathleen had known all the years of her life, and she had never seen anything wonderful about it.
847	PERSON	Kathleen	fairy;fairy	little;smaller;little	have;be;wonder;be;seem;be;say;have;hear;be	You have been wondering all along how it was that the fairies seemed to Kathleen to be, as I said, only a little smaller than herself, when you have always heard that fairies were so very little."
860	PERSON	Kathleen	queen		say;do;know;have;bring	"Kathleen," said the Queen, "do you know why they have brought you here?"
873	PERSON	Kathleen	t	sure	be;say;let;talk;see;don;know;be	"I am not sure," Kathleen said, "that I ought to let you talk to me, because, you see, I don\"t know who you are."
875	PERSON	Terence	\;s;nothing;name		\;have	\" It\"s Terence nothing; I have no name at all except Terence."
875	PERSON	Terence	\;s;nothing;name		\;have	\" It\"s Terence nothing; I have no name at all except Terence."
876	PERSON	Terence	boy;t;bit		know;name;say;don	"I know a boy named Terence," Kathleen said, "and I don\"t like him a bit."
876	PERSON	Kathleen	boy;t;bit		know;name;say;don	"I know a boy named Terence," Kathleen said, "and I don\"t like him a bit."
880	PERSON	Kathleen O	name		be	My name is Kathleen O\"Brien."
880	PERSON	Brien	name		be	My name is Kathleen O\"Brien."
882	PERSON	Kathleen	name;name	last;much;last	have;say;be;be;call	"But if you have only one name," Kathleen said, "it is your last name just as much as it is your first, so perhaps you ought to call me by my last one."
883	PERSON	Terence	name;name;haven;t	last	answer;see;be;think;call	"Oh, no," Terence answered; "you see my name ought to be a first name, only I haven\"t any last one, so I think I ought to call you by your first one."
890	PERSON	Kathleen	mother;father	dead	be;answer;have	"My mother is dead," Kathleen answered; "I have a father."
892	PERSON	Kathleen			ask	Kathleen asked.
894	PERSON	Kathleen	course;\;t;everybody;school	doesn	answer;have;go	"Why, of course," Kathleen answered; "doesn\"t everybody have to go to school?"
896	PERSON	Kathleen	idea	funny	say	"Why, no, indeed," said Kathleen; "what a funny idea!"
898	PERSON	Kathleen	thing;t		want;know;say;don;go;school	"If they want to know things," said Kathleen, "why don\"t they go to school themselves?"
902	PERSON	Terence	line;letter;board;piece;chalk		make	Terence made some lines and some letters on the board, with a piece of chalk.
904	LOCATION	Kathleen	man		say;stand	said one of the men who stood near Kathleen.
905	PERSON	Terence	hasn;t		tell	Hasn\"t Terence told you that?"
906	PERSON	Terence	abc;triangle;side;ab;ac	equal	go;let;be;be	Terence went on: "Let ABC be any triangle in which the sides AB and AC are equal."
909	PERSON	Terence	man;nothing;triangle;triangle;bac;cab	more	say;go;consider	The man said nothing more and Terence went on: "Now, consider this triangle as two triangles, BAC and CAB."
913	PERSON	Terence			go	Go on, Terence."
915	PERSON	Terence	blackguard	clear	say;do;understand;have;make	"There, you blackguards," he said, "do you understand it at all, now that Terence has made it clear to you?"
922	PERSON	Terence	difference;note;bow	clear	tell;feel;draw	She could scarcely tell the difference, and yet she could feel it in every clear note that Terence drew out with his bow.
923	PERSON	Kathleen	something;longing	deep	seem;mean;tell;be;go	It seemed to Kathleen to mean so much, and yet she could not tell what, except that there was something like a deep longing that went all through it.
930	PERSON	Kathleen	king;time;child		come;say;be;come;be;look	The King came up to Kathleen and said: "It is time for you to come and be looking after the child again."
932	PERSON	Kathleen	pillow;queen		have;answer;come;get	"I have it here under my pillow," the Queen answered; "come here and get it, Kathleen."
933	PERSON	Kathleen	queen;bent		ask	the Queen asked, as Kathleen bent over her.
934	PERSON	Kathleen	queen;harm		do;know;answer;look;think;be;say;give	Kathleen did not quite know whether she ought to answer or not, but the Queen looked at her so kindly that she thought that there could be no harm, and she said: "Only what Terence gave me."
934	PERSON	Terence	queen;harm		do;know;answer;look;think;be;say;give	Kathleen did not quite know whether she ought to answer or not, but the Queen looked at her so kindly that she thought that there could be no harm, and she said: "Only what Terence gave me."
938	PERSON	Kathleen	king;gold;couch;queen;s;cradle	tired	leave;be;lay;have;be;place;be	u"The King left them, and Kathleen, who was really very tired, lay down on another gold couch, almost like the Queen"s, that had been placed near the cradle, and in a minute she was asleep."
940	PERSON	Terence			go	Then Terence went away.
941	PERSON	Kathleen	whenever;time;meal;hall		be;go;find;eat;eat;bring	Whenever it was time for a meal they went out into the hall, and there Kathleen always found Terence, and she always ate with him, and ate only what he brought her.
941	PERSON	Terence	whenever;time;meal;hall		be;go;find;eat;eat;bring	Whenever it was time for a meal they went out into the hall, and there Kathleen always found Terence, and she always ate with him, and ate only what he brought her.
942	PERSON	Kathleen	king;time		come;say;be;go;dance;come	In the evening the King came to her and said, "Kathleen, it is time for us to go and dance again; come with us."
943	PERSON	Terence	hand;don;\;t;t	afraid	take;say;go;don;go;do;be;come	Then Terence took her by both hands and said, "Don\"t go with them; don\"t go; if you do, I am afraid that you will never come back."
948	PERSON	Kathleen			come;answer	"I will come back," Kathleen answered.
955	PERSON	Ellen	home;harm		get;tell;have;go;have;say;be;go;do;think;have;come	Even when he got there and Ellen told him that Kathleen had gone away hours ago and had said that she was going home, he did not think that any harm could have come to her."
955	PERSON	Kathleen	home;harm		get;tell;have;go;have;say;be;go;do;think;have;come	Even when he got there and Ellen told him that Kathleen had gone away hours ago and had said that she was going home, he did not think that any harm could have come to her."
957	PERSON	John	sullivans;way;way;nonsense	likely	go;take;think;be;take;look;know;search;be	Late at night John went to the Sullivans" again, taking the way that he thought Kathleen would be likely to take, and looking everywhere for her, though he knew that to search for her in such a way as that was nonsense."
957	PERSON	Kathleen	sullivans;way;way;nonsense	likely	go;take;think;be;take;look;know;search;be	Late at night John went to the Sullivans" again, taking the way that he thought Kathleen would be likely to take, and looking everywhere for her, though he knew that to search for her in such a way as that was nonsense."
958	PERSON	Kathleen			be;be	There was not one of them that was at all like Kathleen.
959	PERSON	Kathleen	other		tell;have;drop;have;say;want;get;have;call;have;answer;have;go;think;follow	She told how Kathleen had dropped behind the others, though she had said that she wanted to get home early, how they had called to her, how she had answered, and how they had gone on, thinking that she would soon follow.
962	PERSON	Kathleen	mother	dead	tell;answer;be	He told his mother this and she answered: "Kathleen is not dead."
966	PERSON	Kathleen	mrs.;o;ld;banshee		die;say;\;hear	"Kathleen could never die," Mrs. O\"Brien said, "without I\"ld hear the banshee."
966	PERSON	Brien	mrs.;o;ld;banshee		die;say;\;hear	"Kathleen could never die," Mrs. O\"Brien said, "without I\"ld hear the banshee."
967	LOCATION	Ireland	s;banshee		\	There\"s banshees only in Ireland."
969	PERSON	John	\;t;\;t	didn;didn	hear;ask;die;know;be;die	"Then why didn\"t you hear her," John asked "before Kitty died, and why didn\"t you know before that she was to die?"
969	PERSON	Kitty	\;t;\;t	didn;didn	hear;ask;die;know;be;die	"Then why didn\"t you hear her," John asked "before Kitty died, and why didn\"t you know before that she was to die?"
970	PERSON	Kathleen	couldn;\;t;ld;banshee		die;\;hear	Kathleen couldn\"t die without I\"ld hear the banshee."
973	PERSON	Shaun	mrs.;o		say;do;know;be;go	"Shaun," said Mrs. O\"Brien, "do you know when it was that Kathleen went away?"
973	PERSON	Brien	mrs.;o		say;do;know;be;go	"Shaun," said Mrs. O\"Brien, "do you know when it was that Kathleen went away?"
973	PERSON	Kathleen	mrs.;o		say;do;know;be;go	"Shaun," said Mrs. O\"Brien, "do you know when it was that Kathleen went away?"
974	PERSON	John			say	said John.
977	PERSON	John		to-day	be	"And what is to-day, John?"
978	PERSON	Don	\;t;time		think	Don\"t I think of it all the time?"
979	PERSON	Brien	time;mrs.;o;people;power	good;more	\;s;say;have	"There\"s no time in the year," Mrs. O\"Brien said, "when the Good People have more power than on May Eve."
980	PERSON	Kathleen	mother;s		die;bear;have;leave;\;go;bear	When her mother died I could bear it, because I had Kathleen left, but now she\"s gone, and how can I bear it?"
982	PERSON	John			ask	John asked.
983	PERSON	Kathleen	girl	last	be;see	"With me and with the girls that were with Kathleen that night and saw her last."
985	PERSON	Brien	care;mrs.;o;ll	little	\;take;say;\;be;go	"I\"ve taken care of all that," Mrs. O\"Brien said; "they\"ll be here in a little while to go with us."
986	PERSON	Brien	time;mrs.;o;to-night		be;ask;meet	"Was it about this time of the day," Mrs. O\"Brien asked, "that you met Kathleen here a year ago to-night?"
986	PERSON	Kathleen	time;mrs.;o;to-night		be;ask;meet	"Was it about this time of the day," Mrs. O\"Brien asked, "that you met Kathleen here a year ago to-night?"
988	PERSON	Brien	mrs.;o;way;place;instant	last	take;go;go;show;stand;see	"Then you must take us," Mrs. O\"Brien went on, "just the way that you went, and show us the very place where Kathleen stood, the last instant that you saw her."
988	PERSON	Kathleen	mrs.;o;way;place;instant	last	take;go;go;show;stand;see	"Then you must take us," Mrs. O\"Brien went on, "just the way that you went, and show us the very place where Kathleen stood, the last instant that you saw her."
992	PERSON	Brien	mrs.;o		whisper;stand;do;speak;stir;call;do;tell;do	Mrs. O\"Brien whispered: "Stand still here, all of you, and do not speak or stir unless I call to you; then do whatever I tell you, and do it quickly."
993	PERSON	Kathleen	nothing;arm;hand;forehead	left;right	see;hurry;see;be;lead;hold	Still they could see nothing except her, but now she hurried toward them, and suddenly they saw that she was leading Kathleen, with her left arm around her and holding her right hand against her forehead."
996	PERSON	John	rest	fast	lead;follow	And John led her away as fast as he could, while the rest followed.
1002	PERSON	Brien	mrs.;o		ask	Mrs. O\"Brien asked.
1004	PERSON	Brien	mrs.;o		ask	Mrs. O\"Brien asked.
1023	PERSON	Oisin	other		call;go;speak	She called to Oisin, and he went apart from the others to speak with her.
1024	PERSON	Oisin	princess;moonlight;voice;wind;harp;love;speaking	beautiful;sweet;eager	be;be;blow;be;go;have;do	The Princess was as beautiful as moonlight, and her voice was as sweet as the wind blowing on a harp, and Oisin was in love with her and eager to go before she had done speaking.
1028	PERSON	Oisin	palace;table;thing;world	beautiful;outside;beautiful;best	think;be;be;be;think;eat;drink;be	And Oisin thought that if the palace was beautiful outside, it was much more beautiful inside, and as for the table that was before him, he could not think of any of the best things in the world to eat and to drink that were not on it.
1029	PERSON	Oisin	hunting;game	finest	ride;find;have;see	Sometimes they rode hunting together, and everywhere they found game, the finest that Oisin had ever seen.
1031	PERSON	Erin	air;sunshine;mist;chill	sweet;warm;more	be;be;like;breathe;feel;see	The air here is sweet and the sunshine is warm, but I should like to breathe the mists and to feel the chill again, if I could only see Erin once more!"
1032	PERSON	Kathleen	nothing;way;woman	old	say;pause;go	Kathleen said nothing when she paused in this way, and in a minute the old woman went on:"
1038	PERSON	Erin	something;cloud;horizon;shore	little;higher;wider;misty;brown;beautiful;green	see;rise;grow;fade;see	And now he saw something like a little cloud on the horizon, and it rose higher and grew wider, and then its misty brown faded away and he saw the beautiful green shores of Erin."
1039	PERSON	Erin	woman;shore	old;beautiful;beautiful;green	pause;say	The old woman paused again and said over softly to herself: "The beautiful--beautiful green shores of Erin."
1043	PERSON	Oisin	ground;princess;man	old;weak;helpless;blind;hollow-cheeked;wrinkled;white-haired	lay;have;forbid;touch	Oisin lay there on the ground of Erin, which the Princess had forbidden him to touch, an old man, weak, helpless, blind, hollow-cheeked, wrinkled, white-haired.
1043	PERSON	Erin	ground;princess;man	old;weak;helpless;blind;hollow-cheeked;wrinkled;white-haired	lay;have;forbid;touch	Oisin lay there on the ground of Erin, which the Princess had forbidden him to touch, an old man, weak, helpless, blind, hollow-cheeked, wrinkled, white-haired.
1044	PERSON	Oisin	tir-na-n-oge	old	be;mourn;brave;seem	And always Oisin was mourning for the brave old days of Finn McCool or for the days of Tir-na-n-Oge, which seemed to him now still farther off.
1044	PERSON	Finn McCool	tir-na-n-oge	old	be;mourn;brave;seem	And always Oisin was mourning for the brave old days of Finn McCool or for the days of Tir-na-n-Oge, which seemed to him now still farther off.
1045	LOCATION	St. Patrick	food;\;s;house	poor;scanty	be;give;seem	And so the food which was given to him in St. Patrick\"s house seemed poor and scanty to him.
1052	PERSON	Oisin	\		dig;say	"\"Dig it out,\" said Oisin.
1055	PERSON	Oisin	\		say	\" said Oisin.
1059	PERSON	Oisin	horn;\		blow;say	"\"Now blow the horn,\" said Oisin.
1067	PERSON	Oisin	man;spear;dog;point;heart	dead	hold;tell;come;be;catch;go;fall	"The man held the spear as Oisin told him, and when the dog came on he was caught upon the point of it, and it went through his heart and he fell dead.
1068	PERSON	St. Patrick	\;s;man		treat;do	And so after that all of St. Patrick\"s men treated him as well as did St. Patrick himself.
1068	PERSON	St. Patrick	\;s;man		treat;do	And so after that all of St. Patrick\"s men treated him as well as did St. Patrick himself.
1074	PERSON	Terence	other;other	busy	be;talk;come;sit;get	Then, when all the others were busy talking among themselves, Terence suddenly came and sat close to her, and between her and the others, so that she could not get away from him.
1076	PERSON	Kathleen	t;t;t;time		don;know;answer;seem;\;remember;\;think;be;do;fill	"I don\"t know," Kathleen answered; "it seemed only a day to me, and I can\"t remember and I can\"t think what it was that I did to fill all that time."
1077	PERSON	Terence			say	said Terence.
1080	PERSON	Kathleen	t		don;know;say	"I don\"t know," said Kathleen.
1081	PERSON	Terence			ask	Terence asked.
1084	PERSON	Kathleen	promise;t;way;t;anybody;t		be;say;win;let;talk;don;see;matter;say;win;tell	"It was no promise at all," Kathleen said, "and I won\"t let you talk to me that way, and I don\"t see that it matters to you what he--what anybody said to me anywhere, and I won\"t tell you any more."
1087	PERSON	Kathleen	feeling		have;move;look;try;find	Kathleen had a feeling that she could not move while he looked at her, although when she tried it she found that she could.
1088	PERSON	Terence	promise;oftener;nothing;nothing;way;nothing;anything	next;same	meet;remind;call;say;look;feel;do;tell;do;have;do	Sometimes after that, when she and Terence met, he reminded her again of what he called the promise, but oftener he said nothing, or next to nothing, and only looked at her in that same way, and then she felt as if she could do nothing of herself, and that if he told her to do anything, she would have to do it.
1093	PERSON	Terence	pool;time	sure;right	feel;go;meet;come;go	Then she felt sure that if she went to the pool at the right time of the day she should meet Terence when he came out or when he went in.
