PARAGRAPH NUMBER	ENTITY TYPE	ENTITY	CO-OCCURRING NOUNS	CO-OCCURRING ADJECTIVES	CO-OCCURRING VERBS	SENTENCE
0	LOCATION	SCOTLAND	folk-lore;legends			FOLK-LORE AND LEGENDS SCOTLAND
1	LOCATION	LONDON	w.;w.;gibbings;bury;st.;w.c.			W. W. GIBBINGS 18 BURY ST., LONDON, W.C. 1889
5	PERSON	Canobie Dick				Canobie Dick and Thomas of Ercildoun.
5	PERSON	Thomas of Ercildoun				Canobie Dick and Thomas of Ercildoun.
7	PERSON	Elphin Irving				Elphin Irving.
10	PERSON	Whippety Stourie				Whippety Stourie.
12	PERSON	Balmachie	u;laird;s		wife	u" The Laird of Balmachie"s Wife."
13	PERSON	Michael Scott				Michael Scott.
15	PERSON	Merman				The Fisherman and the Merman.
17	PERSON	Ewen	head	little		Ewen of the Little Head.
18	PERSON	Jock	mother			Jock and his Mother.
19	PERSON	Columba	saint			Saint Columba.
21	PERSON	Bogle	fiddler			The Fiddler and the Bogle of Bogandoran.
21	LOCATION	Bogandoran	fiddler			The Fiddler and the Bogle of Bogandoran.
22	PERSON	Thomas	rhymer			Thomas the Rhymer.
25	PERSON	Merlin	u;fairy;s			u" The Fairies of Merlin"s Craig."
25	PERSON	Craig	u;fairy;s			u" The Fairies of Merlin"s Craig."
26	PERSON	Rory Macgillivray				Rory Macgillivray.
29	PERSON	Stane	u;maun			u" Mauns" Stane."
32	PERSON	Leith	fairy;boy			The Fairy Boy of Leith.
34	PERSON	Tarbat	u;lord;s;relation			u" Lord Tarbat"s Relations."
35	PERSON	Bogle				The Bogle.
36	PERSON	Daoine Shie				Daoine Shie, or the Men of Peace.
37	PERSON	Bree	death			The Death "Bree."
40	LOCATION	Scotland	fairy;brownie;bogle;being;hill;nook;stream;land;counterpart;dress	same;different;national	be;have;people;distinguish;clothe;be	The fairies, the brownies, the bogles of Scotland are the same beings as those with whom the Irish have peopled the hills, the nooks, and the streams of their land, yet how different, how distinguished from their counterparts, how clothed, as it were, in the national dress!
43	PERSON	Dick	curiosity;hope;gain;horse;way;bargain;chap;neighbourhood;courtesy;mutchkin	mere;mixed;several;dry;unlucky	do;know;be;have;sell;begin;complain;be;hint;live;deal;treat	I do not know whether it was from mere curiosity, or whether some hope of gain mixed with it, but after Dick had sold several horses in this way, he began to complain that dry bargains were unlucky, and to hint, that since his chap must live in the neighbourhood, he ought, in the courtesy of dealing, to treat him to half a mutchkin."
45	LOCATION	Kippilaw	foot;eminence;witch-meeting;windmill;conductor;hillside;passage;cavern;spot	famous;neighbouring	be;be;startle;observe;enter;acquaint;have;see;hear	At the foot of this eminence, which is almost as famous for witch-meetings as the neighbouring windmill of Kippilaw, Dick was somewhat startled to observe that his conductor entered the hillside by a passage or cavern, of which he himself, though well acquainted with the spot, had never seen nor heard.
45	PERSON	Dick	foot;eminence;witch-meeting;windmill;conductor;hillside;passage;cavern;spot	famous;neighbouring	be;be;startle;observe;enter;acquaint;have;see;hear	At the foot of this eminence, which is almost as famous for witch-meetings as the neighbouring windmill of Kippilaw, Dick was somewhat startled to observe that his conductor entered the hillside by a passage or cavern, of which he himself, though well acquainted with the spot, had never seen nor heard.
57	LOCATION	America	personage;opinion;peasantry;consummation;prophecy;exaction;rent;poverty;introduction;sheep;people	common;exorbitant	have;appear;be;be;fulfil;reduce;banish	All these personages have appeared since; and it is the common opinion of the peasantry, that the consummation of the prophecy was fulfilled, when the exaction of the exorbitant rents reduced the Highlanders to poverty, and the introduction of the sheep banished the people to America.
58	PERSON	Kenneth Oer	gift;degree;discretion;time;divination	extraordinary;last;near	have;be;do;appear;have;use;exercise;be;pay	Whatever might have been the gift of Kenneth Oer, he does not appear to have used it with an extraordinary degree of discretion; and the last time he exercised it, he was very near paying dear for his divination.
59	PERSON	Kenneth	genius;condition;pursuer;sacrifice;pebble;enemy;attempt;prophecy;escape	evil;better;unknown;certain;enraged	have;forsake;be;be;be;outstrip;have;hear;make	Whether his evil genius had now forsaken him, or his condition was better than that of his pursuers, is unknown, but certain it is, Kenneth, after the sacrifice of the pebbles, outstripped his enraged enemies, and never, so far as I have heard, made any attempt at prophecy from the hour of his escape."
61	PERSON	Ian	dispute;man;term;blow;scuffle;boy;son;s;adversary;combatant;gripe;contention;event;house;iron;pot-crook;head;combat;life	friendly;close;firm;eager;doubtful;unfortunate	have;fall;have;be;proceed;observe;lock;be;run;bring;salute;relinquish;depart;ensue	u"Having fallen into a dispute with a man with whom he had previously been on friendly terms, they proceeded to blows; in the scuffle, the boy, the son of Ian"s adversary, observing the two combatants locked in a close and firm gripe of eager contention, and being doubtful of the event, ran into the house and brought out the iron pot-crook, with which he saluted the head of the unfortunate Ian so severely, that he not only relinquished his combat, but departed this life on the ensuing morning."
61	PERSON	Ian	dispute;man;term;blow;scuffle;boy;son;s;adversary;combatant;gripe;contention;event;house;iron;pot-crook;head;combat;life	friendly;close;firm;eager;doubtful;unfortunate	have;fall;have;be;proceed;observe;lock;be;run;bring;salute;relinquish;depart;ensue	u"Having fallen into a dispute with a man with whom he had previously been on friendly terms, they proceeded to blows; in the scuffle, the boy, the son of Ian"s adversary, observing the two combatants locked in a close and firm gripe of eager contention, and being doubtful of the event, ran into the house and brought out the iron pot-crook, with which he saluted the head of the unfortunate Ian so severely, that he not only relinquished his combat, but departed this life on the ensuing morning."
63	PERSON	IRVING	elphin			ELPHIN IRVING.
80	PERSON	Tamlane		young	have;win	She that has won him, young Tamlane,
84	LOCATION	Corrievale	legend;people;mixture;elfin;adventure;story;queen;fairies;appeal;feeling;imagination	singular;human;traditional;domestic	be	In the legends of the people of Corrievale, there is a singular mixture of elfin and human adventure, and the traditional story of the Cupbearer to the Queen of the Fairies appeals alike to our domestic feelings and imagination.
85	PERSON	Elphin Irving	well;water;tree-root;door;shepherd;influence;sun;child;tale;sister;story;credence;people;scene	pure;old;wild;singular;full	leap;shade;tell;seem;have;gain;be;lay	A well of pure spring- water leaps out from an old tree-root before the door; and here the shepherds, shading themselves in summer from the influence of the sun, tell to their children the wild tale of Elphin Irving and his sister Phemie; and, singular as the story seems, it has gained full credence among the people where the scene is laid."
85	PERSON	Phemie	well;water;tree-root;door;shepherd;influence;sun;child;tale;sister;story;credence;people;scene	pure;old;wild;singular;full	leap;shade;tell;seem;have;gain;be;lay	A well of pure spring- water leaps out from an old tree-root before the door; and here the shepherds, shading themselves in summer from the influence of the sun, tell to their children the wild tale of Elphin Irving and his sister Phemie; and, singular as the story seems, it has gained full credence among the people where the scene is laid."
86	PERSON	bonnie Corriewater	o;time;gowan;bank;\;ane;shore;grave;remains;cloak;face;story	stiff;stark;foreign;bloody;military	have;pull;wi;lie;sob;draw;allow;proceed	O bonnie Corriewater, a thousand times have I pulled gowans on its banks wi\" ane that lies stiff and stark on a foreign shore in a bloody grave;" and, sobbing audibly, she drew the remains of a military cloak over her face, and allowed the story to proceed.
87	LOCATION	Dryfe Sands	inheritance;orphan;acre;plough;pasture;land;milk;cow;pet;sheep;people;delight;number;bonnet-piece;gold;broadsword;spear;ancestor;strength;courage;battle;minstrel;deed;arm;scotts	many;old;odd;such	leave;be;describe;take;be;add;have;wield;sing;rank	The inheritance left to the orphans may be briefly described: seventeen acres of plough and pasture land, seven milk cows, and seven pet sheep (many old people take delight in odd numbers); and to this may be added seven bonnet-pieces of Scottish gold, and a broadsword and spear, which their ancestor had wielded with such strength and courage in the battle of Dryfe Sands, that the minstrel who sang of that deed of arms ranked him only second to the Scotts and Johnstones.
91	PERSON	IRVING	phemie	fair		FAIR PHEMIE IRVING.
93	PERSON	Corrie	gay;glen		be	Gay is thy glen, Corrie,
95	PERSON	Green	glen		be	Green is thy glen, Corrie,
95	PERSON	Corrie	glen		be	Green is thy glen, Corrie,
128	PERSON	Phemie Irving	minstrel;interruption;s;grace;beauty;confidence;story	additional	establish;claim;give;pursue	u"This minstrel interruption, while it established Phemie Irving"s claim to grace and to beauty, gave me additional confidence to pursue the story."
131	PERSON	Corrie	terror;wraith;apparition;shriek;side;vale	impressed;loud;piercing;other	find;fail;inspire;utter;be;hear	She found him not, and, impressed with the terror which a wraith or apparition seldom fails to inspire, she uttered a shriek so loud and so piercing as to be heard at Johnstone Bank, on the other side of the vale of Corrie."
135	LOCATION	Corrievale	other;language;sister;belief;assurance;mind;feeling;heart;fear;youth;maiden;love;tryst;rank;chivalry	wild;delirious;old;new;full;superstitious;full;supernatural;more;unchristened	be;join;have;hear;be;add;comment;hold;be;carry;augment	They were soon joined by others who had heard the wild and delirious language of his sister: the old belief was added to the new assurance, and both again commented upon by minds full of superstitious feeling, and hearts full of supernatural fears, till the youths and maidens of Corrievale held no more love trysts for seven days and nights, lest, like Elphin Irving, they should be carried away to augment the ranks of the unchristened chivalry.
135	PERSON	Elphin Irving	other;language;sister;belief;assurance;mind;feeling;heart;fear;youth;maiden;love;tryst;rank;chivalry	wild;delirious;old;new;full;superstitious;full;supernatural;more;unchristened	be;join;have;hear;be;add;comment;hold;be;carry;augment	They were soon joined by others who had heard the wild and delirious language of his sister: the old belief was added to the new assurance, and both again commented upon by minds full of superstitious feeling, and hearts full of supernatural fears, till the youths and maidens of Corrievale held no more love trysts for seven days and nights, lest, like Elphin Irving, they should be carried away to augment the ranks of the unchristened chivalry.
139	LOCATION	Corrievale	topic;peasantry;tradition;enthusiasm;superstition;occurrence;life;people;home;subject;belief;imagination;supply	similar;full;ancient;commonest;wondrous;popular;poetic	associate;continue;converse;seek;renew;illustrate	"On these and similar topics, which a peasantry full of ancient tradition and enthusiasm and superstition readily associate with the commonest occurrences of life, the people of Corrievale continued to converse till the fall of evening, when each, seeking their home, renewed again the wondrous subject, and illustrated it with all that popular belief and poetic imagination could so abundantly supply.
168	LOCATION	Craigyburnwood			come	And when they came to Craigyburnwood,
172	PERSON	Heshbon Hill	acorn		find	I found the acorn on Heshbon Hill,
181	PERSON	Elph Irving		young	have;win	This night I have won young Elph Irving
186	PERSON	Corris	u;round;s;greenwood;tree			u" Round Corris"s greenwood tree."
203	PERSON	Elphin	steed;snow	young		And young Elphin a steed like December snow
228	PERSON	Ye	u	wan	have;mang	u" Ye had wan him frae "mang us a"."
235	LOCATION	Annandale	burial-ground;back;gravestone;lock;frost-rime;intensity;look;road;kirkyard;spirit;life;form;maid	ancient;broken;white;fairest	be;find;seat;watch;give;be;flee	She was found seated in the ancient burial-ground, her back against a broken gravestone, her locks white with frost-rime, watching with intensity of look the road to the kirkyard; but the spirit which gave life to the fairest form of all the maids of Annandale was fled for ever."
236	PERSON	Elphin Irving	story;peasant;name;fairies;\;cupbearer;title;sense;credence;dame;vale	such;singular;fullest;supernatural;industrious;virtuous;romantic	be;know;obtain	Such is the singular story which the peasants know by the name of "Elphin Irving, the Fairies\" Cupbearer"; and the title, in its fullest and most supernatural sense, still obtains credence among the industrious and virtuous dames of the romantic vale of Corrie.
236	PERSON	Corrie	story;peasant;name;fairies;\;cupbearer;title;sense;credence;dame;vale	such;singular;fullest;supernatural;industrious;virtuous;romantic	be;know;obtain	Such is the singular story which the peasants know by the name of "Elphin Irving, the Fairies\" Cupbearer"; and the title, in its fullest and most supernatural sense, still obtains credence among the industrious and virtuous dames of the romantic vale of Corrie.
239	PERSON	Clashnichd	dead;hamlet;repose;nothing;stillness;scene;oft;shriek;burst;slumberer;s;ear;anything;reflection	deep;solemn;shrill;poor;pleasant	surround;be;bury;disturb	In the dead of night, when the surrounding hamlets were buried in deep repose, and when nothing else disturbed the solemn stillness of the midnight scene, oft would the shrill shrieks of poor Clashnichd burst upon the slumberer"s ears, and awake him to anything but pleasant reflections."
240	PERSON	Clashnichd	proximity;abode;haunt;misfortune;family;audience;s;lamentation;anything;entertainment	agreeable	be;be;cry;consider	From the proximity of his abode to their haunts, it was the misfortune of himself and family to be the nightly audience of Clashnichd"s cries and lamentations, which they considered anything but agreeable entertainment."
242	PERSON	James Gray	expertness;archer;marksman;age;_;man;time;ghost;incivility;redress	best;next	confide;be;allow;be;tell;do;fear;_;be;desire;choose;repeat;apply	Confiding, however, in his expertness as an archer--for he was allowed to be the best marksman of the age--James Gray told Clashnichd he did not fear him with all his might,--that _he_ was a man; and desired her, moreover, next time the ghost chose to repeat his incivilities to her, to apply to him, James Gray, for redress."
242	PERSON	Clashnichd	expertness;archer;marksman;age;_;man;time;ghost;incivility;redress	best;next	confide;be;allow;be;tell;do;fear;_;be;desire;choose;repeat;apply	Confiding, however, in his expertness as an archer--for he was allowed to be the best marksman of the age--James Gray told Clashnichd he did not fear him with all his might,--that _he_ was a man; and desired her, moreover, next time the ghost chose to repeat his incivilities to her, to apply to him, James Gray, for redress."
242	PERSON	James Gray	expertness;archer;marksman;age;_;man;time;ghost;incivility;redress	best;next	confide;be;allow;be;tell;do;fear;_;be;desire;choose;repeat;apply	Confiding, however, in his expertness as an archer--for he was allowed to be the best marksman of the age--James Gray told Clashnichd he did not fear him with all his might,--that _he_ was a man; and desired her, moreover, next time the ghost chose to repeat his incivilities to her, to apply to him, James Gray, for redress."
243	PERSON	Ben Baynac	howl;mountain;ghost;smoke;shot;air	hideous;responsive	re-echo;surround;groan;vanish	A hideous howl re-echoed from the surrounding mountains, responsive to the groans of a thousand ghosts; and Ben Baynac, like the smoke of a shot, vanished into air."
244	PERSON	Clashnichd	use;horse;home;s;rest		proceed;make;return;enjoy	Clashnichd then proceeded to make use of the horses, and James Gray returned home to enjoy his night"s rest."
244	PERSON	James Gray	use;horse;home;s;rest		proceed;make;return;enjoy	Clashnichd then proceeded to make use of the horses, and James Gray returned home to enjoy his night"s rest."
245	PERSON	Clashnichd	scarce;cheek;hand;adventure;breath;throat;complaint;unruliness;horse;one-half;furniture;trouble;stabling;service	arm-chair;bold;bitterest;more;worth	have;reach;recline;ruminate;enter;vent;have;break;cause;be	Scarce had he reached his arm-chair, and reclined his cheek on his hand, to ruminate over the bold adventure of the night, when Clashnichd entered, with her "breath in her throat," and venting the bitterest complaints at the unruliness of his horses, which had broken one-half of her furniture, and caused her more trouble in the stabling of them than their services were worth.
246	PERSON	James	to-morrow	tame;enough	rejoin;be	"Very well," rejoined James, "they shall be tame enough to-morrow."
248	LOCATION	Clashnichd	time;caldron;water;fire;caldron;wife;s;bosom	large;boiling;enraged	happen;be;suspend;overturn	It happened that there was at the time a large caldron of boiling water suspended over the fire, and this caldron the enraged wife overturned in Clashnichd"s bosom!"
249	LOCATION	Craig-Aulnaic	recovery;wild;lamentation	melancholy	scald;flee;utter;have;be;hear	Scalded beyond recovery, she fled up the wilds of Craig-Aulnaic, uttering the most melancholy lamentations, nor has she been ever heard of since.
260	PERSON	Whippety Stourie	name		be	That Whippety Stourie is my name."
269	PERSON	John	gentleman;fie;haste;rock;reel;spinning-wheel;house;ll;wife;bonnie;face;_	spin-spin-spinning	cry;go;burn;\;have;spoil	cried the gentleman; "then, John, Tam, and Dick, fie, go haste and burn every rock, and reel, and spinning-wheel in the house, for I\"ll not have my wife to spoil her bonnie face with _spin-spin-spinning_."
269	PERSON	Tam	gentleman;fie;haste;rock;reel;spinning-wheel;house;ll;wife;bonnie;face;_	spin-spin-spinning	cry;go;burn;\;have;spoil	cried the gentleman; "then, John, Tam, and Dick, fie, go haste and burn every rock, and reel, and spinning-wheel in the house, for I\"ll not have my wife to spoil her bonnie face with _spin-spin-spinning_."
269	PERSON	Dick	gentleman;fie;haste;rock;reel;spinning-wheel;house;ll;wife;bonnie;face;_	spin-spin-spinning	cry;go;burn;\;have;spoil	cried the gentleman; "then, John, Tam, and Dick, fie, go haste and burn every rock, and reel, and spinning-wheel in the house, for I\"ll not have my wife to spoil her bonnie face with _spin-spin-spinning_."
277	PERSON	James	sir		say	said Sir James.
278	LOCATION	Scotland	arm;\;ee;auld;\;wha;commission	strongest;surest;better	have;execute	The Black Douglas has the strongest arm an\" the surest ee in auld Scotland; an\" wha can execute my commission better than he?"
280	PERSON	James	ll;st.;\;e		\;see	"Ye\"ll see me again on St. James\" E\"en."
283	PERSON	Douglas	heat;onset;sir;dagger		kill	In the heat of the onset, Douglas killed Sir Thomas de Richmont with his dagger.
283	PERSON	Thomas de Richmont	heat;onset;sir;dagger		kill	In the heat of the onset, Douglas killed Sir Thomas de Richmont with his dagger.
284	PERSON	Cailon		last	be;kill;have;meet	Cailon was killed; he had met the Black Knight at last."
284	PERSON	Black Knight		last	be;kill;have;meet	Cailon was killed; he had met the Black Knight at last."
285	PERSON	James	sir;vaunt;gascon		cry	"So much," cried Sir James, "for the vaunt of a Gascon!"
286	PERSON	Neville	man	discomfited	be;slay	Neville was slain, and his men utterly discomfited."
287	PERSON	James Douglas	tent;rest;pain;sir;reappearance;woman	much;old	have;retire;take;toil;be;surprise;have;see	Having retired one night to his tent to take some rest after so much pain and toil, Sir James Douglas was surprised by the reappearance of the old woman whom he had seen at Linthaughlee.
287	LOCATION	Linthaughlee	tent;rest;pain;sir;reappearance;woman	much;old	have;retire;take;toil;be;surprise;have;see	Having retired one night to his tent to take some rest after so much pain and toil, Sir James Douglas was surprised by the reappearance of the old woman whom he had seen at Linthaughlee.
302	PERSON	MICHAEL SCOTT				MICHAEL SCOTT.
303	PERSON	Michael	distance;spot;piece;place;head;piece	great;middle;tail	be;reach;find;leave;be;go	The distance was not very great; and on reaching the spot, he found the middle and tail piece in the place where Michael left them, but the head piece was gone.
304	PERSON	Michael Scott	curiosity;purpose;serpent;fit;indisposition;request;fire;warmth;degree	wily;severe;highest;beneficial	fire;know;be;intend;be;seize;cause;prefer;be;allow;sleep;affirm;be	Fired with curiosity to know the purpose for which the serpent was intended, the wily Michael Scott was immediately seized with a severe fit of indisposition, which caused him to prefer the request that he might be allowed to sleep beside the fire, the warmth of which, he affirmed, was in the highest degree beneficial to him.
308	PERSON	Michael Scott	damage;class;community;operation;workman;part;work;point;fortrose;traveller;\;s;fairy	great;commercial;most;wonderful	see;sustain;order;demolish;leave;show;exploit	Seeing the great damage the commercial class of the community would sustain from the operation, he ordered the workmen to demolish the most part of their work; leaving, however, the point of Fortrose to show the traveller to this day the wonderful exploit of Michael Scott\"s fairies.
310	PERSON	Michael Scott	notice;anecdote;part;life	latter	close;recite	We shall close our notice of Michael Scott by reciting one anecdote of him in the latter part of his life.
318	PERSON	MERMAN	fisherman			THE FISHERMAN AND THE MERMAN.
320	LOCATION	Acres Gio	request;man;neck;seal;care;place;skeo;skin;part;contract;means;son;space;sea;mantle	ethereal;green	be;comply;grasp;commit;land;repair;be;deposit;fulfil;afford;revisit;spread	The request being complied with, the man grasped the neck of the seal, and committing himself to her care, she landed him safely at Acres Gio in Papa Stour; from which place he immediately repaired to a skeo at Hamna Voe, where the skin was deposited, and honourably fulfilled his part of the contract, by affording Gioga the means whereby her son could again revisit the ethereal space over which the sea spread its green mantle."
320	LOCATION	Papa Stour	request;man;neck;seal;care;place;skeo;skin;part;contract;means;son;space;sea;mantle	ethereal;green	be;comply;grasp;commit;land;repair;be;deposit;fulfil;afford;revisit;spread	The request being complied with, the man grasped the neck of the seal, and committing himself to her care, she landed him safely at Acres Gio in Papa Stour; from which place he immediately repaired to a skeo at Hamna Voe, where the skin was deposited, and honourably fulfilled his part of the contract, by affording Gioga the means whereby her son could again revisit the ethereal space over which the sea spread its green mantle."
320	LOCATION	Hamna Voe	request;man;neck;seal;care;place;skeo;skin;part;contract;means;son;space;sea;mantle	ethereal;green	be;comply;grasp;commit;land;repair;be;deposit;fulfil;afford;revisit;spread	The request being complied with, the man grasped the neck of the seal, and committing himself to her care, she landed him safely at Acres Gio in Papa Stour; from which place he immediately repaired to a skeo at Hamna Voe, where the skin was deposited, and honourably fulfilled his part of the contract, by affording Gioga the means whereby her son could again revisit the ethereal space over which the sea spread its green mantle."
320	PERSON	Gioga	request;man;neck;seal;care;place;skeo;skin;part;contract;means;son;space;sea;mantle	ethereal;green	be;comply;grasp;commit;land;repair;be;deposit;fulfil;afford;revisit;spread	The request being complied with, the man grasped the neck of the seal, and committing himself to her care, she landed him safely at Acres Gio in Papa Stour; from which place he immediately repaired to a skeo at Hamna Voe, where the skin was deposited, and honourably fulfilled his part of the contract, by affording Gioga the means whereby her son could again revisit the ethereal space over which the sea spread its green mantle."
323	LOCATION	Colzean	u;yore;proprietor;ancestor;marquis;country;title;lairds;o;co;name;co;s;cove;rock;castle		be;know;bestow	u" In the days of yore, the proprietors of Colzean, in Ayrshire (ancestors of the Marquis of Ailsa), were known in that country by the title of Lairds o" Co", a name bestowed on Colzean from some co"s (or coves) in the rock beneath the castle."
323	LOCATION	Ayrshire	u;yore;proprietor;ancestor;marquis;country;title;lairds;o;co;name;co;s;cove;rock;castle		be;know;bestow	u" In the days of yore, the proprietors of Colzean, in Ayrshire (ancestors of the Marquis of Ailsa), were known in that country by the title of Lairds o" Co", a name bestowed on Colzean from some co"s (or coves) in the rock beneath the castle."
323	LOCATION	Ailsa	u;yore;proprietor;ancestor;marquis;country;title;lairds;o;co;name;co;s;cove;rock;castle		be;know;bestow	u" In the days of yore, the proprietors of Colzean, in Ayrshire (ancestors of the Marquis of Ailsa), were known in that country by the title of Lairds o" Co", a name bestowed on Colzean from some co"s (or coves) in the rock beneath the castle."
