PARAGRAPH NUMBER	ENTITY TYPE	ENTITY	CO-OCCURRING NOUNS	CO-OCCURRING ADJECTIVES	CO-OCCURRING VERBS	VALENCE	AROUSAL	DOMINANCE	SENTENCE
836	PERSON	the lady	firelight;door;fish;time;bed;heath;wrapper;arbour;skin;tangle;side	little;wise;purple;large;green;gorgeous;feathered;cool	shine;be;throw;show;make;tell;go;open;grow	5.9871875	3.91	5.7146875	Then the lady told Tangle it was time to go to bed; and, opening another door in the side of the cottage, showed her a little arbour, cool and green, with a bed of purple heath growing in it, upon which she threw a large wrapper made of the feathered skins of the wise fishes, shining gorgeous in the firelight.
836	LOCATION	the cottage	firelight;door;fish;time;bed;heath;wrapper;arbour;skin;tangle;side	little;wise;purple;large;green;gorgeous;feathered;cool	shine;be;throw;show;make;tell;go;open;grow	5.9871875	3.91	5.7146875	Then the lady told Tangle it was time to go to bed; and, opening another door in the side of the cottage, showed her a little arbour, cool and green, with a bed of purple heath growing in it, upon which she threw a large wrapper made of the feathered skins of the wise fishes, shining gorgeous in the firelight.
840	LOCATION	the fire	pot;lady;side	lovely;other;grand	sit;find;boil;enter	5.85818181818	4.07727272727	5.92090909091	Entering, she found the pot boiling on the fire, and the grand, lovely lady sitting on the other side of it.
843	PERSON	the lady	word		be;say	6.42	4.162	6.17	The first words the lady said were,--
845	LOCATION	the moss	stone;mossy;name;moss;companion	favourite;whole	be;use;sit;read;give;cover;begin;say;have;grow	6.01888888889	3.65166666667	5.81944444444	Now Mossy was the name his companions had given him, because he had a favourite stone covered with moss, on which he used to sit whole days reading; and they said the moss had begun to grow upon him too.
846	PERSON	the lady	tear;eye	beautiful	wait;let;beg;sit	5.53375	3.98875	5.5325	But the lady begged him, with tears in her beautiful eyes, to sit, and let her wait on him.
862	PERSON	Tangle		unwilling	go;be	4.925	4.3625	4.92	Tangle was very unwilling to go.
863	PERSON	the lady	t;man	young	say;don;know	5.91	4.31	5.65285714286	I don"t know the young man," she said to the lady.
867	PERSON	the lady	country;name	other;afraid	do;remember;be;say;lose;go	5.56928571429	4.09714285714	5.54285714286	"And," said the lady, "if you should lose each other as you go through the--the--I never can remember the name of that country,--do not be afraid, but go on and on."
869	LOCATION	the forest	grandmother;mossy;tangle;time	sorry;fond;other;least	be;send;have;get	5.94583333333	3.74666666667	5.59333333333	By the time they got out of the forest they were very fond of each other, and Tangle was not in the least sorry that her grandmother had sent her away with Mossy.
873	LOCATION	the country	tear;longing;while;shadow	other	be;look;sit;whence;see;fall	5.076	3.889	5.338	After sitting for a while, each, looking up, saw the other in tears: they were each longing after the country whence the shadows fell.
874	LOCATION	the country	shadow;mossy		say;come;find;_	5.77666666667	3.73833333333	5.81333333333	"We _must_ find the country from which the shadows come," said Mossy.
876	LOCATION	the plain		little;able	be;cross;rest	6.033	3.522	5.336	--"But we must rest here for a little, and then we shall be able to cross the plain before night."
886	LOCATION	the stair	depth;mouth;sight	giddy;afraid	be;force;grow;turn;enter;throw	5.50785714286	4.145	5.42285714286	She was afraid to enter, and turning again towards the stair, grew giddy at sight of the depth beneath her, and was forced to throw herself down in the mouth of the cave.
886	LOCATION	the cave	depth;mouth;sight	giddy;afraid	be;force;grow;turn;enter;throw	5.50785714286	4.145	5.42285714286	She was afraid to enter, and turning again towards the stair, grew giddy at sight of the depth beneath her, and was forced to throw herself down in the mouth of the cave.
891	LOCATION	the mountain			be;come;lead	5.806	4.014	5.568	"And I am come to lead you through the mountain."
903	LOCATION	the way	shadow		say;fall;show	5.2225	4.0	5.185	"Yes--show me the way up to the country from which the shadows fall," said Tangle.
903	LOCATION	the country	shadow		say;fall;show	5.2225	4.0	5.185	"Yes--show me the way up to the country from which the shadows fall," said Tangle.
903	PERSON	Tangle	shadow		say;fall;show	5.2225	4.0	5.185	"Yes--show me the way up to the country from which the shadows fall," said Tangle.
921	LOCATION	the house	form;opening;face;part;amazement;man	majestic;beautiful;other;grand	start;see;return;lead;wait	5.81315789474	4.23947368421	5.73842105263	Returning to the opening that led into the other part of the house, she started back with amazement, for through it she saw the form of a grand man, with a majestic and beautiful face, waiting for her.
925	LOCATION	the way			show	5.38714285714	4.28285714286	5.15285714286	--But I must show you the way to the Old Man of the Earth."
926	LOCATION	the cave	corner;rock;opening;bath	opposite	be;see;lead	5.41363636364	3.83909090909	5.32727272727	He led her into the cave where the bath was, and there she saw, in the opposite corner, a second opening in the rock.
932	PERSON	Tangle	youth;ear		answer;hear	5.824	3.956	5.75	And the youth answered, and Tangle heard him, though not with her ears:--
934	LOCATION	the way	shadow		whence;tell;fall	5.21333333333	3.80166666667	4.89333333333	"Tell me the way to the country whence the shadows fall."
934	LOCATION	the country	shadow		whence;tell;fall	5.21333333333	3.80166666667	4.89333333333	"Tell me the way to the country whence the shadows fall."
940	LOCATION	the cave	ear;side		tell;lead;lay	5.48571428571	3.63428571429	5.38714285714	He led her to the side of the cave, and told her to lay her ear against the wall.
940	LOCATION	the wall	ear;side		tell;lead;lay	5.48571428571	3.63428571429	5.38714285714	He led her to the side of the cave, and told her to lay her ear against the wall.
945	LOCATION	the way			be;say	6.0	3.58666666667	5.73666666667	"That is the way," he said.
948	LOCATION	the hole	face	full;whole	be;look;throw;turn;stand;think	5.718	3.83466666667	5.57466666667	She turned and looked him full in the face--stood so for a whole minute, as she thought: it was a whole year--then threw herself headlong into the hole.
951	LOCATION	the earth	beast;word;heart;journey;fish;mossy;grandmother;everything;book;thing;bird;talk;man	same	be;say;see;understand;have;learn;put;sing;happen;mean	5.85413793103	4.00344827586	5.77034482759	Everything she had seen, or learned from books; all that her grandmother had said or sung to her; all the talk of the beasts, birds, and fishes; all that had happened to her on her journey with Mossy, and since then in the heart of the earth with the Old man and the Older man--all was plain: she understood it all, and saw that everything meant the same thing, though she could not have put it into words again.
969	LOCATION	the shore	water;figure	majestic;deep	be;roll;walk	5.719	4.001	5.402	A deep water rolled between it and the shore, upon which a majestic figure was walking alone.
977	LOCATION	the cave		other	gaze;reach;have;sit	5.695	3.68	5.71666666667	When they had reached the cave, they sat down and gazed at each other.
982	LOCATION	the way			go;know;have	5.982	3.904	5.332	And I know the way you have to go."
983	LOCATION	the country	shadow;mossy		say;whence;find;want;fall	5.49428571429	4.18428571429	5.44285714286	"I want to find the country whence the shadows fall," said Mossy.
1008	LOCATION	the country	shadow		go;be;whence;know;fall	5.73666666667	3.76333333333	5.2	They knew that they were going up to the country whence the shadows fall.
