PARAGRAPH NUMBER	ENTITY TYPE	ENTITY	CO-OCCURRING NOUNS	CO-OCCURRING ADJECTIVES	CO-OCCURRING VERBS	SENTENCE
896	PERSON	Maisie	habetrot;name;haste;thread;time;girl;home;mother	young	seem;be;call;hear;address;tell;make;tie;be;get;be;have;carry	She seemed to be called Slantlie Mab, for Maisie heard Habetrot address her by that name, telling her to make haste and tie up all the thread, for it was getting late, and it was time that the young girl had it to carry home to her mother.
897	PERSON	Maisie	thread;hole;case;queer;woman	little;old;angry	do;know;do;be;get;do;like;shout;be;be;watch	Maisie did not quite know what to do, or how she was to get the thread, for she did not like to shout down the hole in case the queer little old woman should be angry at being watched.
898	PERSON	Habetrot	path;hank;thread;hand		have;call;appear	However, Habetrot, as she had called herself, suddenly appeared on the path beside her, with the hanks of thread in her hand.
902	PERSON	Maisie	fire;sight;sight;pudding;pudding	low;bright;clear;hungry;fried;black;good	be;suggest;be;be	The fire was low, but bright and clear; and the sight of it and the sight of the puddings suggested to Maisie that she was very hungry, and that fried black puddings were very good.
911	LOCATION	London Town	duke;s;daughter		go;marry	One day he will go away to London Town and marry a Duke\"s daughter."
913	PERSON	Maisie	s;garden;gate;mother;garden;singing;line	strange	happen;be;ride;come	u"So it happened that he was riding along by Maisie"s garden gate as her mother came into the garden singing these strange lines."
915	PERSON	Maisie	s;mother;answer;house;nobleman;bridle;garden;gate	young;anxious	make;turn;walk;be;know;mean;hang;follow	u"Maisie"s mother made no answer, but turned and walked into the house; and the young nobleman, being very anxious to know what it all meant, hung his bridle over the garden gate, and followed her."
917	PERSON	Maisie	man;maiden;mother;door;stranger;mother;garden	young;industrious	ask;see;be;go;pull;have;hide;come;have;come;be	Then the young man asked to see the Maiden who was so industrious, and her mother went and pulled Maisie from behind the door, where she had hidden herself when the stranger came in; for she had come downstairs while her mother was in the garden.
920	PERSON	Maisie	s;mother;piece;fortune;everything;wedding	overjoyed;unexpected;good;ready;little;perplexed	be;imagine;busy;get;be	u"Maisie"s mother was overjoyed, as you may imagine, at this piece of unexpected good fortune, and busied herself in getting everything ready for the wedding; but Maisie herself was a little perplexed."
920	PERSON	Maisie	s;mother;piece;fortune;everything;wedding	overjoyed;unexpected;good;ready;little;perplexed	be;imagine;busy;get;be	u"Maisie"s mother was overjoyed, as you may imagine, at this piece of unexpected good fortune, and busied herself in getting everything ready for the wedding; but Maisie herself was a little perplexed."
923	PERSON	Maisie			tell	And Maisie told her.
925	PERSON	Maisie	wedding;festivity;couple;castle;husband;walk;moonlight		be;have;settle;appoint;suggest;take	Accordingly, after all the wedding festivities were over and the couple had settled down at the Castle, on the appointed evening Maisie suggested to her husband that they should take a walk together in the moonlight.
927	PERSON	Maisie	rose;wheel	red;bent;lovely;sick	have;blush;feel;wonder;do;do;help	Maisie had blushed as red as a rose as she bent over the lovely wheel, and then felt quite sick, as she wondered whatever she would do if Habetrot did not help her.
927	PERSON	Habetrot	rose;wheel	red;bent;lovely;sick	have;blush;feel;wonder;do;do;help	Maisie had blushed as red as a rose as she bent over the lovely wheel, and then felt quite sick, as she wondered whatever she would do if Habetrot did not help her.
929	PERSON	Maisie	boulder;head;habetrot;habetrot;instant;woman	little;old	come;put;whisper;appear	As soon as they came to the boulder Maisie put her head against it and whispered, "Habetrot, dear Habetrot"; and in an instant the little old woman appeared.
930	PERSON	Maisie	root;oak;tree;wand;hand;door;fairy;valley;hole;stone	great;tiny;green;open;other;great	tap;hold;remember;have;notice;fly;follow;have;see	And then she tapped on the root of a great oak tree with a tiny wand which she held in her hand, and a green door, which Maisie never remembered having noticed before, flew open, and they followed the Fairy through it into the other valley which Maisie had seen through the hole in the great stone.
930	PERSON	Maisie	root;oak;tree;wand;hand;door;fairy;valley;hole;stone	great;tiny;green;open;other;great	tap;hold;remember;have;notice;fly;follow;have;see	And then she tapped on the root of a great oak tree with a tiny wand which she held in her hand, and a green door, which Maisie never remembered having noticed before, flew open, and they followed the Fairy through it into the other valley which Maisie had seen through the hole in the great stone.
931	PERSON	Maisie	woman;stone;work;reason;mutch;cap;dress;lip;finger;thread;distaff	little;old;white;chucky;busy;uglier;red;white;dull;grey;happy;miserable;long;furthest;wet	be;sit;seem;have;seem;notice;be;wear;skirt;have;do;wear;look;seem;be;try;look;push;draw	All the little old women were sitting on their white chucky stones busy at work, only they seemed far uglier than they had seemed at first; and Maisie noticed that the reason for this was, that, instead of wearing red skirts and white mutches as they had done before, they now wore caps and dresses of dull grey, and instead of looking happy, they all seemed to be trying who could look most miserable, and who could push out their long lips furthest, as they wet their fingers to draw the thread from their distaffs.
932	PERSON	Maisie	lip;mouth	ugly	look;push;go;ask;have;make;grow	Just look at their lips"; and, pushing Maisie behind him, he went up to one of them and asked her what had made her mouth grow so ugly.
936	PERSON	Habetrot	lint;boulder;dell;companion;trouble;matter	big	be;be;spin;be;carry;leave;spin;be	And whenever there was lint at the Castle to be spun, it was carried down to the big boulder in the dell and left there, and Habetrot and her companions spun it, and there was no more trouble about the matter."
943	PERSON	Knight	counsel;prince;s;ambassador;slipper;horse;whole;kingdom;lady	trusty;fleet-footed	have;take;summon;appoint;tell;take;mount;ride;find;fit	u"And after they had taken counsel together they summoned a trusty Knight, and appointed him the Prince"s Ambassador; and told him to take the slipper, and mount a fleet-footed horse, and ride up and down the whole of the Kingdom until he found a lady whom it would fit."
947	PERSON	Laird	nobody;wife;daughter;living	dead;left;poor;late	be;be;have;grow;have;work	But the Laird was dead now, and there was nobody left but his wife and two daughters, who had grown poor of late, and who had to work hard for their living.
954	PERSON	Laird	excitement;s;house;company;prince;head;lady;princess	fancy;gallant	be;arrive;greet;be;be	u"You can fancy what excitement there was at the Laird"s house when the gallant company arrived, with their Prince at their head, to greet the lady who was to be their Princess."
974	PERSON	Merlin	strip;moorland;end;crag;s;crag;country;folk;enchanter;abode	shaped;famous	run;know;say;have;take	Now this strip of moorland ran up at one end to a curiously shaped crag, known as Merlin"s Crag, because, so the country folk said, that famous Enchanter had once taken up his abode there."
1008	PERSON	JENNY WREN	wedding;robin;redbreast			THE WEDDING OF ROBIN REDBREAST AND JENNY WREN
1009	PERSON	Robin Redbreast	burnside;branch;bush	little;briar	be;walk;see;hop	And as she was walking down the burnside she saw a little Robin Redbreast hopping up and down on the branches of a briar bush.
1012	PERSON	Robin	m;road;king;s;palace;song;yule	merry	\;answer;sing	"I\"m on my road to the King\"s Palace," answered Robin cheerily, "to sing him a song this merry Yule morning."
1022	PERSON	Robin	m;road;king;s;palace;song;yule;answer;gled	merry;same;grey;greedy	\;sing;answer;give;have;give	"I\"m on my road to the King\"s Palace, to sing him a song this merry Yule morning," answered Robin, giving the same answer that he had given to the grey Pussy Baudrons and the greedy gled.
1022	PERSON	Pussy Baudrons	m;road;king;s;palace;song;yule;answer;gled	merry;same;grey;greedy	\;sing;answer;give;have;give	"I\"m on my road to the King\"s Palace, to sing him a song this merry Yule morning," answered Robin, giving the same answer that he had given to the grey Pussy Baudrons and the greedy gled.
1027	PERSON	Robin	m;way;king;s;palace;song;yule;ground;eye;bread;butter	merry	\;sing;answer;hop;keep;fix	"I\"m on my way to the King\"s Palace to sing him a song this merry Yule morning," answered Robin, hopping down to the ground, and keeping one eye fixed on the bread and butter.
1028	PERSON	Robin	bit;boy;crumb		come;say;give	"Come a bit nearer, Robin," said the boy, "and I will give thee some crumbs."
1031	PERSON	Queen	wife;home;nest		give;reply;go;help;build	"We can give him a wife," replied the Queen, "who will go home with him and help him to build his nest."
1036	PERSON	Jenny Wren	housewife;world	glad;best;little	be;hear;prove	And you will be glad to hear that Jenny Wren proved the best little housewife in the world."
1040	LOCATION	Dwarfie Stone	native;island;legend;snorro	hollow;northern;long	be;call;have;live	It is hollow inside, and the natives of these northern islands call it the Dwarfie Stone, because long centuries ago, so the legend has it, Snorro the Dwarf lived there.
1042	PERSON	Snorro	men;s;father;fairy;denizen;earth;son;gift;youth;nobody;dwarfie;stone;man;woman;hoy	perpetual;true;oldest	say;be;have;be;have;bequeath;know;be;have;inhabit;have;be;bear	u"Men said that this was because Snorro"s father had been a Fairy, and not a denizen of earth, who had bequeathed to his son the gift of perpetual youth, but nobody knew whether this were true or not, for the Dwarf had inhabited the Dwarfie Stone long before the oldest man or woman in Hoy had been born."
1047	PERSON	Snorro	book;protection;enchanter	much;mighty	fear;fear;be;whisper;have;belong;cross;name	For they feared the book almost as much as they feared Snorro himself, for it was whispered that it had once belonged to Odin, and they crossed themselves for protection as they named the mighty Enchanter.
1047	PERSON	Odin	book;protection;enchanter	much;mighty	fear;fear;be;whisper;have;belong;cross;name	For they feared the book almost as much as they feared Snorro himself, for it was whispered that it had once belonged to Odin, and they crossed themselves for protection as they named the mighty Enchanter.
1048	PERSON	Snorro	time;reason;dwarfie;stone	real	guess;choose;live	But all the time they never guessed the real reason why Snorro chose to live in the Dwarfie Stone.
1054	PERSON	Paul	manner;lack;conversation;man;silent	remarkable;such	be;win;have;call	And this was the more remarkable because, with all his winning manner, he had such a lack of conversation that men called him Paul the Silent, or Paul the Taciturn.
1054	PERSON	Paul	manner;lack;conversation;man;silent	remarkable;such	be;win;have;call	And this was the more remarkable because, with all his winning manner, he had such a lack of conversation that men called him Paul the Silent, or Paul the Taciturn.
1055	PERSON	Harold	name;orator;speech;tongue	fair-haired;blue-eyed;free;ready	be;have;gain;be	He was fair-haired and blue-eyed, and he had gained for himself the name of Harold the Orator, because he was always free of speech and ready with his tongue.
1057	PERSON	Harold	people;brother;knowledge;coldness	silent;jealous	help;know;like;make;spring	Harold could not help knowing that the people liked his silent brother best, and the knowledge made him jealous of him, so a coldness sprang up between them.
1058	PERSON	Earl Harold	visit;king;mother;sister;countess;fraukirk		chance;go;accompany	Now it chanced, one summer, that Earl Harold went on a visit to the King of Scotland, accompanied by his mother, the Countess Helga, and her sister, the Countess Fraukirk.
1058	LOCATION	Scotland	visit;king;mother;sister;countess;fraukirk		chance;go;accompany	Now it chanced, one summer, that Earl Harold went on a visit to the King of Scotland, accompanied by his mother, the Countess Helga, and her sister, the Countess Fraukirk.
1058	PERSON	Countess Helga	visit;king;mother;sister;countess;fraukirk		chance;go;accompany	Now it chanced, one summer, that Earl Harold went on a visit to the King of Scotland, accompanied by his mother, the Countess Helga, and her sister, the Countess Fraukirk.
1059	PERSON	Earl Harold	s;heart;mind;bride	sweet;good;gentle	be;be;win;make;be	She was so sweet, and good, and gentle that Earl Harold"s heart was won, and he made up his mind that she, and only she, should be his bride."
1062	PERSON	Paul	brother;rival	possible	remember;do;think;be	And all the while he never remembered his brother Paul; or, if he did, he never thought it possible that he could be his rival.
1063	PERSON	Lady Morna	love		see;return	And the Lady Morna, from the very first hour that she saw him, returned his love."
1065	PERSON	Paul	word	pleasant	meet	But Paul met him with pleasant words.
1066	PERSON	Paul	man;name;silent;chance;tongue;title;orator	likely;proud	be;choose;have;marry;move;be;give	Is it likely that she will choose me, whom all men name Paul the Silent, when she hath the chance of marrying you, whose tongue moves so swiftly that to you is given the proud title of Harold the Orator?"
1066	PERSON	Harold	man;name;silent;chance;tongue;title;orator	likely;proud	be;choose;have;marry;move;be;give	Is it likely that she will choose me, whom all men name Paul the Silent, when she hath the chance of marrying you, whose tongue moves so swiftly that to you is given the proud title of Harold the Orator?"
1068	PERSON	Earl Paul	order;everything;departure;other	ready	see;be;take	And in order to see that everything was ready, Earl Paul took his departure some days before the others.
1069	PERSON	Earl	sadness;thought;departure;sight;distress;arm;wife	full;kind-hearted;young;folding	have;be;weep;be;contain;whisper;love;beg;promise;be	She had been weeping, for she was full of sadness at the thought of his departure; and at the sight of her distress the kind-hearted young Earl could no longer contain himself, but, folding her in his arms, he whispered to her how much he loved her, and begged her to promise to be his wife.
1071	PERSON	Earl Paul	foot		spring	Then Earl Paul sprang to his feet.
1073	PERSON	Earl Harold	lover;s	better	know;feel;be;fain;put	She knew, better than her lover, what Earl Harold"s feeling would be; and she would fain put off the evil hour."
1075	PERSON	Earl Paul	palace;lady-love		agree;set;leave	Rather reluctantly, Earl Paul agreed; and next day he set off for the Palace at Orphir, leaving his lady-love behind him.
1075	LOCATION	Orphir	palace;lady-love		agree;set;leave	Rather reluctantly, Earl Paul agreed; and next day he set off for the Palace at Orphir, leaving his lady-love behind him.
1076	PERSON	Countess Fraukirk	step-aunt;hall;curtain;word;heart;rage	unknown;black	have;chance;be;hide;have;overhear;have;speak;be;fill	For, all unknown to him, his step-aunt, Countess Fraukirk, had chanced to be in the hall, the evening before, hidden behind a curtain, and she had overheard every word that Morna and he had spoken, and her heart was filled with black rage.
1076	PERSON	Morna	step-aunt;hall;curtain;word;heart;rage	unknown;black	have;chance;be;hide;have;overhear;have;speak;be;fill	For, all unknown to him, his step-aunt, Countess Fraukirk, had chanced to be in the hall, the evening before, hidden behind a curtain, and she had overheard every word that Morna and he had spoken, and her heart was filled with black rage.
1077	PERSON	Earl	woman;blood-relation;way;brother;nephew;earl	hard;ambitious;young;own;dead;sole	be;have;hate;be;stand;be;be	For she was a hard, ambitious woman, and she had always hated the young Earl, who was no blood-relation to her, and who stood in the way of his brother, her own nephew; for, if Paul were only dead, Harold would be the sole Earl of Orkney.
1077	PERSON	Paul	woman;blood-relation;way;brother;nephew;earl	hard;ambitious;young;own;dead;sole	be;have;hate;be;stand;be;be	For she was a hard, ambitious woman, and she had always hated the young Earl, who was no blood-relation to her, and who stood in the way of his brother, her own nephew; for, if Paul were only dead, Harold would be the sole Earl of Orkney.
1077	PERSON	Harold	woman;blood-relation;way;brother;nephew;earl	hard;ambitious;young;own;dead;sole	be;have;hate;be;stand;be;be	For she was a hard, ambitious woman, and she had always hated the young Earl, who was no blood-relation to her, and who stood in the way of his brother, her own nephew; for, if Paul were only dead, Harold would be the sole Earl of Orkney.
1077	LOCATION	Orkney	woman;blood-relation;way;brother;nephew;earl	hard;ambitious;young;own;dead;sole	be;have;hate;be;stand;be;be	For she was a hard, ambitious woman, and she had always hated the young Earl, who was no blood-relation to her, and who stood in the way of his brother, her own nephew; for, if Paul were only dead, Harold would be the sole Earl of Orkney.
1079	PERSON	M. Meredith Williams	illustration			[Illustration: M. Meredith Williams
1083	PERSON	Earl Paul	earl;\;s;death;matter	weighty;beloved	compass;be;be;be	For to compass an Earl\"s death is a weighty matter, especially when he is so well beloved as is the Earl Paul.
1086	LOCATION	Scotland	countess;gold;wealth;success;post;court;king;ambition;determination;way	wily;higher;higher;high	offer;bribe;promise;obtain;stir;give;consent;do;ask	But the wily Countess offered him much gold, and bribed him higher and higher, first with wealth, then with success, and lastly she promised to obtain for him a high post at the Court of the King of Scotland; and at that his ambition stirred within him, his determination gave way, and he consented to do what she asked.
1089	PERSON	Dwarf Snorro	grin;piece;cloth;palace;orphir	malicious	say;part;arrange;be;deliver	"That will he not," said Dwarf Snorro, with a malicious grin; and the two parted, after arranging that the piece of cloth should be delivered at the Palace of Orphir on the day before Christmas Eve.
1092	LOCATION	Snorro	love-potion;lady;brother;thought	precious	go;buy;make;hate;turn	I will go to Snorro, and buy from him a love-potion, which will make my Lady Morna hate my precious brother and turn her thoughts kindly towards me."
1092	PERSON	Morna	love-potion;lady;brother;thought	precious	go;buy;make;hate;turn	I will go to Snorro, and buy from him a love-potion, which will make my Lady Morna hate my precious brother and turn her thoughts kindly towards me."
1093	PERSON	Dwarfie Stone	valley;difficulty;occupant;hole;door;raven;shoulder;setting;sun	lonely;uncanny	arrive;hurry;stand;have;find;be;stand;serve;gaze	When he arrived there he hurried up the lonely valley to where the Dwarfie Stone stood, and he had no difficulty in finding its uncanny occupant, for Snorro was standing at the hole that served as a door, his raven on his shoulder, gazing placidly at the setting sun.
1093	PERSON	Snorro	valley;difficulty;occupant;hole;door;raven;shoulder;setting;sun	lonely;uncanny	arrive;hurry;stand;have;find;be;stand;serve;gaze	When he arrived there he hurried up the lonely valley to where the Dwarfie Stone stood, and he had no difficulty in finding its uncanny occupant, for Snorro was standing at the hole that served as a door, his raven on his shoulder, gazing placidly at the setting sun.
1099	PERSON	Snorro	earnest;word;dwelling;phial;hand;liquid	small;full;rosy	see;be;enter;return;be	Snorro saw that he was in earnest, so without a word he entered his dwelling, and in a few minutes returned with a small phial in his hand, which was full of a rosy liquid.
1100	PERSON	Morna	contents;lady;\;s	wine-cup;four-and-twenty;better	pour;say;warrant;have;pass;love;lovest	"Pour the contents of this into the Lady Morna\"s wine-cup," he said, "and I warrant thee that before four-and-twenty hours have passed she will love thee better than thou lovest her now."
1103	PERSON	Harold	seat;whole;wine;floor;look;satisfaction;s;cup	empty	have;go;manage;pour;smile;come;face;put	When he had gone back to his seat she managed to pour the whole of the wine on the floor, and smiled to herself at the look of satisfaction that came over Harold"s face as she put down the empty cup."
1104	LOCATION	Orphir	satisfaction;moment;kindness;court;love	afraid;great;good;own;true	increase;feel;treat;hope;do;keep;grace;move;protect	His satisfaction increased, for from that moment she felt so afraid of him that she treated him with great kindness, hoping that by doing so she would keep in his good graces until the Court moved to Orphir, and her own true love could protect her.
1105	PERSON	Harold	side;graciousness;charm;hope	delighted;certain	be;feel;be;begin;work;be;fulfil	Harold, on his side, was delighted with her graciousness, for he felt certain that the charm was beginning to work, and that his hopes would soon be fulfilled.
1106	LOCATION	Orphir	court;royal;palace;everything;readiness;reception;guest		remove;have	A week later the Court removed to the Royal Palace at Orphir, where Earl Paul had everything in readiness for the reception of his guests.
1106	PERSON	Earl Paul	court;royal;palace;everything;readiness;reception;guest		remove;have	A week later the Court removed to the Royal Palace at Orphir, where Earl Paul had everything in readiness for the reception of his guests.
1107	PERSON	Lady Morna	course;attention	safe;unwelcome	be;overjoy;meet;be;overjoy;meet;feel;be	Of course he was overjoyed to meet Lady Morna again, and she was overjoyed to meet him, for she felt that she was now safe from the unwelcome attentions of Earl Harold.
1107	PERSON	Earl Harold	course;attention	safe;unwelcome	be;overjoy;meet;be;overjoy;meet;feel;be	Of course he was overjoyed to meet Lady Morna again, and she was overjoyed to meet him, for she felt that she was now safe from the unwelcome attentions of Earl Harold.
1108	PERSON	Earl Harold	sight;joy;gall;bitterness;efficacy;snorro;s;love-potion		be;contain;trust	u"But to Earl Harold the sight of their joy was as gall and bitterness, and he could scarcely contain himself, although he still trusted in the efficacy of Snorro the Dwarf"s love-potion."
1109	PERSON	Countess Helga	countess;fraukirk;time;web;fashion;gift	magic;fatal	look;arrive;hope	As for Countess Fraukirk and Countess Helga, they looked forward eagerly to the time when the magic web would arrive, out of which they hoped to fashion a fatal gift for Earl Paul.
1109	PERSON	Earl Paul	countess;fraukirk;time;web;fashion;gift	magic;fatal	look;arrive;hope	As for Countess Fraukirk and Countess Helga, they looked forward eagerly to the time when the magic web would arrive, out of which they hoped to fashion a fatal gift for Earl Paul.
1110	PERSON	Helga	woman;countess;s;chamber;talking;time;tap;window;round;s;raven;sill;packet;beak	last;wicked;grey-headed;sealed	be;sit;rule;come;look;see;perch	u"At last, the day before Christmas Eve, the two wicked women were sitting in the Countess Helga"s chamber talking of the time when Earl Harold would rule alone in Orkney, when a tap came to the window, and on looking round they saw Dwarf Snorro"s grey-headed Raven perched on the sill, a sealed packet in its beak."
1110	PERSON	Earl Harold	woman;countess;s;chamber;talking;time;tap;window;round;s;raven;sill;packet;beak	last;wicked;grey-headed;sealed	be;sit;rule;come;look;see;perch	u"At last, the day before Christmas Eve, the two wicked women were sitting in the Countess Helga"s chamber talking of the time when Earl Harold would rule alone in Orkney, when a tap came to the window, and on looking round they saw Dwarf Snorro"s grey-headed Raven perched on the sill, a sealed packet in its beak."
1110	LOCATION	Orkney	woman;countess;s;chamber;talking;time;tap;window;round;s;raven;sill;packet;beak	last;wicked;grey-headed;sealed	be;sit;rule;come;look;see;perch	u"At last, the day before Christmas Eve, the two wicked women were sitting in the Countess Helga"s chamber talking of the time when Earl Harold would rule alone in Orkney, when a tap came to the window, and on looking round they saw Dwarf Snorro"s grey-headed Raven perched on the sill, a sealed packet in its beak."
1110	PERSON	Dwarf Snorro	woman;countess;s;chamber;talking;time;tap;window;round;s;raven;sill;packet;beak	last;wicked;grey-headed;sealed	be;sit;rule;come;look;see;perch	u"At last, the day before Christmas Eve, the two wicked women were sitting in the Countess Helga"s chamber talking of the time when Earl Harold would rule alone in Orkney, when a tap came to the window, and on looking round they saw Dwarf Snorro"s grey-headed Raven perched on the sill, a sealed packet in its beak."
1114	PERSON	Earl Harold	stitch;footstep;staircase;burst;door	last	work;be;put;hurry;be;hear;ascend;wind;open	All that night they worked, and all next day, till, late in the afternoon, when they were putting in the last stitches, hurried footsteps were heard ascending the winding staircase, and Earl Harold burst open the door.
1115	PERSON	Lady Morna	cheek;passion;eye;orphir;love;s;protection;s;manner;faith;s;charm	red;bright;safe;true;cold;distant	be;be;notice;be;have;grow;be;begin;lose	u"His cheeks were red with passion, and his eyes were bright, for he could not but notice that, now that she was safe at Orphir under her true love"s protection, the Lady Morna"s manner had grown cold and distant again, and he was beginning to lose faith in Snorro"s charm."
