PARAGRAPH NUMBER	ENTITY TYPE	ENTITY	CO-OCCURRING NOUNS	CO-OCCURRING ADJECTIVES	CO-OCCURRING VERBS	VALENCE	AROUSAL	DOMINANCE	SENTENCE
0	PERSON	Princess	stories	light;other		6.5775	4.365	6.0025	The Light Princess and Other Fairy Stories
0	PERSON	Fairy	stories	light;other		6.5775	4.365	6.0025	The Light Princess and Other Fairy Stories
1	PERSON	George MacDonald				5.0	5.0	5.0	by George MacDonald
11	PERSON	the queen	joke	good	pretend;take	5.9775	4.49125	5.52625	But the queen pretended to take it all as a joke, and a very good one too.
13	PERSON	the queen	king	sorry	be;say	5.80444444444	4.32111111111	5.76888888889	"I am sure, dear king, I am very sorry," said the queen.
14	PERSON	the king	virtue;_		go;be;make;retort	5.93375	4.04875	5.45375	"So you ought to be," retorted the king; "you are not going to make a virtue of _that_, surely."
16	PERSON	The queen			smile	7.205	4.835	6.88	The queen smiled.
18	PERSON	the king	queen	sorry;nice	oblige;be	5.80714285714	4.26	5.61428571429	She was, indeed, a very nice queen, and heartily sorry that she could not oblige the king immediately.
19	PERSON	the queen	daughter;princess	little;lovely;last;more	be;give;cry;deserve	6.20454545455	4.68818181818	5.31818181818	It was more than he deserved, therefore, when, at last, the queen gave him a daughter--as lovely a little princess as ever cried.
24	PERSON	The king	garret		see;live	6.74	4.35333333333	6.01	The king could not see into the garret she lived in, could he?
37	LOCATION	the steps	limb;baby;tail;s;clothes	top	float;reach;stand;have;catch;climb;tremble	5.49142857143	3.76785714286	5.545	Trembling in every limb, she climbed upon the steps, and had to stand upon the very top, and reach up, before she could catch the floating tail of the baby"s long clothes.
38	PERSON	the queen	horror-struck	last	stare;be;stammer;turn;say;gasp	5.50166666667	4.44666666667	5.89333333333	At last, turning to the queen, who was just as horror-struck as himself, he said, gasping, staring, and stammering,--
40	PERSON	the queen	cause;effect	much;cleverer;defective	come;be;begin;suspect;have	5.319	3.917	5.239	Now the queen was much cleverer than the king, and had begun already to suspect that "this effect defective came by cause."
40	PERSON	the king	cause;effect	much;cleverer;defective	come;be;begin;suspect;have	5.319	3.917	5.239	Now the queen was much cleverer than the king, and had begun already to suspect that "this effect defective came by cause."
42	PERSON	Princess Makemnoit			bewitch;have	6.75	4.47	5.73	Princess Makemnoit has bewitched her."
43	PERSON	the queen	s		answer;say	5.706	4.696	5.774	"That"s just what I say," answered the queen.
44	LOCATION	the steps	throne		bring;get	5.434	4.236	5.746	bring the steps I get on my throne with."
47	PERSON	John	majesty;tong		say;hand;take;get	5.72428571429	3.93571428571	5.93428571429	"Take the tongs, John," said his Majesty; and getting up on the table, he handed them to him.
47	LOCATION	the table	majesty;tong		say;hand;take;get	5.72428571429	3.93571428571	5.93428571429	"Take the tongs, John," said his Majesty; and getting up on the table, he handed them to him.
48	PERSON	John	baby;princess;tong	little	be;reach;hand	6.15428571429	4.08571428571	5.45857142857	John could reach the baby now, and the little princess was handed down by the tongs.
52	PERSON	The queen	loss;down-stair	ignorant	go;occasion;have	5.215	4.6	5.19166666667	The queen went down-stairs, quite ignorant of the loss she had herself occasioned.
53	PERSON	the queen	nothing;length;boudoir;majesty;hearing	uneasy	go;s;grow;find	5.6875	4.2025	5.60125	But hearing nothing, she grew uneasy, and went at length to the queen"s boudoir, where she found her Majesty.
55	PERSON	the queen			ask	6.235	4.265	6.165	asked the queen.
57	PERSON	the queen	grave		say;look	5.195	4.445	5.6325	said the queen, looking grave.
65	PERSON	the king	instance;breakfast;counting-house;money		go;count	6.45	4.25142857143	5.76142857143	One day, for instance, after breakfast, the king went into his counting-house, and counted out his money.
71	PERSON	the queen	honey-pot;t		say;eat;look	5.98428571429	4.39428571429	6.07142857143	"I can"t eat it," said the queen, looking ruefully at the honey-pot.
75	PERSON	the king	sigh;cough		try;turn;say;help	5.31222222222	4.22888888889	5.59666666667	Yet the king could not help a sigh, which he tried to turn into a cough, saying--
77	PERSON	the queen	thing;soul	bad;prophetic;light-headed	answer;be;look	5.75090909091	4.24	5.42454545455	"It is a bad thing to be light-headed," answered the queen, looking with prophetic soul far into the future.
78	PERSON	the king	thing;tis	good;light-handed	be;say	6.08833333333	4.06666666667	5.78833333333	""Tis a good thing to be light-handed," said the king.
79	PERSON	the queen	thing;tis	bad;light-fingered	answer;be	5.43166666667	4.295	5.24333333333	""Tis a bad thing to be light-fingered," answered the queen.
80	PERSON	the king	thing;tis	light-footed;good	be;say	6.08833333333	4.06666666667	5.78833333333	""Tis a good thing to be light-footed," said the king.
81	PERSON	the queen	thing;tis	bad	interrupt;begin	5.14428571429	4.28571428571	5.02714285714	""Tis a bad thing--" began the queen; but the king interrupted her.
81	PERSON	the king	thing;tis	bad	interrupt;begin	5.14428571429	4.28571428571	5.02714285714	""Tis a bad thing--" began the queen; but the king interrupted her.
83	PERSON	the queen	thing;temper	bad;light-minded	be;begin;retort;lose	5.272	4.196	5.123	"But it is a bad thing altogether to be light-minded," retorted the queen, who was beginning to lose her temper.
86	PERSON	the queen	light;vowel;_	light;ex-asperated	be;aspirate;heir;hair;tell;mean	5.66333333333	3.89333333333	5.60444444444	And besides, he could not tell whether the queen meant light-_haired_ or light-_heired_; for why might she not aspirate her vowels when she was ex-asperated herself?
90	PERSON	the king	arm	rueful	consult;sit;look;take	5.57333333333	3.855	5.69166666667	She looked so rueful, that the king took her in his arms; and they sat down to consult.
91	PERSON	the king			say	5.955	4.44	6.205	said the king.
92	PERSON	the queen	t		say	5.768	4.524	5.872	"No, I can"t," said the queen.
93	PERSON	the king			say	5.955	4.44	6.205	said the king.
95	PERSON	the king			say	5.955	4.44	6.205	said the king.
96	PERSON	the queen			say	6.215	4.74	6.46	"Yes," said the queen.
97	PERSON	the king	mind;t		say;don	5.722	4.786	5.7	"Well, I don"t mind," said the king.
98	PERSON	The queen			try;comfort	6.46666666667	3.93666666667	6.38666666667	The queen tried to comfort him.
100	PERSON	the king	consternation;idea	sudden	exclaim	6.525	4.555	5.82	exclaimed the king, in sudden consternation at the idea.
103	PERSON	the king	sigh		answer;be;s	5.42833333333	4.13166666667	5.33	A sigh was the king"s only answer.
104	LOCATION	the court	physician;experiment	afraid	try;be;have;consult	5.197	4.071	5.245	He would have consulted the court physicians; but he was afraid they would try experiments upon her.
113	PERSON	the king	dignity;page	whole	be;speak;do;hurt	5.588	3.974	5.651	As for the king, his dignity was greatly hurt, and he did not speak to the page for a whole month.
118	LOCATION	the chair	support;_;seat		be;do;sit;receive;pretend;see;say;determine;_	5.8625	3.8175	6.0575	Whether she could be said to _sit_, seeing she received no support from the seat of the chair, I do not pretend to determine.
119	PERSON	the king	time;people;child	other;aware	be;say	6.17545454545	4.08454545455	5.70545454545	"My dear child," said the king, "you must be aware by this time that you are not exactly like other people."
121	PERSON	the queen		serious	be;say	6.1225	4.24	6.0225	"Now be serious, my dear, for once," said the queen.
130	PERSON	the queen			interrupt;begin	5.965	4.42	5.3575	began the queen; but the princess interrupted her.
130	PERSON	the princess			interrupt;begin	5.965	4.42	5.3575	began the queen; but the princess interrupted her.
133	PERSON	the king	time	angry;useless	be;learn;have;resume	5.21	4.14444444444	5.26777777778	resumed the king, who had learned by this time that it was quite useless to be angry with her.
139	PERSON	The king	motion;head;queen;point	single;wiser	be;say;check	5.866	4.261	5.643	The king was on the point of saying _Yes_, but the wiser queen checked him with a single motion of her head.
147	PERSON	the king			cry	4.84666666667	4.26666666667	4.9	cried the king; "we will."
148	PERSON	The queen	hum-drum;silence;humility		retire;hear;laugh	6.34333333333	4.27166666667	6.285	The queen laughed; but Hum-Drum and Kopy-Keck heard with humility and retired in silence.
148	PERSON	Kopy-Keck	hum-drum;silence;humility		retire;hear;laugh	6.34333333333	4.27166666667	6.285	The queen laughed; but Hum-Drum and Kopy-Keck heard with humility and retired in silence.
155	PERSON	Kopy-Keck	death;form	grim	say;arrive	4.695	4.51666666667	5.62166666667	"Which would presently arrive in the form of grim death," said Kopy-Keck.
164	LOCATION	the window	push;water;someone;wind;situation	irrespective;night-gown;best;awkward	be;suspend;angle;give;reach;see;remain;have;fail	5.50052631579	3.96263157895	5.31368421053	And if she gave herself a push towards the water and just failed of reaching it, her situation would be dreadfully awkward, irrespective of the wind; for at best there she would have to remain, suspended in her night-gown, till she was seen and angled for by someone from the window.
183	LOCATION	the wood	bewilderment;ground;darkness;hold;phenomenon		be;reach;say;see;continue;stand;catch	5.75	3.85	5.64846153846	But in the darkness of the wood, the prince continued in some bewilderment as to what the phenomenon could be; until, reaching the ground, and seeing him standing there, she caught hold of him, and said,--
183	PERSON	the prince	bewilderment;ground;darkness;hold;phenomenon		be;reach;say;see;continue;stand;catch	5.75	3.85	5.64846153846	But in the darkness of the wood, the prince continued in some bewilderment as to what the phenomenon could be; until, reaching the ground, and seeing him standing there, she caught hold of him, and said,--
185	PERSON	the prince			return	5.695	4.22	5.05	returned the prince.
191	PERSON	the prince			ask	5.695	4.315	5.34	asked the prince.
193	PERSON	the prince			ask	5.695	4.315	5.34	asked the prince.
194	PERSON	the princess			answer	6.87	4.71	5.845	answered the princess.
195	PERSON	the prince			say;come	5.66333333333	4.38333333333	5.73666666667	"Come, then," said the prince.
196	PERSON	The prince	foot;part;hurry;edge	high;least	be;reach;turn;say;have;come	5.69875	3.944375	5.45125	The prince being therefore in no hurry, they came upon the lake at quite another part, where the bank was twenty-five feet high at least; and when they had reached the edge, he turned towards the princess, and said,--
196	LOCATION	the lake	foot;part;hurry;edge	high;least	be;reach;turn;say;have;come	5.69875	3.944375	5.45125	The prince being therefore in no hurry, they came upon the lake at quite another part, where the bank was twenty-five feet high at least; and when they had reached the edge, he turned towards the princess, and said,--
196	LOCATION	the bank	foot;part;hurry;edge	high;least	be;reach;turn;say;have;come	5.69875	3.944375	5.45125	The prince being therefore in no hurry, they came upon the lake at quite another part, where the bank was twenty-five feet high at least; and when they had reached the edge, he turned towards the princess, and said,--
196	PERSON	the princess	foot;part;hurry;edge	high;least	be;reach;turn;say;have;come	5.69875	3.944375	5.45125	The prince being therefore in no hurry, they came upon the lake at quite another part, where the bank was twenty-five feet high at least; and when they had reached the edge, he turned towards the princess, and said,--
200	PERSON	the prince			say	5.675	4.79	5.635	said the prince.
201	PERSON	the princess	effort		pant	6.48	4.48	5.64666666667	After some effort the princess panted out,--
203	PERSON	the prince	specimen	tolerable	answer;think	5.36	4.36285714286	5.34428571429	"Yes," answered the prince, "I should think it a very tolerable specimen."
205	PERSON	the prince	feeling;elevation		be;concede	5.72666666667	3.56833333333	5.465	"My feeling was certainly one of elevation too," the prince conceded.
206	PERSON	The princess	question		do;retort;understand;appear	6.268	3.904	6.008	The princess did not appear to understand him, for she retorted his question:--
207	PERSON	the princess			say	6.775	4.925	6.31	said the princess.
209	PERSON	the princess		more	be;say;tire	5.804	4.39	5.636	"No more of that: I am tired of it," said the princess.
211	PERSON	the prince			say	5.675	4.79	5.635	said the prince.
214	PERSON	the prince	time	happy	be;say;like;fall	5.97666666667	4.40333333333	5.48222222222	"I shall be most happy to fall in with you any time you like," said the prince, devotedly.
216	PERSON	the prince	heart		respond	6.03333333333	4.43666666667	5.27333333333	"With all my heart," responded the prince.
220	LOCATION	the window	push;hold;to-morrow;balcony	little;able	swim;be;look;do;give;call;catch;get;_	5.8648	4.1972	5.4812	Now if you would just swim there with me very quietly, and when we are all but under the balcony, give me such a push--_up_ you call it--as you did a little while ago, I should be able to catch hold of the balcony, and get in at the window; and then they may look for me till to-morrow morning!"
221	PERSON	the prince	pleasure;obedience	more	swim;say	6.098	5.144	5.796	"With more obedience than pleasure," said the prince, gallantly; and away they swam, very gently.
222	PERSON	the prince			ask;venture	5.57333333333	4.72666666667	5.58666666667	the prince ventured to ask.
223	PERSON	the princess	answer;s	strange	be	5.928	4.27	5.494	Perhaps," was the princess"s somewhat strange answer.
225	PERSON	the princess			swim;be;dream	7.026	4.384	5.538	All night long he dreamed that he was swimming with the princess.
230	PERSON	the prince			sing;begin	6.46	4.03333333333	5.59333333333	Then the prince began to sing.
233	PERSON	Lady		fair		7.025	3.67	5.995	"Lady fair,
248	LOCATION	the lake	o		er	6.065	3.82	5.18	O"er the lake,
268	PERSON	the prince			say;look	5.76666666667	4.44666666667	5.71666666667	said the prince, looking down.
269	PERSON	the princess	prince		say;please;look	6.235	4.69	5.7225	Yes, if you please, prince," said the princess, looking up.
270	PERSON	the prince			say	5.675	4.79	5.635	said the prince.
271	PERSON	the princess	prince;man	young;nice	be;say	6.10625	4.42625	5.6275	"Because you are a very nice young man, prince," said the princess.
274	PERSON	The princess	delight;ecstasy	delicious	swim;be	7.07	4.91142857143	5.97428571429	The princess was in ecstasies of delight, and their swim was delicious.
275	PERSON	the princess	heaven		be;laugh;talk	7.104	4.616	6.058	But when he talked about being in heaven, the princess laughed at him dreadfully.
276	PERSON	the princess	bottom;lake;moon	lovely;deeper;theirs;clear;steady;cold;bluer	be;say	6.10454545455	3.70454545455	5.65181818182	there was the moon, far off, clear and steady and cold, and very lovely, at the bottom of a deeper and bluer lake than theirs, as the princess said.
277	LOCATION	the lake	mermaid;sea;help;merman	altered	be;marry;see;leave;turn;say;go	6.032	4.31066666667	5.46533333333	But as soon as ever she left the lake, she was so altered, that the prince said to himself, "If I marry her, I see no help for it: we must turn merman and mermaid, and go out to sea at once."
277	PERSON	the prince	mermaid;sea;help;merman	altered	be;marry;see;leave;turn;say;go	6.032	4.31066666667	5.46533333333	But as soon as ever she left the lake, she was so altered, that the prince said to himself, "If I marry her, I see no help for it: we must turn merman and mermaid, and go out to sea at once."
282	LOCATION	the lake	direction;idea;surface;mark;wind;border;fact	certain;last;horrible	be;make;examine;sink;become;cause	5.69105263158	3.74947368421	5.50947368421	She caused marks to be made along the borders, and examined them, day after day, in all directions of the wind; till at last the horrible idea became a certain fact--that the surface of the lake was slowly sinking.
283	LOCATION	the lake	people		go;be;say;live	6.12777777778	4.00333333333	5.79555555556	People said she would not live an hour after the lake was gone.
287	PERSON	The king	brain;revenge;skull;thirst;people		die;lose;boil;frizzle	4.63230769231	4.57692307692	5.35230769231	The king and the people shall die of thirst; their brains shall boil and frizzle in their skulls before I will lose my revenge."
290	LOCATION	the door	cellar;key		go;unlock;take;say	5.56428571429	3.89142857143	5.91	Then she took the keys and went down to her cellar; and as she unlocked the door she said to herself,--
292	LOCATION	the lake	side;roof;bottom	under	be	5.344	3.16	5.434	Now this roof was the under side of the bottom of the lake.
293	LOCATION	the cavern	dart;mouth;round;circuit;snake	sudden;last	go;make;lessen;round;cling	5.19615384615	4.09538461538	5.21153846154	Round and round the cavern they went, ever lessening the circuit, till at last the snake made a sudden dart, and clung to the roof with its mouth.
293	LOCATION	the roof	dart;mouth;round;circuit;snake	sudden;last	go;make;lessen;round;cling	5.19615384615	4.09538461538	5.21153846154	Round and round the cavern they went, ever lessening the circuit, till at last the snake made a sudden dart, and clung to the roof with its mouth.
294	PERSON	the princess		dry	cry;drain	4.88	4.4025	4.92	cried the princess; "drain it dry."
295	LOCATION	the floor	delight;water;door	ready;faint;malicious	rush;listen;hear;sit	5.725	4.055	5.91916666667	There she sat down on the floor ready to faint, but listening with malicious delight to the rushing of the water, which she could hear distinctly through all the hundred doors.
296	LOCATION	Earth	baby;tear;fountain;mother		flow;cry;cease;have;be	5.4425	4.175	5.29333333333	And not alone had the fountains of mother Earth ceased to flow; for all the babies throughout the country were crying dreadfully--only without tears.
296	LOCATION	the country	baby;tear;fountain;mother		flow;cry;cease;have;be	5.4425	4.175	5.29333333333	And not alone had the fountains of mother Earth ceased to flow; for all the babies throughout the country were crying dreadfully--only without tears.
301	LOCATION	the lake	pair;diving;depth;boot;polish	dainty;extra	do;be;distract;put;remain;call;roam;go	5.80833333333	3.60722222222	5.65722222222	He went nearly distracted; but after roaming about the lake for days, and diving in every depth that remained, all that he could do was to put an extra polish on the dainty pair of boots that was never called for.
303	LOCATION	the lake	length;pool	few;deepest;unexhausted	go;be;remain	5.97428571429	3.79428571429	5.43	At length the lake was all but gone, only a few of the deepest pools remaining unexhausted.
304	PERSON	the king			carry	5.835	3.96	5.235	They carried it to the king.
316	PERSON	the king	plate;gold;contents	wonderful	be;cause;publish	6.07222222222	4.14444444444	5.94777777778	Therefore the king caused the contents of the wonderful plate of gold to be published throughout the country.
316	LOCATION	the country	plate;gold;contents	wonderful	be;cause;publish	6.07222222222	4.14444444444	5.94777777778	Therefore the king caused the contents of the wonderful plate of gold to be published throughout the country.
318	PERSON	The prince	nothing;oracle;journey;return;way	hermit	go;meet;know;have;consult	5.90733333333	3.96066666667	5.464	The prince, having gone several days" journey into the forest, to consult a hermit whom he had met there on his way to Lagobel, knew nothing of the oracle till his return.
318	LOCATION	the forest	nothing;oracle;journey;return;way	hermit	go;meet;know;have;consult	5.90733333333	3.96066666667	5.464	The prince, having gone several days" journey into the forest, to consult a hermit whom he had met there on his way to Lagobel, knew nothing of the oracle till his return.
318	PERSON	Lagobel	nothing;oracle;journey;return;way	hermit	go;meet;know;have;consult	5.90733333333	3.96066666667	5.464	The prince, having gone several days" journey into the forest, to consult a hermit whom he had met there on his way to Lagobel, knew nothing of the oracle till his return.
321	LOCATION	the door	crime;counting-house;capital		knock;s;disturb;be	4.86	4.31333333333	5.07666666667	So he knocked at the door of the king"s counting-house, where it was all but a capital crime to disturb him.
321	PERSON	the king	crime;counting-house;capital		knock;s;disturb;be	4.86	4.31333333333	5.07666666667	So he knocked at the door of the king"s counting-house, where it was all but a capital crime to disturb him.
322	PERSON	the prince		alarmed;least	be	5.81	4.29	4.945	But the prince was not in the least alarmed.
326	PERSON	the king	sword;point		raise;bawl	5.504	4.844	5.476	bawled the king, raising the point of his sword.
327	PERSON	the prince	plug;monarch;stopper;lake	leaky;grand	put;say;call	5.28461538462	3.95846153846	5.42846153846	"I will put a stopper--plug--what you call it, in your leaky lake, grand monarch," said the prince.
329	PERSON	the prince			reply;thank	6.45333333333	3.97333333333	6.02333333333	"No, thank you," replied the prince.
331	PERSON	the prince			say;thank	6.37333333333	4.30333333333	6.05333333333	"No, thank you," said the prince.
332	LOCATION	the hole	attendant;majesty		go;say;call;look;proceed	5.90555555556	3.71777777778	5.85666666667	"Then we will go and look for the hole at once," said his majesty, and proceeded to call some attendants.
333	PERSON	the prince	condition;majesty		please;make;interpose;stop;have	5.4125	4.41625	5.64125	"Stop, please your majesty; I have a condition to make," interposed the prince.
336	LOCATION	the hole	sack		put;stick;have	5.24125	3.91	5.35125	I will have you put in a sack, and stuck in the hole."
338	PERSON	the king			retort;have;_;offer	5.84333333333	3.82333333333	5.56333333333	"Well, you _have_ offered yourself," retorted the king.
342	PERSON	the king			feel;be;growl	5.97833333333	4.30666666667	5.69833333333	growled the king, feeling that the prince was right.
342	PERSON	the prince			feel;be;growl	5.97833333333	4.30666666667	5.69833333333	growled the king, feeling that the prince was right.
344	PERSON	the prince	voice;resolution;spite	sentimental	falter;s;grow	5.915	3.775	5.71	Here the prince"s voice faltered, and he very nearly grew sentimental, in spite of his resolution.
345	PERSON	the king			exclaim	6.0	4.45	5.53	exclaimed the king.
346	PERSON	the prince			persist	5.09	4.395	5.415	persisted the prince.
347	PERSON	the king	course		do;reply	5.64	4.14	5.9175	"Of course I do," replied the king.
350	LOCATION	the hole	water;stone	little	be;flow;round	5.86625	3.3975	5.4325	There was water all round the stone, but very little was flowing through the hole.
354	PERSON	The prince	occasion;prince		go;be;resolve;dress;die	5.621	4.706	5.325	The prince went to dress for the occasion, for he was resolved to die like a prince.
356	PERSON	The princess		worth	recognize;acknowledge;think;do	6.46	4.06	6.362	The princess recognized him at once, but did not think it worth while to acknowledge him.
358	PERSON	the princess	shoeblack		be;say;tell	5.83333333333	4.52333333333	5.51	"They told me it was a shoeblack," said the princess.
363	PERSON	The king	home;dinner		go;have	6.412	4.092	5.88	The king had already gone home to dinner.
364	PERSON	the princess	parrot		go;repeat	6.32	4.45285714286	5.60714285714	"Now you can go," repeated the princess after him, like a parrot.
373	LOCATION	the ocean	s;expanse	fair		6.51	3.93	5.66666666667	Of the ocean"s fair expanse;
381	LOCATION	the spring	bubbling			7.64	5.5	5.9	Or the bubbling of the spring
384	LOCATION	the river	s		go	5.51	4.5325	4.795	Of the river"s downward going;
387	LOCATION	the ocean	s;voice	mighty		6.335	4.295	5.9875	Or the ocean"s mighty voice,
392	PERSON	Lady	delight;world;s		keep	6.58	4.41	5.798	"Lady, keep thy world"s delight;
402	PERSON	the princess		tedious	make;say	5.815	4.4725	5.735	It makes it less tedious," said the princess.
403	PERSON	the prince	pause	much;long	be;follow;overcome;sing	5.89714285714	4.25142857143	5.57714285714	But the prince was too much overcome to sing any more, and a long pause followed.
404	PERSON	the princess	eye;prince;boat	kind;last	shut;be;say;lay	6.28444444444	4.06666666667	5.95444444444	"This is very kind of you, prince," said the princess at last, quite coolly, as she lay in the boat with her eyes shut.
405	PERSON	the prince	t;compliment	sorry;worth	be;return;think;die	5.47	4.585	5.31333333333	"I am sorry I can"t return the compliment," thought the prince; "but you are worth dying for, after all."
409	PERSON	the princess	moment		start;cry	5.8425	4.9325	4.95	But at the moment up started the princess, crying,--
412	PERSON	the prince	water	wide;awake	encourage;repeat;see;look	5.975	4.14375	5.96	repeated the prince, encouraged by seeing her wide awake and looking eagerly at the water.
418	PERSON	the prince	glass;biscuit;wine		say;give	5.919	4.434	5.572	"Just give me a glass of wine and a biscuit first," said the prince, very humbly.
419	PERSON	the princess	heart		say;gape	6.6025	4.8375	6.2325	"With all my heart," said the princess, and gaped as she said it.
425	PERSON	the princess	bit;sip;biscuit;wine		feed;say;begin	6.20875	3.87125	6.11125	said the princess; and she began at once to feed him with bits of biscuit and sips of wine.
426	PERSON	the prince			feel	5.855	4.6	4.945	But the prince felt better.
431	PERSON	the prince			swim;say	5.784	4.83	5.726	"I shall never swim more," said the prince.
432	PERSON	the princess		silent	be;say;forget	5.6	4.32	5.535	"Oh, I forgot," said the princess, and was silent.
435	PERSON	the princess	kiss	sweet;cold	answer;kiss	6.30111111111	4.67888888889	5.84777777778	"Yes, I will," answered the princess, and kissed him with a long, sweet, cold kiss.
437	PERSON	The princess	shriek		spring;give	6.43166666667	4.75	5.28666666667	The princess gave a shriek, and sprang into the lake.
