PARAGRAPH NUMBER	ENTITY TYPE	ENTITY	CO-OCCURRING NOUNS	CO-OCCURRING ADJECTIVES	CO-OCCURRING VERBS	SENTENCE
267	PERSON	Prince	man;boat;ceremony;sail;country;castle;harm;mistress;home;hunting;key;mullioned;chamber;s;neck;hand	due;own;sheep-dog	attend;set;know;have;befall;come;have;take	u"So the man attended her to the boat with all due ceremony, and she set sail for her own country; and no one in the Castle knew that any harm had befallen their dear Mistress until the Prince came home from his hunting with the key of the Mullioned Chamber, which he had taken from his sheep-dog"s neck, in his hand."
269	PERSON	Silver-Tree	story;queen;s;visit;servant;door;wife		laugh;hear;tell;have;do;run;open;release	u"He laughed when he heard the story of Queen Silver-Tree"s visit, and told the servants that they had done well; then he ran upstairs to open the door and release his wife."
271	PERSON	Silver-Tree	rage;grief;poison;queen;princess;s;body;need;burial;couch;mullioned;chamber	deadly;such;silken	be;know;have;use;preserve;have;have;lay;leave;go;look;please	u"He was nearly beside himself with rage and grief; and, because he knew that a deadly poison such as Queen Silver-Tree had used would preserve the Princess"s body so that it had no need of burial, he had it laid on a silken couch and left in the Mullioned Chamber, so that he could go and look at it whenever he pleased."
274	PERSON	Gold-Tree	prince;door;princess;couch	silken	chance;leave;unlock;have;tell;do;go;see;lie;look;be	But one day the Prince chanced to leave the door unlocked, and as he had never told her not to do so, she went in, and there she saw Princess Gold-Tree lying on the silken couch, looking as if she were asleep.
277	PERSON	Gold-Tree	moment;princess;eye;princess;story	other;whole	open;sit;have;recover;tell	In a moment Princess Gold-Tree opened her eyes and sat up, and presently she had recovered sufficiently to tell the Other Princess the whole story.
279	PERSON	Gold-Tree	heart;love;princess		love;be;mourn	Although he loved her very much, he was always mourning in his heart for his first dear love, Princess Gold-Tree.
283	PERSON	Gold-Tree	word;prince;couch	sure;ready	run;be;sit;welcome	Without a word the Prince ran upstairs, and, sure enough, there was his dear Gold-Tree, sitting on the couch ready to welcome him.
287	PERSON	Gold-Tree	princess;princess;sister;life	other;other	become;love;have;be;bring	For Princess Gold-Tree and the Other Princess soon became like sisters, and loved each other as if they had been brought up together all their lives.
288	PERSON	Silver-Tree	manner;country;queen;face;water;well;glen	old;little	pass;go;have;do;look	In this manner another year passed away, and one evening, in the old country, Queen Silver-Tree went, as she had done before, to look at her face in the water of the little well in the glen.
292	PERSON	Gold-Tree	princess;course			"The Princess Gold-Tree, of course."
297	PERSON	Gold-Tree	ship;sea;hand;land;princess	own	steer;be;approach;be;see;recognise	She steered the Ship over the sea with her own hands, and when it was approaching the land it was seen and recognised by Princess Gold-Tree.
301	PERSON	Queen Silver-Tree	edge;water;step-daughter;boat;silver;goblet;wine	glad;full	go;see;come;pretend;be;spring;run;meet;hold;drink	So they both went down to the edge of the water, and when Queen Silver-Tree saw her step-daughter coming she pretended to be very glad, and sprang out of the boat and ran to meet her, and held out a silver goblet full of wine for her to drink.
303	PERSON	Gold-Tree	princess;hand;cup;princess;step-mother	gentle;courteous;other	be;have;stretch;have;step	Princess Gold-Tree, who was ever gentle and courteous, would have stretched out her hand for the cup, had not the Other Princess stepped between her and her step-mother.
308	PERSON	Gold-Tree	princess;husband;friend;remainder;life		live	As for Princess Gold-Tree, she lived happily and peacefully with her husband and her friend for the remainder of her life.
312	LOCATION	Kittlerumpit	story;widow;woman;house;whereabouts;house;nobody	poor;young	be;go;tell;live;call;stand;know	I am going to tell you a story about a poor young widow woman, who lived in a house called Kittlerumpit, though whereabouts in Scotland the house of Kittlerumpit stood nobody knows.
312	LOCATION	Scotland	story;widow;woman;house;whereabouts;house;nobody	poor;young	be;go;tell;live;call;stand;know	I am going to tell you a story about a poor young widow woman, who lived in a house called Kittlerumpit, though whereabouts in Scotland the house of Kittlerumpit stood nobody knows.
312	PERSON	Kittlerumpit	story;widow;woman;house;whereabouts;house;nobody	poor;young	be;go;tell;live;call;stand;know	I am going to tell you a story about a poor young widow woman, who lived in a house called Kittlerumpit, though whereabouts in Scotland the house of Kittlerumpit stood nobody knows.
313	LOCATION	Kittlerumpit	mistress		be;widow;be;be;pity	Be that as it may, the widowed Mistress of Kittlerumpit was sorely to be pitied.
323	PERSON	Kittlerumpit	house;hillside;fir;wood;ground;front	great	explain;stand;slope	Now I must explain to you that the house of Kittlerumpit stood on a hillside, with a great fir wood behind it, and the ground sloping down steeply in front.
327	LOCATION	Kittlerumpit	madam;voice;house;mistress;woman;world	unfortunate	say;sob;bid;welcome;find	"Madam," she said, with a sob in her voice, "I bid you welcome to the house of Kittlerumpit, although you find its Mistress one of the most unfortunate women in the world."
334	PERSON	Haly	water			Haly water."
337	LOCATION	Kittlerumpit	woman;mistress;rent;relief;gratitude;hem;lady;s;gown	joyful;safe;strange;green	be;see;do;feel;be;have;kiss;have;allow	u"A joyful woman was the Mistress of Kittlerumpit when she saw it do this, for she felt that her rent was safe; and in her relief and gratitude she would have kissed the hem of the strange Lady"s green gown, if she would have allowed it, but she would not."
354	PERSON	Kittlerumpit	fairy;notice;voice;wife;reason;bairn	harsh;merciless;good	take;come;say;ken;come;give	The Fairy took no notice of this, however, but came close up to her, and said, in her harsh, merciless voice, "Good wife of Kittlerumpit, ye ken the reason of my coming; give me the bairn."
360	PERSON	Kittlerumpit	mistress;beauty;knowledge;something;fairy;s;tone;feel	young;angry	know;be;have;vex;make;contain	u"Now the young Mistress of Kittlerumpit knew that she was no beauty, and the knowledge had never vexed her; but something in the Fairy"s tone made her feel so angry that she could contain herself no longer."
378	LOCATION	Ireland	red-etin			"The Red-Etin of Ireland
379	LOCATION	Ballygan	ance		live	Ance lived in Ballygan,
380	PERSON	Malcolm	u;king;s;daughter		steal	u" And stole King Malcolm"s daughter,"
381	LOCATION	Scotland	king	fair		The King of fair Scotland.
386	PERSON	Julian				Like Julian the Roman,
397	LOCATION	Ireland	red-etin			"The Red-Etin of Ireland
398	LOCATION	Ballygan	ance		live	Ance lived in Ballygan,
399	PERSON	Malcolm	u;king;s;daughter		steal	u" And stole King Malcolm"s daughter,"
400	LOCATION	Scotland	king	fair		The King of fair Scotland.
405	PERSON	Julian				Like Julian the Roman,
416	LOCATION	Ireland	red-etin			"The Red-Etin of Ireland
417	LOCATION	Ballygan	ance		live	Ance lived in Ballygan,
418	PERSON	Malcolm	u;king;s;daughter		steal	u" And stole King Malcolm"s daughter,"
419	LOCATION	Scotland	king	fair		The King of fair Scotland.
424	PERSON	Julian				Like Julian the Roman,
451	LOCATION	Ireland	question;whether		be;be;inhabit	The first of these three questions was, "Whether Ireland or Scotland was first inhabited?"
451	LOCATION	Scotland	question;whether		be;be;inhabit	The first of these three questions was, "Whether Ireland or Scotland was first inhabited?"
452	PERSON	Adam	world	old	be;be;make	The second, "How old was the world when Adam was made?"
459	PERSON	Red-Etin	beast;terror;shelter;castle;woman;question;pillar;stone	same;fierce;old	encounter;run;take;hide;find;answer;be;turn	And he also encountered the same fierce beasts, and ran from them in terror, and took shelter from them in the Castle; and the old woman hid him, and the Red-Etin found him, and, because he could not answer the three questions, he, too, was turned into a pillar of stone."
474	LOCATION	Ireland	red-etin			"The Red-Etin of Ireland
475	LOCATION	Ballygan	ance		live	Ance lived in Ballygan,
476	PERSON	Malcolm	u;king;s;daughter		steal	u" And stole King Malcolm"s daughter,"
477	LOCATION	Scotland	king	fair		The King of fair Scotland.
482	PERSON	Julian				Like Julian the Roman,
504	PERSON	Malcolm	enemy;man;woman;shepherd;swineherd;goatherd;king;s;daughter;prisoner;castle	dead;young;old;true	see;be;ask;have;tell;be;be	u"As soon as he saw that his enemy was really dead, the young man asked the old woman if what the shepherd, and the swineherd, and the goatherd had told him were true, and if King Malcolm"s daughter were really a prisoner in the Castle."
509	PERSON	Malcolm	rest;other;reverence;royal;princess;king;s;daughter	beautiful;stately;such;great;clear	be;be;bow;treat;be;see;be	u"Among them was one who was more beautiful and stately than the rest, and all the others bowed down to her and treated her with such great reverence that it was clear to see that she was the Royal Princess, King Malcolm"s daughter."
523	PERSON	Roane	seal;other;country;people;seal;mermen;country;ocean;order;water;air;earth	larger;own;strange;ours	be;use;call;whisper;be;come;assume;disguise;pass;come;breathe	Some of those seals were larger than others, and the country people used to call them "Roane," and whisper that they were not seals at all, but Mermen and Merwomen, who came from a country of their own, far down under the ocean, who assumed this strange disguise in order that they might pass through the water, and come up to breathe the air of this earth of ours.
523	PERSON	Merwomen	seal;other;country;people;seal;mermen;country;ocean;order;water;air;earth	larger;own;strange;ours	be;use;call;whisper;be;come;assume;disguise;pass;come;breathe	Some of those seals were larger than others, and the country people used to call them "Roane," and whisper that they were not seals at all, but Mermen and Merwomen, who came from a country of their own, far down under the ocean, who assumed this strange disguise in order that they might pass through the water, and come up to breathe the air of this earth of ours.
554	PERSON	Merman	bed;hurt;touch;hand;magic;wound;scar;seal	old	go;stoop;wound;wash;dress;appear;work;have;finish;seem;deaden;die;leave;spring	He went over to the bed, and, stooping over the wounded Merman, washed and dressed the hurt as well as he could; and the touch of his hands appeared to work like magic, for no sooner had he finished than the wound seemed to deaden and die, leaving only the scar, and the old seal sprang up, as well as ever.
573	PERSON	Earl	fellow;duty;everybody;knee;butler;errand	good-natured;little;great;fat;old	be;do;like;serve;bend;run	He was a very good-natured little fellow, and did his duties so willingly and well that everybody liked him, from the great Earl whom he served every day on bended knee, to the fat old butler whose errands he ran.
607	PERSON	Queen	daughter;ado	poor;such;evil;much	widow;be;have;fall;have;get;eat	And this widowed Queen was so poor, and had fallen upon such evil days, that she and her daughters had often much ado to get enough to eat.
615	PERSON	Prince	palace;story	great;wealthy;outside	hear;tell;draw;marry;be	u"And I"ve heard tell that they drew her to the Palace of a great and wealthy Prince, who married her; but that is outside my story."
647	PERSON	Glen	move;evil;spirit;power	much	have	For, if thou but so much as move, then the Evil Spirit of the Glen will have thee in his power."
653	LOCATION	Norroway	moment;spell;eye;prince;evil;spirit;spell;likeness;bull;haste;glen;form;maiden;bride	mystic;invisible;great;black;rightful	fall;cause;become;have;vanquish;be;loose;have;lie;have;transform;return;love;hope;win	In a moment a mystic spell fell upon her, which caused her to become invisible to the eyes of the Prince of Norroway, who, having vanquished the Evil Spirit, was loosed from the spell which had lain over him, and had transformed him into the likeness of a great Black Bull, and who returned in haste down the glen to present himself, in his rightful form, to the maiden whom he loved, and whom he hoped to win for his bride.
668	LOCATION	Norroway	washerwoman;face;condition;mantle;knight;fight	old;ugly;sly;evil;white;black;deadly	be;say;be;try;wash;have;bring;wash;have;get;stain	The washerwoman, who was old and ugly, with a sly and evil face, said that she might--on one condition--and that was that she should try to wash a white mantle that the Black Knight of Norroway had brought to her to wash, as he had got it stained in a deadly fight.
669	PERSON	Prince		loth;great;powerful	be;disappoint;be;exceed	For I am loth to disappoint the Black Knight of Norroway, who is an exceeding great and powerful Prince."
673	PERSON	Knight	course;woman;link;maiden;mantle;spite;labour;daughter	old;delighted;suspicious;mysterious;clean	be;be;appear;be;become;wash;have;remain;soil;stain;have;bestow	Of course, the old woman was delighted, but she was very suspicious also, for it appeared to her that there must be some mysterious link between the maiden and the Knight, if his mantle became clean so easily when she washed it, when it had remained soiled and stained in spite of all the labour which she and her daughter had bestowed upon it.
675	PERSON	Glen	man;mantle;encounter;evil;spirit;someone	young	know;have;carry;try;find;wash;succeed	Now you must know that the young man had carried about this mantle with him for the last seven years--ever since his encounter with the Evil Spirit of the Glen--always trying to find someone who could wash it for him, and never succeeding.
684	PERSON	Black Knight	desire	great	let;watch;sleep;have;have;see	"And let me watch beside the Black Knight as he sleeps this night, for I have long had a great desire to see him."
694	PERSON	Black Prince	thing;woman;wedding;s;bedside	only;old	seem;do;carry;bribe;put;allow;watch	u"So, as it seemed the only thing to do, she carried them to the old woman, and bribed her to put the wedding off for yet another day, and allow her to watch that night also by the Black Prince"s bedside."
702	PERSON	Prince	stone	young;deaf;motionless	watch;remain	for the young Prince whom she watched so tenderly, remained deaf and motionless as a stone.
739	PERSON	Dinna	head;man;grip;woman;grip		bother;say	"Dinna bother your head about that, Tibby," said her man, "but grip it, my woman, grip it."
739	PERSON	Tibby	head;man;grip;woman;grip		bother;say	"Dinna bother your head about that, Tibby," said her man, "but grip it, my woman, grip it."
754	PERSON	Janet	husband;heckle		cry;think;have;hit;throw	cried Janet contemptuously, for she thought that her husband might easily have hit it, and she threw her heckle at it.
761	PERSON	Jock	corner;chair;hurry;wee;bannock;door	dark	run;trip;fall;jump;fly;laugh	So Jock ran into the dark corner behind the chair; but, in his hurry, he tripped and fell, and the wee bannock jumped over him and flew laughing out at the door.
768	PERSON	Goodman	goodwife;cinder;fire	half;undressed	be;be;rake	The Goodman was half undressed, and the Goodwife was raking the cinders carefully out of the fire.
783	PERSON	Earl St. Clair	region;earl;friend;need	same;young;such	live;be;ride;hunt;fight;be	Now in that same region lived two young earls, Earl St. Clair and Earl Gregory, who were such friends that they rode, and hunted, and fought together, if need be.
783	PERSON	Earl Gregory	region;earl;friend;need	same;young;such	live;be;ride;hunt;fight;be	Now in that same region lived two young earls, Earl St. Clair and Earl Gregory, who were such friends that they rode, and hunted, and fought together, if need be.
784	PERSON	Earl Gregory	chase;a-hunting;moor;spite;elfin;king	fond	be;suggest;go;haunt	And as they were both very fond of the chase, Earl Gregory suggested one day that they should go a-hunting on the haunted moor, in spite of the Elfin King.
789	PERSON	Earl St. Clair	companion;s;word;mother;lad;knee;whoso;sign;trinity;need;spell;witch;elf;demon	little;blessed	do;heed;remember;have;tell;be;carry;fear;be;throw	u"But Earl St. Clair did not heed his companion"s words, for he remembered how his mother had told him, when he was a little lad at her knee that whoso carried the Sign of the Blessed Trinity need never fear any spell that might be thrown over him by Warlock or Witch, Elf or Demon."
789	PERSON	Warlock	companion;s;word;mother;lad;knee;whoso;sign;trinity;need;spell;witch;elf;demon	little;blessed	do;heed;remember;have;tell;be;carry;fear;be;throw	u"But Earl St. Clair did not heed his companion"s words, for he remembered how his mother had told him, when he was a little lad at her knee that whoso carried the Sign of the Blessed Trinity need never fear any spell that might be thrown over him by Warlock or Witch, Elf or Demon."
790	PERSON	Earl Gregory	meadow;leaf;clover;arm;scarf;horse;moorland	silken;desolate;lonely	go;pluck;bind;mount;ride	So he went out to the meadow and plucked a leaf of clover, which he bound on his arm with a silken scarf; then he mounted his horse and rode with Earl Gregory to the desolate and lonely moorland.
796	PERSON	Earl St. Clair	word;horse;direction;stranger;moorland;finger;sign;lip;prayer;protection	mysterious;sacred	put;spur;gallop;have;take;leave;touch;tremble;mutter	And without another word he put spurs to his horse and galloped off in the direction which the mysterious stranger had taken, leaving Earl St. Clair alone upon the moorland, his fingers touching the sacred Sign and his trembling lips muttering prayers for protection.
798	PERSON	Earl Gregory	wake;knight;moor;moss;region;life;wind;snow-field;grass;foot	green;desolate;cold;hoar-frost;lay;thick;white;withered	ride;follow;burn;come;have;be;blow	Meanwhile Earl Gregory rode on and on, ever following in the wake of the Knight in green, over moor, and burn, and moss, till he came to the most desolate region that he had ever been in in his life; where the wind blew cold, as if from snow-fields, and where the hoar-frost lay thick and white on the withered grass at his feet.
800	PERSON	Earl Gregory	singing;arm;head;ground;world;halt;horse;ring;finger	weird;mad;skinny	be;shout;dance;wave;throw;have;go;see;beckon	These weird Goblins were shouting and singing as they danced, and waving their arms above their heads, and throwing themselves about on the ground, for all the world as if they had gone mad; and when they saw Earl Gregory halt on his horse just outside the Ring they beckoned to him with their skinny fingers.
802	PERSON	Earl	spell;spite;fear;summons;bridle;horse;s;neck	strange;young;powerful;eldrich	seem;have;be;cast;be;feel;obey;throw;prepare;join	u"And, strange as it may seem, the spell that had been cast over the young Earl was so powerful that, in spite of his fear, he felt that he must obey the eldrich summons, and he threw his bridle on his horse"s neck and prepared to join them."
803	PERSON	Goblin	companion	old;grizzled	step;approach	But just then an old and grizzled Goblin stepped out from among his companions and approached him.
810	PERSON	Gregory	cup;heather;ale;brim;knight;sir;table;bow;sir	stately;thirsty	be;fill;foam;see;lift;hand;be;drink	And this cup was filled with heather ale, which foamed up over the brim; and when the Knight saw Sir Gregory, he lifted it from the table, and handed it to him with a stately bow, and Sir Gregory, being very thirsty, drank.
810	PERSON	Gregory	cup;heather;ale;brim;knight;sir;table;bow;sir	stately;thirsty	be;fill;foam;see;lift;hand;be;drink	And this cup was filled with heather ale, which foamed up over the brim; and when the Knight saw Sir Gregory, he lifted it from the table, and handed it to him with a stately bow, and Sir Gregory, being very thirsty, drank.
816	PERSON	Earl St. Clair	holy;sign	true;fearless;strong	dread;be;be;brave;approach;bear	And what they dreaded was true; for it was the brave Earl St. Clair who approached, fearless and strong because of the Holy Sign he bore.
817	PERSON	Goblin	ring;dancer;border	charmed;eldrich;magic;little;grizzled	see;be;step;have;whisper;come;whisper	And as soon as he saw the charmed Ring and the eldrich dancers, he was about to step over its magic border, when the little grizzled Goblin who had whispered to Earl Gregory, came and whispered to him also.
817	PERSON	Earl Gregory	ring;dancer;border	charmed;eldrich;magic;little;grizzled	see;be;step;have;whisper;come;whisper	And as soon as he saw the charmed Ring and the eldrich dancers, he was about to step over its magic border, when the little grizzled Goblin who had whispered to Earl Gregory, came and whispered to him also.
827	PERSON	Earl St. Clair	grisly;goblin;companion;standing;outskirts;ring	charmed	say;step;leave	So saying the Grisly Goblin stepped back among his companions, leaving Earl St. Clair standing alone on the outskirts of the charmed Ring.
830	PERSON	Earl St. Clair	power;sign;arm;unhurt	blessed	go	But through the power of the Blessed Sign on his arm Earl St. Clair went on unhurt.
832	PERSON	Earl Gregory	marble;table;hair;head;sight;elfin;king;follower;front;form;fate	stiff;stark;same	approach;rise;sit;lay;have;share	And as he approached the marble table the very hairs rose on his head at the sight of the Elfin King sitting behind it, stiff and stark like his followers; while in front of him lay the form of Earl Gregory, who had shared the same fate.
834	PERSON	Earl St. Clair	power;holy;sign;quest	foiled	restrain;have;be	But the Power of the Holy Sign restrained them, else had Earl St. Clair been foiled in his quest.
836	PERSON	Matin Bell	danger;sound;air;ground;goblet	solid;enchanted	carry;be;die;step;fling	And it carried him safely through all the dangers; and just as the sound of the Matin Bell was dying away in the morning air he stepped on to solid ground once more, and flung the enchanted goblet from him.
838	PERSON	Earl St. Clair	arm;sens;blood;vein;friend;spot;goblet;nothing;piece;whinstone;drop;dew;crevice;side	warm;wondrous;rough;grey;little	have;run;have;hold;return;course;return;have;throw;find;hide;be;hollow	And when, after Earl St. Clair had run to him and had held him in his arms till his senses returned and the warm blood coursed through his veins, the two friends returned to the spot where Earl St. Clair had thrown down the wondrous goblet, they found nothing but a piece of rough grey whinstone, with a drop of dew hidden in a little crevice which was hollowed in its side.
838	PERSON	Earl St. Clair	arm;sens;blood;vein;friend;spot;goblet;nothing;piece;whinstone;drop;dew;crevice;side	warm;wondrous;rough;grey;little	have;run;have;hold;return;course;return;have;throw;find;hide;be;hollow	And when, after Earl St. Clair had run to him and had held him in his arms till his senses returned and the warm blood coursed through his veins, the two friends returned to the spot where Earl St. Clair had thrown down the wondrous goblet, they found nothing but a piece of rough grey whinstone, with a drop of dew hidden in a little crevice which was hollowed in its side.
862	PERSON	Maisie	mother;s;companion;husband	rich	see;be;be;get;sigh;say	So when her mother saw one after another of Maisie"s companions, who were not nearly so pretty as she was, getting rich husbands, she sighed and said:"
863	PERSON	Maisie			laugh	But Maisie only laughed.
865	PERSON	Maisie	girl;wish;nunnery;sunshine;distaff	idle	be;have;be;shut;try;think;sit	Now, though Maisie was an idle girl, she had no wish to be shut up in a nunnery; so she tried not to think of the sunshine outside, but sat down soberly with her distaff.
868	PERSON	Maisie	dell;flower		love;grow	Maisie loved this dell, the flowers grew so abundantly there.
869	PERSON	Maisie	primrose;violet;grass;water;wagtail;stone;middle;stream	sweet-scented;little	peep;come;perch;bob;seem;be;nod;be;try;say;mind;cheer	The primroses and sweet-scented violets peeped out from among the grass, and a little water wagtail came and perched on a stone in the middle of the stream, and bobbed up and down, till it seemed as if he were nodding to Maisie, and as if he were trying to say to her, "Never mind, cheer up."
875	PERSON	Maisie	hole	funny	know;have;sit;wonder;come;be	Maisie knew it well; she had often sat upon it, and wondered how the funny hole came to be there.
876	PERSON	Maisie	silver;hair;mutch;frill;head;girl;skirt;knee	white;big;little;short	have;be;wear;have;take;wear;reach	Indeed, had it not been for her silver hair, and the white mutch with the big frill that she wore on her head, Maisie would have taken her for a little girl, she wore such a very short skirt, only reaching down to her knees.
878	PERSON	Maisie	time;silence;question	long	stand;look;repeat	Maisie stood and looked at her for such a long time in silence that she repeated her question.
880	PERSON	Maisie	mother;gentleman		answer;say;look;spin	"Oh, no," answered Maisie, "my mother says no gentleman would look at me because I cannot spin."
884	PERSON	Maisie	offer;friend;run;home;lint;bidding	good;true;new	think;be;be;bid;fetch;tell;require	Maisie thought that this offer was too good to be true; but her new friend bade her run home and fetch the lint; and I need not tell you that she required no second bidding.
892	PERSON	Habetrot	ho;ho;wench;name	little;little	know;be	"Ho, ho, my pretty little wench little knows that my name is Habetrot."
896	PERSON	Slantlie Mab	habetrot;name;haste;thread;time;girl;home;mother	young	seem;be;call;hear;address;tell;make;tie;be;get;be;have;carry	She seemed to be called Slantlie Mab, for Maisie heard Habetrot address her by that name, telling her to make haste and tie up all the thread, for it was getting late, and it was time that the young girl had it to carry home to her mother.
